id,firstname,lastname,faction,position,date, url,speech
"1056379","Anja","Karliczek","not found","Minister","2021-03-04T00:00:00.000Z","https://dip21.bundestag.de/dip21/btp/19/19215.pdf","\n\nLiebe Frau Präsidentin! Liebe Kolleginnen und Kollegen! Bildung ist in diesen Tagen in aller Munde; und das ist auch gut so. Denn mit einem Spot auf die Schwierigkeiten des Bildungssystems, die Corona so gnadenlos offengelegt hat, gibt es auch die Hoffnung, dass wir mit vereinten Kräften für Fortschritt sorgen.\n\n({0})\n\nUnd ich will es hier und heute ganz deutlich sagen: Die Digitalisierung des Bildungssystems bietet Chancen für jeden und jede.\n\nSeit Beginn der Legislaturperiode haben wir viele Projekte in Gang gesetzt, gerade auch in der digitalen Bildung. Und ja, es hat eine Weile gebraucht, bis der DigitalPakt ins Laufen gekommen ist.\n\n({1})\n\nInzwischen arbeitet die große Mehrheit der Schulen mit digitalen Lern- und Arbeitsplattformen, und digitale Tools werden immer selbstverständlicher.\n\n({2})\n\nUnd nein, natürlich ist noch nicht alles perfekt; denn digitale Bildung ist eben nicht nur das Nutzen von Technik. Im Gegenteil: Es geht um Lernen, angepasst an die Bedürfnisse unserer Kinder, es geht um Lehren, wie es den Lehrerinnen und Lehrern entspricht. Das wird eine Aufgabe sein, die Bund, Länder und Kommunen in Arbeitsteilung noch länger fordert. Aber das Geld aus dem DigitalPakt kommt an:\n\n({3})\n\nDie jüngsten Berichte aus allen Ländern zeigen zunehmende Fortschritte bei der Umsetzung, die finanziellen Abflüsse nehmen zu.\n\n({4})\n\nNatürlich stellt mich der aktuelle Zustand nicht zufrieden, und natürlich hätten wir uns schnellere Umsetzung gewünscht.\n\n({5})\n\nAber mein Blick nach vorn ist positiv. Überall herrscht Aufbruchsstimmung.\n\n({6})\n\nUnd deshalb, liebe Opposition, ist es besser, wenn Sie nun nicht wieder einen falschen Anschein erwecken, sondern ehrlich anerkennen, dass vieles passiert ist.\n\n({7})\n\nWo stünden wir denn wohl heute, wenn der Bund den DigitalPakt nicht so entschieden auf den Weg gebracht hätte?\n\n({8})\n\nAllein für den DigitalPakt stellen wir inzwischen 6,5 Milliarden Euro bereit. Wir bezahlen Schülerlaptops, wenn Schüler keine eigenen Geräte haben. Wir bezahlen Laptops für Lehrerinnen und Lehrer.\n\n({9})\n\nWir bezahlen den Aufbau professioneller Administratorenstrukturen in den Ländern. Alles übrigens Aufgaben der Länder und Kommunen – wo auch Sie Verantwortung tragen –, bei denen wir sie finanziell unterstützen.\n\n({10})\n\nWas uns in diesen Tagen aber auch umtreibt, ist die Frage, wie wir den Kindern helfen können, verpasste Bildungschancen nachzuholen.\n\n({11})\n\nUnd dabei geht es mir nicht nur um Lernrückstände; denn geschlossene Schulen sind auch verpasste Chancen in der Persönlichkeitsentwicklung.\n\n({12})\n\nUnd Schulleitungen berichten mir, dass Teamwork und Rücksichtnahme mittlerweile neu erlernt werden müssen – manchmal habe ich auch hier im Hohen Haus den gleichen Eindruck.\n\nAls erste Maßnahme haben wir den Ländern unsere Unterstützung für Osterferien- und Sommerferienprogramme angeboten.\n\n({13})\n\nAber Kinder mit größeren Lernrückständen brauchen umfangreichere Unterstützung.\n\n({14})\n\nDazu brauchen wir Klarheit, wie groß die Lernrückstände tatsächlich sind, und dann können wir gemeinsam mit der KMK\n\n({15})\n\naktiv werden.\n\nDoch zurück zum aktuellen Bildungsbericht. Ja, es gibt noch viel zu tun.\n\n({16})\n\nDer Bericht ist ein Gradmesser, wo wir in der Bildung in Deutschland stehen. Und weil er den Schwerpunkt auf die digitale Bildung legt, ist er höchst aktuell. Und er ist Ansporn für alle, sich für Bildung weiterhin zu engagieren.\n\n({17})\n\nUnd er ist weiß Gott kein Grund, schwarzzumalen.\n\n({18})\n\nDenn der Bildungsbericht dokumentiert eine ganze Reihe sehr erfreulicher Entwicklungen: Die Bildungsbeteiligung nimmt zu, der Bildungsstand hat sich verbessert, die Bildungsausgaben steigen kontinuierlich, Bildungswege werden flexibler.\n\nFlexibilität – ein magisches Wort für die Zukunft der Bildung.\n\n({19})\n\nDenn jeder wird in Zukunft berufliche und theoretische Elemente in seine Aus- und Weiterbildung hineinbringen. Wir werden immer wieder im Laufe unseres Lebens modular lernen. Deshalb möchte ich gerne für den Sommer Praktika in Betrieben unterstützen. Denn das hilft Betrieben und Jugendlichen gleichermaßen, und wir wissen, dass das Matching die große Herausforderung bleibt; und da bieten Praktika beste Chancen.\n\n({20})\n\nIch möchte, dass in diesem Sommer für die nächsten Jahre möglichst viele Ausbildungsverträge abgeschlossen werden können. Denn unsere Berufsausbildung ist stark, modern und attraktiv. Wir werden nicht umsonst weltweit darum beneidet.\n\n({21})\n\nWir befinden uns mitten in einem technologischen Sprung. Die duale Bildung ist ein tolles Instrument in diesem Wandel, weil sie Wurzeln und Flügel verleiht: Wurzeln für ein stabiles Fundament der eigenen beruflichen Zukunft und Flügel, weil die Aufstiegschancen in der dualen Bildung noch nie so groß waren wie heute.\n\n({22})\n\nLiebe Kolleginnen und Kollegen, die digitale Bildung ist jetzt überall im Alltag angekommen – in der dualen und in der schulischen Bildung,\n\n({23})\n\nin der Hochschulbildung und in der Weiterbildung. Das ist der Grund, warum ich mit der Bundeskanzlerin die digitale Bildungsinitiative ins Leben gerufen habe.\n\n({24})\n\nZiel ist, einen nationalen digitalen Bildungsraum zu entwickeln, damit Bildung für die Menschen in unserem Land bedeutet: sicher navigieren in der digitalen Welt.\n\n({25})\n\nViele Schritte haben wir angepackt. Aber wir kommen in der Zusammenarbeit zwischen Bund, Länder und Kommunen an unsere Grenzen.\n\n({26})\n\nIn jedem Gespräch sagen mir Schulleiter, dass das Geld bei ihnen zu langsam ankommt. Wir brauchen kürzere Drähte und schnellere Koordination.\n\n({27})\n\nDie Pandemie wirkt wie ein Brennglas. Wir haben gesehen, dass wir in vielen Bereichen nicht wirklich gut aufgestellt waren. Doch in den vergangenen Monaten sind viele Weichen gestellt worden.\n\n({28})\n\nDeshalb möchte ich hier und jetzt auch die Gelegenheit nutzen, allen zu danken, die diese schwere Zeit mit uns gemeinsam durchstehen. Mein Dank geht an Lehrerinnen und Lehrer, an Schülerinnen und Schüler, an Eltern, aber ganz genauso – und das will ich hier auch deutlich sagen, weil wir oft über Schule, aber selten über Hochschule reden – an alle Studierenden und Hochschullehrenden, aber natürlich auch an alle Auszubildenden und Ausbilder in den Betrieben.\n\n({29})\n\nWir wissen, was die Pandemie ihnen in den letzten Monaten zugemutet hat, und wir wissen auch, dass wir alle miteinander langsam an Grenzen stoßen.\n\nDie Pandemie ist für uns alle eine Geduldsprobe.\n\n({30})\n\nUnd wo es auf der einen Seite so schwer ist, gibt es auf der anderen Seite eine Aufbruchsstimmung: Es geht ein Ruck durch das Bildungsland Deutschland.\n\n({31})\n\nVon vielen im Bildungssystem höre ich in diesen Tagen: Jetzt erst recht. -Gemeinsam werden wir Bildung in Deutschland wieder erstklassig machen.\n\n({32})\n\nGute Bildung ist nicht nur für jeden Einzelnen und die Gesellschaft wichtig, sondern soll auch Freude machen – ein Leben lang. Denn in der Bildung ist „lebenslang“ ein Versprechen für immer wieder neue Chancen, für persönliche Weiterentwicklung, für das permanente Entdecken neuer Lebenswelten.\n\n({33})\n\nDas Bildungsland Deutschland und das Innovationsland Deutschland gehen Hand in Hand\n\n({34})\n\nin eine wettbewerbsfähige Zukunft, eine am Menschen ausgerichtete Zukunft,\n\n({35})\n\neine Zukunft, in der Kreativität und Empathie der Kern eines neuen Bildungsversprechens sind.\n\n({36})"
"1057942","Anja","Karliczek","not found","Minister","2021-04-13T00:00:00.000Z","https://dip21.bundestag.de/dip21/btp/19/19220.pdf","\n\nSehr geehrter Herr Präsident! Liebe Kolleginnen und Kollegen! Bildung und Forschung genießen hier im Parlament, aber auch in der Bundesregierung höchste Priorität. Deswegen haben wir in dieser Legislaturperiode auf der einen Seite strukturelle Veränderungen initiiert und gleichzeitig so viel noch nie in Bildung und Forschung investiert. Mit mittlerweile 20,8 Milliarden Euro fördern wir Maßnahmen und Programme zur Stärkung der Wettbewerbsfähigkeit und der Zukunftsfähigkeit unseres Innovationslandes Deutschland.\n\nLassen Sie mich einige Beispiele herausgreifen. Der erste in Europa zugelassene gegen das Coronavirus wirksame Impfstoff ist von BioNTech in Mainz entwickelt worden, ein Unternehmen, das das BMBF schon in der Gründungsphase gefördert hat. Dass kein anderes Land außer den USA in diesem Bereich so viel investiert, zeigt, wie viel Wert wir auf die Zukunft legen und auch auf die Entwicklung eines eigenen Coronaimpfstoffes gelegt haben.\n\nAuch beim Grünen Wasserstoff haben wir das Potenzial früh erkannt, und wir treiben mit unserer Förderung die Technologieentwicklung voran, damit Deutschland Ausrüster der Welt für Grünen Wasserstoff werden kann. Im Konjunkturpaket haben wir deshalb auch einen ganz klaren Schwerpunkt auf Zukunftstechnologien gesetzt, zum Beispiel auf künstliche Intelligenz, Quanten- und Kommunikationstechnologien, aber eben auch auf die Batterieforschung.\n\nWir haben die Attraktivität von Ausbildung und Studium gestärkt: hin zu mehr Vergleichbarkeit und Verzahnung und mit einem ganz starken Fokus auf das lebenslange Lernen.\n\nWir erleben, dass sich die Strukturen von akademischer und beruflicher Ausbildung in der Transformationsgesellschaft stetig weiterentwickeln. Daher müssen wir in der Bildungsfinanzierung natürlich immer wieder entsprechend nachjustieren.\n\nWir haben in dieser Legislaturperiode die Wissenschaftspakte verstetigt. Dafür investieren Bund und Länder über die nächsten zehn Jahre 160 Milliarden Euro. So viel Freiheit und so viel Sicherheit auf der einen Seite für außeruniversitäre Forschung und auf der anderen Seite für die Hochschulen hat es noch nie gegeben.\n\nDie Hochschulen sind natürlich genauso von der Schließung betroffen wie die Schulen. Allerdings ist die Digitalisierung der Lehre in den Hochschulen viel weiter fortgeschritten als in den Schulen. Deswegen lief von Beginn an in den Hochschulen einiges besser bei der digitalen Lehre als in den Schulen. Auch das war ein Grund, warum wir schon vor der Krise die Digitalisierung der Schulen mit dem DigitalPakt Schule vorangetrieben haben. Mittlerweile, nachdem wir ja jetzt in der Krise noch mal 1,5 Milliarden Euro draufgelegt haben, stellen wir den Ländern 6,5 Milliarden Euro dafür zur Verfügung, die Digitalisierung in den Schulen voranzutreiben. Damit sich bei der Digitalisierung der Schulen, aber auch in den Hochschulen weiterhin spürbar etwas tut, setzen wir vor allem auf diese Pakte, wobei ich mir gerade beim DigitalPakt Schule natürlich ein höheres Tempo beim Ausgeben der Mittel wünschen würde.\n\nUm Schülerinnen und Schülern zu helfen, ihre pandemiebedingten Lernrückstände aufzuholen, erarbeiten wir aktuell mit den Ländern ein gemeinsames Nachhilfeprogramm. Deswegen ist es wichtig, dass die Länder jetzt Lernstände erheben; denn nur dann können sie gezielt nachsteuern.\n\nBei den Schulen unterstützen wir die Länder bis an die Grenzen des rechtlich Möglichen. Um aber die großen Herausforderungen insbesondere der digitalen Bildung meistern zu können, brauchen wir für die Zukunft neue engere Formen der Zusammenarbeit von Bund und Ländern, und zwar auf klar erweiterter Rechtsgrundlage.\n\nEin zweiter Punkt. Wir müssen wesentlich souveräner werden, und zwar technologisch. In Europa gilt es jetzt, technologisch souveräner und unabhängiger zu werden. Wir müssen in der Lage sein, Schlüsseltechnologien zu verstehen, sie selbst herzustellen und sie am Ende auch weiterzuentwickeln, weil wir nur so diese ganzen technologischen Entwicklungen im Sinne unserer Werte mitgestalten können. Genau deshalb werden wir auch in Zukunft in KI, Quantentechnologie, Kommunikationssysteme, Mikroelektronik und weitere Schlüsseltechnologien investieren.\n\nIn der Pandemie haben wir gesehen, wie groß die internationalen Abhängigkeiten auch in wichtigen Bereichen der öffentlichen Daseinsvorsorge sind. Deswegen ist es ein Ziel unseres Hauses, Deutschland wieder zur Apotheke der Welt zu machen. Dafür brauchen wir exzellente Forschungskapazitäten und exzellente agile Produktionsentwicklungen in Europa, auch jenseits aktueller Notwendigkeiten.\n\nLiebe Kolleginnen und Kollegen, in dieser Legislaturperiode sind viele Grundlagen für unsere technologische Entwicklung und auch für die Modernisierung der Bildung gelegt worden. Diesen Kurs wollen und werden wir fortsetzen – mutig, technologieoffen und mit einem ganz klaren Blick auf die Herausforderungen der Zukunft.\n\nHerzlichen Dank. Jetzt beantworte ich gerne Ihre Fragen.\n\n({0})"
"1057945","Anja","Karliczek","not found","Minister","2021-04-13T00:00:00.000Z","https://dip21.bundestag.de/dip21/btp/19/19220.pdf","\n\nHerzlichen Dank für die Frage. Das war jetzt viel. Es ist, glaube ich, nicht so einfach, dies in einer Minute zu beantworten. – In den Schulen geht es erst einmal darum, ein sicheres Arbeitsumfeld zu schaffen, also Konzepte zu entwickeln, die sicheres Lernen und Lehren in Verbindung mit Testen möglich machen. Aber wir haben auch beim Impfen die Priorisierung der Lehrkräfte im Grundschulbereich und der Erzieher im Kitabereich hochgesetzt, weil dort das Abstandhalten nicht so einfach ist. Deswegen wollen wir, dass die Lehrkräfte eher geimpft werden. Auch das trägt zur Sicherheit in den Schulen bei.\n\nDas Thema Luftfilter ist angesprochen worden. Es gibt sogenannte S3-Leitlinien, die einen Standard des sicheren Arbeitsumfeldes ermöglichen, die einen Standard von Therapien im medizinischen Bereich ermöglichen. Diese S3-Leitlinien sind ein Konzept, das man in den Schulen umsetzen kann und bei dem man sich die einzelnen Aspekte anschaut, von der Mobilität, also von dem Weg der Schüler zur Schule, bis hin zu Wechselunterricht oder den Lüftungsanlagen. Nur ein gesamtes Konzept kann eine echte Lösung geben.\n\nZum Thema Nachhilfe so viel – ich habe es gerade erwähnt –: Wir sind dabei, zusammen mit den Ländern ein Konzept zu erarbeiten. Wir wollen damit aber ganz bewusst erst in das neue Schuljahr gehen. Wir wollen in den Sommerferien und auch in der Zeit danach unter hoffentlich besseren, sicheren und einfacheren Bedingungen das Thema Nachhilfe aufrufen. Wir alle merken, dass es im Moment sehr, sehr anstrengend ist. Sie haben es gerade selber angesprochen: Die Müdigkeit der Familien, die Müdigkeit der Schülerinnen und Schüler und auch der Hochschüler ist nicht wegzudiskutieren. Deswegen sollten wir ihnen jetzt nicht noch zusätzliche Aufgaben geben, sondern im Herbst das Nachholprogramm starten und vielleicht über die Sommerferien mit dem Thema Persönlichkeitsentwicklung beginnen, um die Teamarbeit wieder zu stärken."
"1057948","Anja","Karliczek","not found","Minister","2021-04-13T00:00:00.000Z","https://dip21.bundestag.de/dip21/btp/19/19220.pdf","\n\nDie Milliarde ist daraus entstanden, dass man erst einmal gefragt hat: Welche Größenordnung braucht man überhaupt? Wir gehen davon aus, dass 20 bis 25 Prozent der Schülerinnen und Schüler betroffen sind und Unterstützung brauchen. Das wird aber Unterstützung in unterschiedlicher Form sein. Die Aufgabe, die Nachhilfe langfristig und auch in Gänze zu organisieren, ist eine Aufgabe der Länder; denn Schulen sind Aufgabe der Länder. Wir wollen die Länder unterstützen, wir wollen diesen Anschub geben, wir wollen auch die Lernstandserhebungen, weil damit ganz gezielt geholfen werden kann. Aber, ich glaube, es ist richtig, wenn wir die Verantwortung dann wieder in die Hände der Länder legen."
"1057951","Anja","Karliczek","not found","Minister","2021-04-13T00:00:00.000Z","https://dip21.bundestag.de/dip21/btp/19/19220.pdf","\n\nWir haben schon frühzeitig, auch schon im letzten Sommer, mit dem Programm „Kultur macht stark“ ganz gezielt Angebote aus unserem Haus gemacht, die dann durch Programme in den Ländern ergänzt wurden, um einen sogenannten Lernsommer zu ermöglichen. Ich habe ganz gezielt zusammen mit der Kollegin Karin Prien in Schleswig-Holstein einen Lernsommer Schleswig-Holstein auf den Weg gebracht, bei dem es ganz klar darum ging, sowohl die Persönlichkeitsentwicklung als auch die sozialen und emotionalen Aspekte in den Mittelpunkt zu stellen und nicht nur das Lernen. Natürlich muss es eine Kombination sein; denn gerade Jugendliche im heranwachsenden Alter entwickeln sich. Auch da ist bestimmt etwas auf der Strecke geblieben."
"1057956","Anja","Karliczek","not found","Minister","2021-04-13T00:00:00.000Z","https://dip21.bundestag.de/dip21/btp/19/19220.pdf","\n\nJa, aber eine Grundgesetzänderung hat besondere Vorschriften und hat auch besondere Zeiten, die man einkalkulieren muss, um sie von Anfang bis Ende durchsetzen zu können. Es geht uns im Bereich der digitalen Bildung darum, eine Gemeinschaftsaufgabe klein, aber fein zu definieren. Ich habe gestern zum Beispiel bei #innovationsland Deutschland ein sehr interessantes Gespräch mit einem Physiker gehabt, der sich im Bereich der Lichttechnologien bewegt. Er hat ein ganz tolles Video gezeigt. Die Möglichkeit, dieses Video inhaltlich in den Physikunterricht einzuspeisen, haben wir heute nicht, weil es um Inhalte geht und weil wir so etwas nicht zur Verfügung stellen dürfen. Da müssten wir erst langwierige Vereinbarungen mit den Ländern schließen. Genau an dieser Stelle wäre es, glaube ich, sinnvoll, wenn wir in Richtung Berufsorientierung eigene Möglichkeiten hätten, auch inhaltlich etwas zur Verfügung zu stellen.\n\n({0})"
"1057959","Anja","Karliczek","not found","Minister","2021-04-13T00:00:00.000Z","https://dip21.bundestag.de/dip21/btp/19/19220.pdf","\n\nIch bin seit Beginn der Pandemie mit meinen Wissenschaftsministerkollegen der Länder im direkten Austausch, weil wir uns natürlich immer kurzgeschlossen haben. Wir haben zum Beispiel auf diesem Weg besprochen: Wie geht es mit dem BAföG weiter? Wie geht es mit den finanziellen Sorgen weiter? Natürlich ist es jetzt im dritten Onlinesemester etwas anderes als im ersten. Ich habe ja gerade gesagt: Der Start der Onlinelehre an den Hochschulen war relativ gut, weil die Digitalisierung viel weiter war, weil sie viel mehr Möglichkeiten hatten. Es konnte über die ganze Zeit mehr als 75 Prozent der Lehre an den Hochschulen stattfinden. Auf der anderen Seite sind die Länder dazu übergegangen, nach dem ersten Komplett-Lockdown Bibliotheken wieder zu öffnen, auch wenn es natürlich eingeschränkte Öffnungen waren. Sie haben die Labornutzung entzerrt, haben Möglichkeiten geschaffen, Labortätigkeiten in kleineren Gruppen aufzunehmen. Auch Studienseminare finden jetzt unter der Möglichkeit des Testens schon wieder statt.\n\n({0})\n\nEs ist nicht so, dass in den Hochschulen alles geschlossen ist. Aber Sie haben natürlich recht: Viele Studierende sitzen zu Hause. Gerade die, die in den kleinen Studentenwohnungen sitzen, sind natürlich schon schwer betroffen, und darauf machen wir auch aufmerksam. Wir werden uns auch damit beschäftigen, wie wir gerade den Erstsemestern, die bisher noch nicht einmal die Möglichkeit hatten, die Hochschule kennenzulernen, ermöglichen, dies im Rahmen von Modellprojekten nachzuholen."
"1057962","Anja","Karliczek","not found","Minister","2021-04-13T00:00:00.000Z","https://dip21.bundestag.de/dip21/btp/19/19220.pdf","\n\nFür die Hochschulen gilt im Wesentlichen das, was wir mit dem Infektionsschutzgesetz jetzt festschreiben: dass wir bei bestimmten Inzidenzen Möglichkeiten schaffen können, über Testen gewisse Öffnungsschritte zu ermöglichen, und dass dann, wenn die Inzidenzen zu hoch gehen, wieder komplett geschlossen werden muss. Man muss sich über eines im Klaren sein: Hochschulen sind in der Regel keine kleinen Einheiten, sondern Einheiten, in denen mehrere Tausend bis hin zu mehreren Zehntausend Studentinnen und Studenten unterwegs sind. Deswegen ist es da natürlich ungleich schwerer, Konzepte zu erstellen, die dann größere Öffnungsschritte ermöglichen. Ich glaube, wir müssen so ehrlich sein, dass wir im Moment noch alle miteinander die Zähne zusammenbeißen müssen. Ich denke, dass wir einfach auch sehr aufmerksam sein müssen, wenn es darum geht, ob jemand sehr schwer damit klarkommt oder man jemanden vielleicht auch nicht mehr erreicht. Ich denke, zum Winter sieht die Situation anders aus und dass man da auch schon die Perspektive geben kann, dass im Wintersemester wieder viel mehr stattfindet."
"1057965","Anja","Karliczek","not found","Minister","2021-04-13T00:00:00.000Z","https://dip21.bundestag.de/dip21/btp/19/19220.pdf","\n\nEs ist eine sehr wahre Feststellung, dass wir im Grunde ein bisschen Glück gehabt haben mit der Entwicklung der mRNA-Technologie durch langjährige Unterstützung aus unserem Haus heraus. Wir unterstützen die Firma BioNTech seit ihrer Gründung im Jahr 2008 immer mal wieder, um eben den Fortschritt an dieser Stelle auch systematisch möglich zu machen, und das hat in diesem Fall geklappt.\n\nBei den Mutanten ist es so, dass innerhalb der Unternehmen jetzt darauf geschaut wird: Helfen die Impfstoffe, oder müssen wir neue entwickeln? Gerade durch die mRNA-Technologie ist es relativ einfach geworden, relativ schnell wirksame Impfstoffe gegen Mutationen zu entwickeln. Wir haben im internationalen Bereich ein europäisches Netzwerk für Studienzentren und auch den HERA-Inkubator, die ganz gezielt die Frage der Wirksamkeit der Impfstoffe gegen Mutanten in den Fokus stellen und da die Weiterentwicklung vorantreiben."
"1057968","Anja","Karliczek","not found","Minister","2021-04-13T00:00:00.000Z","https://dip21.bundestag.de/dip21/btp/19/19220.pdf","\n\nWas wir brauchen, ist das, was man in den USA unter dem Stichwort „BARDA“ gegründet hat, nämlich eine Förderagentur, die langfristig, bis zur Zulassung fördert. Wir haben ja bisher immer Grundlagenforschung gefördert und es dann ein Stück weit dem Markt überlassen, ob weitergefördert wird und es zur Zulassung kommt. Wir werden uns jetzt – die Diskussion führen wir gerade auf europäischer Ebene – sehr klar darauf fokussieren, dass wir eine eigene Förderagentur brauchen, die dieses sogenannte Tal des Todes aktiv überschreitet und auch die Entwicklung von Reserveantibiotika und Ähnlichem fördert; denn dafür gibt es keinen Markt. Wenn ich etwas nicht in den Markt bringen darf, das im Grunde der allgemeinen Gesundheit und auch dazu dient, sich auf mögliche Pandemien vorzubereiten oder zum Beispiel auch Resistenzen bei Antibiotika zu bekämpfen, dann muss der Staat da eintreten, dann ist das eine ganz wichtige Aufgabe, die wir zu erfüllen haben, weil das der Markt nicht kann."
"1057971","Anja","Karliczek","not found","Minister","2021-04-13T00:00:00.000Z","https://dip21.bundestag.de/dip21/btp/19/19220.pdf","\n\nDanke für die Nachfrage. – Impfstoffentwicklungen sind Hochrisikoprojekte, und daher muss man eben auch immer Rückschläge verkraften. Deswegen haben wir im letzten Sommer immer, wenn wir gefragt worden sind, wann wir denn mit einem Impfstoff rechnen, darauf hingewiesen: Wenn wir im Sommer des Jahres 2021 einen Impfstoff haben, sind wir richtig gut. Wir wussten, weil das Risiko eben relativ hoch ist, um die Gefahr, einen Rückschlag zu erleben und dann mit einer Studie von Neuem beginnen zu müssen.\n\nDeswegen haben wir für unser 750-Millionen-Euro-Programm ganz klare, eindeutige Meilensteine vorgegeben. Immer erst dann, wenn ein Meilenstein erreicht war, konnte der nächste Schritt der Entwicklung gemacht werden. Wir haben denen, die wir gefördert haben, niemals das ganze Geld auf einmal gegeben, sondern wir haben sie Schritt für Schritt eng begleitet. So haben wir eben für den Staat das Risiko beherrschbar gehalten."
"1057974","Anja","Karliczek","not found","Minister","2021-04-13T00:00:00.000Z","https://dip21.bundestag.de/dip21/btp/19/19220.pdf","\n\nWir haben in dieser Legislaturperiode eine BAföG-Reform vorgenommen. Wir haben insgesamt 1,3 Milliarden Euro zusätzlich in die Sozialleistung BAföG gesteckt. Ich glaube, wir können noch gar nicht abschließend beurteilen, wie diese Reform wirkt.\n\nAber eines muss man dazusagen: Das BAföG ist eine Sozialleistung, und vor der Krise war es einfach so, dass die Wirtschaft von Höchststand zu Höchsttand ging, die Beschäftigung sehr, sehr gut war und auch die Löhne gestiegen sind. Der Bezug von BAföG ist subsidiär, er tritt erst dann ein, wenn Eltern nicht leisten können, wenn Eltern ihre Kinder nicht bis zum Ende der ersten Ausbildung unterstützen können. Vor der Krise besaßen viele Eltern die Leistungsfähigkeit, ihre Kinder zu unterstützen.\n\nNichtsdestotrotz haben wir gesagt: Wir wollen die Trendumkehr. Wir wollen wieder mehr junge Leute erreichen. Wir wollen bis in die Mitte der Gesellschaft hinein fördern. – Deswegen haben wir die Reform auf den Weg gebracht mit drei Stufen. Die dritte Stufe tritt jetzt im Herbst in Kraft. Wir werden im Juli die ersten Daten bekommen für die ersten beiden Jahre, und dann werden wir weitersehen. Wenn es so noch nicht geklappt hat, können wir in der nächsten Legislaturperiode da wieder ansetzen."
