id,firstname,lastname,faction,position,date, url,speech
"1018531","Anja","Karliczek","not found","Minister","2019-01-30T00:00:00.000Z","https://dip21.bundestag.de/dip21/btp/19/19076.pdf","\n\nSehr geehrter Herr Bundestagspräsident! Liebe Kolleginnen und Kollegen! Meine sehr geehrten Damen und Herren! Bildung brauchen wir wie die Luft zum Atmen. Nur mit ihr können wir unsere Persönlichkeit entwickeln. Nur mit ihr können unsere jungen Menschen Karriere machen, haben wir Fachkräfte in unserem Land, gibt es Wohlstand in unserem Land. Nur mit Bildung haben wir auch die Chance, uns im weltweiten Wettbewerb zu behaupten.\n\nIch glaube, wir können sagen: Jeder hat ein Recht auf Bildung. Wir nennen das Chancengerechtigkeit. Chancengerechtigkeit ist der eine Punkt. Ein zweiter Punkt ist, dass wir einen Schwerpunkt zur Unterstützung der Mitte unserer Gesellschaft setzen wollen. Darum reformieren wir das BAföG. Darum investieren wir in Menschen, die lernen wollen. So haben wir es heute Morgen im Kabinett beschlossen. Wir brauchen gut ausgebildete Menschen. Diese wollen wir mit der BAföG-Novelle fördern. Wir wollen gerade die Familien unterstützen, die diese Gesellschaft tragen, nämlich die arbeitenden Eltern mit Kindern in Ausbildung.\n\nMit der Reform des BAföGs konzentrieren wir uns auf die wichtigsten Aspekte.\n\nWir erhöhen den Förderhöchstsatz von heute 735 Euro auf 861 Euro im Jahre 2020. Das ist ein Plus von 17 Prozent.\n\nWeil die Wohnkosten an vielen Orten so stark gestiegen sind, erhöhen wir auch den Wohnzuschlag für alle BAföG-Geförderten, die nicht bei den Eltern wohnen, von 250 Euro auf 325 Euro.\n\nDrittens erhöhen wir die Einkommensfreibeträge bis 2021 ebenfalls um fast 17 Prozent. Damit wird die Zahl der BAföG-Geförderten wieder deutlich steigen. Besonders Familien, die bisher knapp über der Einkommensgrenze liegen, werden in Zukunft vom BAföG profitieren.\n\nEs soll aber damit nicht genug sein. Wichtig ist uns auch: Niemand soll Sorge haben müssen, sich zu sehr zu verschulden. Niemand soll deswegen von einem Studium abgehalten werden. Deswegen haben wir beschlossen, dass jeder Absolvent maximal 77 monatliche Raten à 130 Euro zahlen soll. Wer dann trotz redlichen Bemühens seine BAföG-Schulden nicht tilgen kann, dem werden sie nach 20 Jahren erlassen.\n\nNicht zuletzt wollen wir, dass künftig junge Leute ihren BAföG-Antrag vermehrt online stellen. Wir wollen die Chancen der Digitalisierung entschieden nutzen. Rechtlich ist das jetzt schon möglich. Mit den Ländern arbeiten wir jetzt gerade daran, auch die praktischen Hürden zu überwinden.\n\nMeine Damen und Herren, mit dieser BAföG-Reform stärken wir die Mitte der Gesellschaft. Wir stärken Familien mit Kindern in Ausbildung. Wir halten unser Versprechen, das wir im Koalitionsvertrag gegeben haben. Darum investieren wir in dieser Legislaturperiode zusätzlich mehr als 1,2 Milliarden Euro für das BAföG. So schaffen wir die versprochene Trendumkehr. So soll jeder junge Mensch seine Talente entfalten können.\n\nFür gute Rahmenbedingungen leisten wir mit unserer BAföG-Reform einen entscheidenden Beitrag. Gute Rahmenbedingungen für gute Bildung: Einen Schritt dahin haben wir heute mit der BAföG-Reform gemacht.\n\nHerzlichen Dank.\n\n({0})"
"1018535","Anja","Karliczek","not found","Minister","2019-01-30T00:00:00.000Z","https://dip21.bundestag.de/dip21/btp/19/19076.pdf","\n\nLieber Herr Frömming, ich will mit Ihrem zweiten Punkt anfangen. Ich habe das Thema studentischer Wohnraum, weil es auch im Koalitionsvertrag steht, mit dem Kollegen Seehofer sehr intensiv erörtert. Wir sind uns darin einig, dass wir über die Grundgesetzänderung zur Unterstützung des sozialen Wohnungsbaus, die jetzt im Raum steht, auch die Förderung studentischen Wohnraumes ansetzen, die primär Ländersache ist. Ich bin gerade dabei, mich mit den Ländern darüber zu verständigen, indem wir noch einmal darauf hinweisen, dass diese Förderung gerade in den Städten einen entscheidenden Beitrag zur Entlastung der Wohnungsmärkte leisten kann.\n\nIhr erster Punkt: Leistung von Studenten. Ich glaube, wenn sich jemand aufmacht, sich in einem Erststudium zu qualifizieren, dann ist das generell schon eine Leistung, die sehr anerkennenswert ist. Beim BAföG geht es ja darum, diese Menschen finanziell zu unterstützen. Bei der Rückzahlung wollen wir denen, die den Staat unterstützen, indem sie das Geld schnell zurückzahlen, einen Teil der Schulden erlassen."
"1018538","Anja","Karliczek","not found","Minister","2019-01-30T00:00:00.000Z","https://dip21.bundestag.de/dip21/btp/19/19076.pdf","\n\nDie Notwendigkeit sehen wir auch. Es sind heute schon Online-BAföG-Anträge möglich, was aber sehr wenig genutzt wird, weil dies derzeit noch sehr komplex und sehr kompliziert ist. Wir haben das Onlinezugangsgesetz auf den Weg gebracht und wollen damit alle Leistungen, die der Staat auf verschiedenen Ebenen zur Verfügung stellt, online möglich machen. Die Onlinebeantragung beim BAföG gehört dazu.\n\nDeswegen haben wir jetzt, weil das über die Länder orchestriert wird, eine Arbeitsgruppe eingesetzt, um unter Vorsitz des Landes Sachsen-Anhalt einen Prototypen zu entwickeln und die Beantragung über das Onlinezugangsgesetz zur Verfügung stellen zu können."
"1018541","Anja","Karliczek","not found","Minister","2019-01-30T00:00:00.000Z","https://dip21.bundestag.de/dip21/btp/19/19076.pdf","\n\nDas elternunabhängige BAföG wäre wie ein bedingungsloses Grundeinkommen. Genau das lehnen wir ab. Wir wollen, dass weiterhin die primäre Zuständigkeit der Familie erhalten bleibt. Alles andere würde unser Unterhaltsrecht komplett auf den Prüfstand stellen. Wir müssten im Grunde die ganze Struktur, nach der unser Sozialsystem angelegt ist, komplett umkrempeln, wenn wir solche Veränderungen vornehmen würden.\n\nWir bleiben dabei, dass die Zuständigkeit für eine Erstausbildung und die Unterstützung der Kinder zunächst einmal bei den Eltern liegt, wenn sie ausreichend leistungsfähig sind. Denn nur so können wir sicherstellen, dass mit dem Steuergeld sparsam umgegangen wird."
"1018544","Anja","Karliczek","not found","Minister","2019-01-30T00:00:00.000Z","https://dip21.bundestag.de/dip21/btp/19/19076.pdf","\n\nDie privaten Berufsakademien haben sich in den letzten Jahren entwickelt und bieten Abschlüsse analog zum Bachelor an. Für uns sind das sehr wichtige Studiengänge; denn es handelt sich häufig um soziale oder technisch-duale Studiengänge. Vor dem Hintergrund, dass sie bisher nicht förderfähig waren, weil es private Einrichtungen sind, haben wir uns aufgrund der Gleichwertigkeit der Abschlüsse entschieden, die Studierenden an Berufsakademien mit zu unterstützen."
"1018547","Anja","Karliczek","not found","Minister","2019-01-30T00:00:00.000Z","https://dip21.bundestag.de/dip21/btp/19/19076.pdf","\n\nDie letzte soziale Erhebung zeigt zu den Wohnkosten, dass wir mit einer Pauschale von 325 Euro schon über den durchschnittlichen Kosten liegen. Wir haben im Fokus, dass man in Deutschland an jeder Hochschule sehr gut studieren kann, nicht nur in den Städten, wo Wohnraum im Moment sehr teuer ist. Wir haben uns deswegen weiterhin für eine Pauschale entschieden, damit die Attraktivität überall in Deutschland gleich ist."
"1018562","Anja","Karliczek","not found","Minister","2019-01-30T00:00:00.000Z","https://dip21.bundestag.de/dip21/btp/19/19076.pdf","\n\nWir wissen aus der letzten Sozialerhebung, dass mit unserem Vorschlag die Lebenshaltungskosten gedeckt würden. Die meisten Studierenden, die arbeiten – das haben wir in dieser Befragung auch herausgefunden –, sagen: Wir wollen ein bisschen mehr haben für Dinge, die wir uns extra leisten wollen. – Deswegen soll es so bleiben, dass Einkünfte nach der 450-Euro-Regelung auf das BAföG nicht angerechnet werden. Denn natürlich wollen wir den Studierenden, die sich ein bisschen mehr leisten wollen, die Möglichkeit geben, auch etwas hinzuzuverdienen."
"1018550","Anja","Karliczek","not found","Minister","2019-01-30T00:00:00.000Z","https://dip21.bundestag.de/dip21/btp/19/19076.pdf","\n\nDie Zahl 180 000, die Sie in den Raum gestellt haben, betrifft die Fallzahlen, auch diejenigen, die nur ein, zwei Monate in einem Jahr gefördert wurden. Der Rückgang der Zahl der im Jahresdurchschnitt Geförderten lag wesentlich niedriger, nämlich gerade bei rund 100 000. An dieser Stelle haben wir angesetzt und haben gesagt: Trendumkehr bedeutet, dass wir wieder mehr junge Leute fördern wollen. Wir wollen noch in dieser Legislaturperiode auf diesem Weg bis zu 100 000 junge Leute mehr erreichen."
"1018553","Anja","Karliczek","not found","Minister","2019-01-30T00:00:00.000Z","https://dip21.bundestag.de/dip21/btp/19/19076.pdf","\n\nIch will die zweite Frage zuerst beantworten. Solche Berechnungen beruhen immer auf Erfahrungswerten und statistischen Annahmen und haben deswegen natürlich Ungenauigkeiten. Wenn man bessere Erkenntnisse hat, kann man nachbessern. Das wurde getan. Deswegen ist die jetzt zugrunde gelegte Zahl an Stunden wesentlich geringer als bei der letzten BAföG-Reform. Das ist der erste Punkt.\n\nDer zweite Punkt. In den letzten Jahren sind viele aus der BAföG-Förderung herausgefallen aufgrund der guten konjunkturellen Lage. Die gute konjunkturelle Lage hat dazu geführt, dass in vielen Fällen beide Elternteile arbeiten und dass viele Eltern Lohnsteigerungen erhalten haben. Das hat wiederum dazu geführt, dass sie aus den Einkommensfreibeträgen herausgefallen sind und deswegen ihre Kinder kein BAföG mehr bekommen haben. Wir setzen deshalb genau dort an. Wir wollen im Grunde sicherstellen, dass diejenigen, die soeben darüber liegen und in den letzten Jahren aus der Förderungsberechtigung herausgefallen sind, wieder hineinkommen und dadurch genau diejenigen gefördert werden, die es aus unserer Sicht am nötigsten haben, weil sie von gestiegenen Wohn- und Lebenshaltungskosten am meisten betroffen sind."
"1018591","Anja","Karliczek","not found","Minister","2019-01-30T00:00:00.000Z","https://dip21.bundestag.de/dip21/btp/19/19076.pdf","\n\nFür uns war wichtig, sicherzustellen, dass niemand, auch wenn er nicht erfolgreich ist und sich die Rückzahlung, die ja einkommensabhängig ist, nicht leisten kann, sein ganzes Leben lang BAföG-Schulden hat. Deswegen haben wir die Systematik verändert und sind auf 77 Monatsbeiträge gegangen. Wir haben zusätzlich gesagt: Wer es nach 20 Jahren nicht geschafft hat, seine BAföG-Schulden abzubauen, der bekommt sie erlassen."
"1018556","Anja","Karliczek","not found","Minister","2019-01-30T00:00:00.000Z","https://dip21.bundestag.de/dip21/btp/19/19076.pdf","\n\nDas Gute ist, dass wir nicht für alles eine Gesetzesänderung brauchen. Für all das, was wir jetzt beschließen, brauchen wir keine Gesetzesänderung, um den Online-BAföG-Antrag auf den Weg zu bringen. Wir sind deshalb in der Arbeitsgruppe dabei, zügig ein Modul zu erarbeiten, das wir über das Onlineportal des Bundes zur Verfügung stellen können."
"1018559","Anja","Karliczek","not found","Minister","2019-01-30T00:00:00.000Z","https://dip21.bundestag.de/dip21/btp/19/19076.pdf","\n\nWir haben uns intensiv damit auseinandergesetzt, was ein ungeordneter Brexit für die Menschen bedeutet, die mit Auslands-BAföG gefördert werden. Wir haben jetzt eine Übergangsregelung geschaffen. Diese Regelung soll bei den Auszubildenden Vertrauen schaffen, sicher sein zu können, dass sie ihr Studium oder ihre sonstige Ausbildung im Ausland in Ruhe zu Ende bringen können, und soll unbillige Härten abfedern. Der Gesetzentwurf zu dieser Übergangsregelung ist von der Bundesregierung am 12. Dezember letzten Jahres beschlossen worden und wird morgen in erster Lesung hier beraten. Dann kann das Gesetz pünktlich noch zum 30. März dieses Jahres in Kraft treten."
"1018565","Anja","Karliczek","not found","Minister","2019-01-30T00:00:00.000Z","https://dip21.bundestag.de/dip21/btp/19/19076.pdf","\n\nIch will als Erstes auf den ersten Punkt – warum wollen wir den Bericht verschieben? – eingehen: Eine Evaluierung muss auch eine Aussagekraft haben. Das erste Jahr, das nach der BAföG-Reform die Wirkung der neuen Kriterien abbildet, ist das Jahr 2019. Wenn wir eine Evaluierung über drei Jahre durchführen, dann werden wir die Jahre 2018, 2019, 2020 vollständig berücksichtigen können, und dann können wir im Sommer 2021 wirklich feststellen: Hat es gewirkt, oder hat es nicht gewirkt?\n\nIch denke, wir können an einer Stelle auch mal froh sein: Wir wollen natürlich Familien mit Kindern in Ausbildung unterstützen. Aber wenn zugleich die Wirtschaftslage so gut ist, dass die Einkommen im Grunde schneller steigen, als wir mit den Sozialleistungen nachziehen können, dann sollten wir jetzt froh sein, dass wir wieder in die Mitte der Gesellschaft investieren, aber sollten nicht eine gute Wirtschaftslage beklagen.\n\n({0})"
"1018568","Anja","Karliczek","not found","Minister","2019-01-30T00:00:00.000Z","https://dip21.bundestag.de/dip21/btp/19/19076.pdf","\n\nBürokratieabbau ist für uns ein sehr wesentliches Thema, und genau aus dem Grunde haben wir jetzt den Aufschlag mit dem Onlinezugangsgesetz gemacht, um so die ganzen Leistungen, die der Staat bietet, zu bündeln. An dieser Stelle wird es weitergehen, bis wir alle 575 Leistungen online zur Verfügung stellen können.\n\n({0})"
"1018571","Anja","Karliczek","not found","Minister","2019-01-30T00:00:00.000Z","https://dip21.bundestag.de/dip21/btp/19/19076.pdf","\n\nDie Wohnraumfrage ist für mich eine sehr, sehr wichtige; denn gerade in den Großstädten, wo es viele Hochschulen und viele Studenten gibt, sind die Wohnungsmärkte häufig angespannt. Ich persönlich bin davon überzeugt, dass bezahlbarer studentischer Wohnraum einen Beitrag zur Entspannung der Lage leisten kann. Deswegen habe ich das Ganze erst mit Horst Seehofer besprochen, und wir haben dann gesagt – Wohnraumunterstützung ist ja Sache der Länder, die das dann zusammen mit den Studierendenwerken organisieren –: Gut, wir machen einen Aufschlag. Wir schreiben jetzt unsere Länderkollegen an und weisen sie darauf hin, dass das für uns ein wichtiger Aspekt im Rahmen des sozialen Wohnungsbauprogramms ist, das wir jetzt gerade auf den Weg bringen.\n\nDas Zweite ist: Wir haben die durchschnittlichen Kosten für studentischen Wohnraum erhoben und sind bei gut 300 Euro gelandet. Wir haben gesagt: Ja, wir geben für die nächsten Jahre noch ein wenig obendrauf. So haben wir dann den Betrag von 325 Euro festgelegt."
"1018574","Anja","Karliczek","not found","Minister","2019-01-30T00:00:00.000Z","https://dip21.bundestag.de/dip21/btp/19/19076.pdf","\n\nWir führen ja Erhebungen dazu durch, was unsere Reformen bewirken. Wir haben von daher gesagt: Wir machen drei Schritte bei den Einkommensfreibetragserhöhungen. Natürlich wäre es so, dass, wenn wir nur einen Schritt machen würden, im nächsten Anlauf, bei der nächsten Einkommenserhöhung, schon wieder ein Absinken der Zahlen der geförderten Studierenden zu verzeichnen gewesen wäre. Deswegen haben wir gesagt: In einem ersten Schritt wollen wir auf aktuelle Gegebenheiten durch die Anpassung der Einkommensfreibeträge reagieren. Die zweite und die dritte Stufe sind wirklich dazu da, die Trendumkehr einzuleiten und sicherzustellen, dass es dann auch mehr BAföG-Berechtigte werden. So sind wir dann zu der Aussage gekommen, dass wir bis 2021 rund 100 000 junge Menschen mehr erreichen."
"1018577","Anja","Karliczek","not found","Minister","2019-01-30T00:00:00.000Z","https://dip21.bundestag.de/dip21/btp/19/19076.pdf","\n\nZum ersten Punkt. Es ist nicht die Anhebung der Bedarfssätze, die die Trendumkehr einleiten soll, sondern die der Einkommensfreibeträge. Durch höhere Einkommensfreibeträge, dadurch, dass wir wieder mehr Familien mit Kindern in Ausbildung erreichen, leiten wir die Trendumkehr ein. Die Bedarfssätze sollen in zwei Schritten erhöht werden, weil es aufgrund gestiegener Lebenshaltungskosten und gestiegener Wohnkosten notwendig ist.\n\nWas war noch einmal der zweite Teil Ihrer Frage?"
"1018579","Anja","Karliczek","not found","Minister","2019-01-30T00:00:00.000Z","https://dip21.bundestag.de/dip21/btp/19/19076.pdf","\n\nNein, eine solche Dynamisierung haben wir nicht erwogen, weil wir es Ihnen, dem Parlament, ermöglichen wollen, auch nach einem Bericht, die dann notwendigen Anpassungen ganz zielgenau vorzunehmen. Wenn wir einfach nur eine Dynamisierung haben wollten, würden wir im Grunde zielgenaue Anpassungen von BAföG aus der Hand geben. Das wollen wir nicht. Deswegen wollen wir weiter Berichte erstellen – aussagekräftige Berichte –, und dann können wir in der nächsten Legislaturperiode eine neue BAföG-Reform angehen, wenn die Notwendigkeit dazu besteht."
"1018582","Anja","Karliczek","not found","Minister","2019-01-30T00:00:00.000Z","https://dip21.bundestag.de/dip21/btp/19/19076.pdf","\n\nDie Berichtspflicht ist für uns ein wesentlicher Punkt, der uns ein Urteil darüber ermöglicht: Wirken unsere Reformen, oder wirken sie nicht? – Aber wahr ist natürlich: Wir können nicht alle zwei Jahre einen Bericht erstellen, der dann keine Aussagekraft hat.\n\n({0})\n\nDeswegen haben wir gesagt: Wir wollen 2018 bis 2020 als nächsten Berichtszeitraum nehmen, um zu sehen: Wirken unsere Reformen?\n\n({1})\n\nZur Dynamisierung. Wir haben die Wohnkostenpauschale überproportional erhöht und die Bedarfssätze um 7 Prozent. Das zeigt sehr schön, dass wir zielgenau erhöhen und nicht einfach nur dynamisieren.\n\n({2})"
"1018585","Anja","Karliczek","not found","Minister","2019-01-30T00:00:00.000Z","https://dip21.bundestag.de/dip21/btp/19/19076.pdf","\n\nIm BAföG sind schon einige Flexibilisierungsmöglichkeiten enthalten, faktisch ein Teilzeitstudium aufzunehmen, beispielsweise bei Krankheit, Behinderung, Schwangerschaft oder auch Kindererziehung. Die Pflege ist dort noch nicht enthalten. Ob man die Pflege zusätzlich in die Flexibilisierungsmöglichkeit einbeziehen kann, können wir gerne im parlamentarischen Verfahren noch diskutieren. Ich glaube, wir müssen gucken, wie viele davon betroffen sind und ob das beispielsweise wie die Berücksichtigung von Kindererziehung gestaltet werden kann. Aber ich wäre grundsätzlich nicht abgeneigt."
"1018588","Anja","Karliczek","not found","Minister","2019-01-30T00:00:00.000Z","https://dip21.bundestag.de/dip21/btp/19/19076.pdf","\n\nDie größte Veränderung, die wir seit den erstmals von mir vorgestellten Eckpunkten aufgenommen haben, ist die, dass wir eine dritte Stufe bei den Einkommensfreibeträgen eingeführt haben, damit wir wirklich sicherstellen können, dass die Trendumkehr gelingt, dass mehr junge Leute dauerhaft erreicht werden können.\n\nWarum haben wir gewartet, um die Kabinettsreife herzustellen? Weil wir uns erst die aktuellsten Prognosezahlen auch schon für 2018 anschauen und herausfinden wollten, was die Ursache dafür ist, dass die Zahl der BAföG-Empfänger, die wir erreichen wollen, zurückgegangen ist. Wir wollen gerade durch die überproportionale Steigerung der Einkommensfreibeträge in drei Stufen nachhaltig nachsteuern, um die Trendwende auch wirklich zu gewährleisten."
"1018594","Anja","Karliczek","not found","Minister","2019-01-30T00:00:00.000Z","https://dip21.bundestag.de/dip21/btp/19/19076.pdf","\n\nDie Frage würde ich gerne an das federführende Ressort weitergeben."
"1018614","Anja","Karliczek","not found","Minister","2019-01-30T00:00:00.000Z","https://dip21.bundestag.de/dip21/btp/19/19076.pdf","\n\nGenau, ich bin zwar nicht zuständig – wir werden Ihnen eine konkretere rechtliche Bewertung schriftlich zukommen lassen –, aber vielleicht so viel: Ich glaube, dass Tiere so qualvoll sterben müssen, ist generell etwas, was niemand von uns in irgendeiner Form will. Es geht um das Verhältnis von Eigentumsrechten und Tierschutz. Diese beiden Fragen können nicht voneinander getrennt werden. Letztendlich müssen Richter am Ende bewerten, wie sie das ins Verhältnis stellen. Dass so viele Tiere zu Tode gekommen sind, ist für uns alle sehr bedauerlich."
"1018618","Anja","Karliczek","not found","Minister","2019-01-30T00:00:00.000Z","https://dip21.bundestag.de/dip21/btp/19/19076.pdf","\n\nIch will die zweite Frage als Erstes beantworten: Für uns ist wichtig, dass wir gute Zusammenarbeit gewährleisten, dass wir homogen zusammenarbeiten können; deswegen sind wir im engen Austausch. Wir wollen aber erst national die Dinge beginnen und sie dann verknüpfen. Das ist für uns auch bei der Agentur zur Förderung von Sprunginnovationen ein wesentliches Kriterium.\n\nWir wollen in der Zusammenarbeit mit Frankreich im Grunde den Aufschlag machen, um am Ende europäische Projekte voranzutreiben. Auch die Förderung von Sprunginnovationen soll auf Dauer ein europäisches Projekt werden, wo wir mit unterschiedlichen Zuständigkeiten zusammenarbeiten.\n\nHinsichtlich dieser Agentur haben wir mehrere Fragen zu beantworten. Erstens geht es um das rechtliche Konstrukt; hier befinden wir uns im abschließenden Austausch mit dem Finanzministerium, das uns sehr eng begleitet. Zweitens haben wir uns parallel auch schon gefragt: Wer kommt infrage, um diese Agentur zu leiten? Denn am Ende hängt es gerade bei der Agentur zur Förderung von Sprunginnovationen an den Köpfen, die damit betraut sind, Innovationen zu erkennen, die auch wirklich das Potenzial haben, neue Märkte zu erschließen. Es geht ja nicht um inkrementelle Innovationen, sondern um Innovationen, die uns im weltweiten Wettbewerb einen Schritt nach vorne bringen.\n\n({0})"
"1018634","Anja","Karliczek","not found","Minister","2019-01-30T00:00:00.000Z","https://dip21.bundestag.de/dip21/btp/19/19076.pdf","\n\nSolange wir das, was berichtet wird, nicht aus eigenen Quellen sicherstellen können, äußern wir uns zu Dingen nicht.\n\n({0})\n\nSo weit dazu.\n\nDas Zweite ist, dass wir in Deutschland ein sehr strenges Embryonenschutzgesetz haben. Wir glauben, dass dieses Embryonenschutzgesetz die Dinge, die da gelaufen sein sollen, nicht zulässt. Das halten wir weiterhin für richtig."
"1018645","Anja","Karliczek","not found","Minister","2019-01-30T00:00:00.000Z","https://dip21.bundestag.de/dip21/btp/19/19076.pdf","\n\nWie schnell in der Forschung Erkenntnisse generiert werden können, entzieht sich, glaube ich, ein wenig unserer Einschätzung. Das sind Spekulationen, ob es denn 2050 erst so weit sein wird.\n\nWichtig ist für uns, dass ITER für die Europäische Union weiterhin ein wichtiges Projekt ist und dass wir weiter dabeibleiben werden. Wir müssen damit umgehen, falls Großbritannien sich daran nicht mehr beteiligt. Dass wir uns weiter an der Forschung beteiligen und dieses Projekt weiter vorantreiben, sollten wir nicht infrage stellen. Unabhängig vom Fortschritt dieses Projektes können wir die Energiewende zum Erfolg führen."
