id,firstname,lastname,faction,position,date, url,speech
"1026836","Anja","Karliczek","not found","Minister","2019-06-27T00:00:00.000Z","https://dip21.bundestag.de/dip21/btp/19/19107.pdf","\n\nSehr geehrter Herr Präsident! Liebe Kolleginnen und Kollegen! Es gibt viele Dinge, um die uns die Welt beneidet, und ich glaube, wir können sagen: Die duale Berufsausbildung ist eins davon. Sie hat einen großen Anteil an der wirtschaftlichen Kraft unseres Landes. Sie schafft für jeden einzelnen Auszubildenden hervorragende Chancen, und sie bietet den Betrieben hochqualifizierte Mitarbeiter.\n\nDie berufliche Bildung bei uns muss sich wahrlich nicht verstecken. Im Gegenteil: Berufliche und akademische Bildung bieten bei uns gleichwertige Chancen auf ein erfolgreiches Arbeitsleben.\n\n({0})\n\nBeide sind anspruchsvoll und bereiten auf spannende Aufgaben vor. Beide bieten ausgezeichnete Chancen für den Aufstieg im Beruf. Beide sind unverzichtbar, um den Fachkräftebedarf bei uns im Land zu decken, und zwischen beiden können junge Menschen in Deutschland frei wählen, ganz nach ihren Interessen und Stärken.\n\nIn den vergangenen Jahren stand vor allem die akademische Bildung im Fokus. Das hat uns einen historischen Höchststand an Studierenden beschert. Für die berufliche Bildung legen wir jetzt nach. Wir modernisieren das Berufsbildungsgesetz. Wir sichern die Attraktivität der beruflichen Bildung für die Zukunft. Wir geben ihr den Stellenwert, der ihr wirklich zusteht.\n\n({1})\n\nWir zeigen: Mit einer beruflichen Ausbildung kann man auch eine große Karriere machen und auch ein hohes Gehalt bekommen. Denn die Unternehmen suchen dringend beruflich qualifizierte Arbeitskräfte. Die Situation auf dem Arbeitsmarkt ist so gut wie lange nicht mehr.\n\nDas ist die zentrale Nachricht des aktuellen Berufsbildungsberichtes: Die Zahl der neu abgeschlossenen Ausbildungsverträge steigt wieder, und mittlerweile stehen 100 Bewerberinnen und Bewerbern 106 Ausbildungsplätze gegenüber. Das zeigt: Die Betriebe setzen ganz klar auf die duale Ausbildung zur Deckung ihres Fachkräftebedarfs. Sie strengen sich mittlerweile sogar besonders an, um jungen Menschen ein wirklich gutes Angebot zu machen. Diese Entwicklung ist nicht nur bemerkenswert, sondern von unserer Seite auch fördernswert.\n\n({2})\n\nWir wollen die berufliche Bildung entschieden stärken. Die Novelle des Berufsbildungsgesetzes ist dazu ein wichtiger Schritt. Lassen Sie mich das an drei Punkten verdeutlichen:\n\nAuszubildende packen in den Betrieben auch engagiert mit an. Das ist eine Leistung, die auch finanziell anerkennenswert ist. Wir wollen eine wertschätzende Kultur des Miteinanders: im Leben, auf der Arbeit und auch selbstverständlich in der Ausbildung. In den meisten Branchen und Betrieben ist das mittlerweile der Fall. Wo dies nicht so ist, wollen wir ein Zeichen für eine attraktive Ausbildung setzen.\n\nMit der Novelle führen wir deshalb eine Mindestvergütung ein. Sie startet 2020 mit 515 Euro. Wer sich ein bisschen auskennt, der weiß genau, dass viele Betriebe schon heute mehr zahlen. Deshalb ist es ein richtiges Zeichen, dass die Mindestausbildungsvergütung stufenweise auf 620 Euro für das erste Ausbildungsjahr steigt. Nach 2023 passen wir die Mindestvergütung an die durchschnittliche Entwicklung aller Ausbildungsvergütungen an. Mehr noch: Da ein Auszubildender mit jedem weiteren Jahr der Betriebszugehörigkeit wertvoller für das Unternehmen wird, soll er das auch spüren, und zwar durch einen Aufschlag von 18 Prozent im zweiten und 35 Prozent im dritten Ausbildungsjahr.\n\nGanz bewusst haben wir übrigens bei der Frage, wie hoch die Mindestvergütung sein soll, die Sozialpartner eingebunden. Es war ein guter und enger Austausch. Am Ende stand der Kompromiss. Der Interessenausgleich, der unser System der beruflichen Bildung seit jeher stark gemacht hat, hat sich auch hier wieder einmal bewährt. Denn die Mindestvergütung stärkt nicht nur die berufliche Bildung, sondern auch die Sozialpartnerschaft. Die Tarifbindung eines Betriebes hat immer Vorrang vor der Mindestvergütung. Das lässt Möglichkeiten und Freiheiten, auch regionale und branchenspezifische Lösungen zu finden. Wo es aber keine Tarifbindung gibt, greift die neue Haltelinie.\n\nWie immer und überall gilt auch hier: Geld ist nicht alles. Für eine attraktive Ausbildung braucht es noch ein wenig mehr. Eine Ausbildung soll in möglichst vielen Lebenssituationen möglich sein. Denn uns ist wichtig, dass jedem der Start ins Berufsleben gelingt. Auch hier wollen wir ein überzeugendes Angebot schaffen. Deshalb stärken wir die Berufsausbildung in Teilzeit. Künftig kann die Ausbildungszeit im Einvernehmen mit dem Betrieb verlängert werden. So wird Teilzeit zu einer echten Option für Auszubildende. So wird die duale Ausbildung beispielsweise auch für neue Zielgruppen attraktiv, etwa für Menschen mit einer Lernbeeinträchtigung.\n\n74 Prozent der Auszubildenden werden von ihrem Betrieb übernommen. Sie wechseln nahtlos ins Anstellungsverhältnis. Das zeigt: Eine Ausbildung eröffnet beste Chancen, gerade auch jetzt in Zeiten des Fachkräftemangels. Sie lohnt sich sowohl für die Betriebe als auch für Auszubildende. Aber nach einer Ausbildung ist noch lange nicht Schluss. Für denjenigen, der es möchte, kann es weitergehen: in Führungspositionen eines Unternehmens oder eben auch zum eigenen Meisterbetrieb. Qualifizierung ist heute mehr denn je erwünscht und auch möglich.\n\nAuch hier setzen wir Zeichen für mehr Internationalität und für mehr grenzüberschreitende Zusammenarbeit. Wir schaffen Transparenz mit drei einheitlichen Fortbildungsstufen und drei griffigen Abschlussbezeichnungen: Geprüfter Berufsspezialist, Bachelor Professional, Master Professional. Schon an der Sprache wird deutlich: Die berufliche Bildung in den Betrieben ist im Wert vergleichbar mit der Ausbildung an den Universitäten. Auch im Ausland werden die neuen Bezeichnungen gut verstanden. Das ist gerade in weltweit operierenden Unternehmen und über Landesgrenzen hinaus wichtig. So stärken wir die berufliche Bildung als Marke. So stärken wir Karrierechancen. So stärken wir den Arbeitsmarkt, und so leisten wir einen wichtigen Beitrag für die Fachkräftesicherung.\n\n({3})\n\nBewährte Berufsbezeichnungen bleiben natürlich erhalten. Die neuen Bezeichnungen ergänzen sie und stärken sie. Aber der Meister bleibt der Meister, jetzt und in Zukunft.\n\nDer nächste Schritt zur Stärkung der beruflichen Bildung ist schon auf dem Weg. Wir werden auch das AFBG, das Aufstiegs-BAföG, novellieren; den Gesetzentwurf werden wir in Kürze vorlegen. Mit der Reform des Berufsbildungsgesetzes liefern wir heute spürbare Verbesserungen für die Auszubildenden, die Kammern und Betriebe. Wir bauen Flexibilität auf und Bürokratie ab. Wir geben der dualen Berufsbildung den Wert, der ihr gebührt. 50 Jahre wird unser Berufsbildungsgesetz in diesem Jahr alt. Berufsbildung in Deutschland war bisher eine Erfolgsgeschichte und soll es auch zukünftig bleiben. Dafür bitte ich um Ihre Unterstützung.\n\nHerzlichen Dank.\n\n({4})"
"1028050","Anja","Karliczek","not found","Minister","2019-09-12T00:00:00.000Z","https://dip21.bundestag.de/dip21/btp/19/19112.pdf","\n\nSehr geehrter Herr Bundestagspräsident! Liebe Kolleginnen und Kollegen! Meine sehr verehrten Damen und Herren! Wir stehen inmitten großer Herausforderungen. Wir müssen das Klima schützen, die Digitalisierung gestalten, Wohlstand und Zusammenhalt bewahren, und das alles gleichzeitig, und zwar in Zeiten, in denen die Einnahmen nicht mehr so üppig steigen wie bisher, in Zeiten, in denen der Brexit und internationale Handelskonflikte unsere Konjunktur zu bremsen drohen.\n\nDie Bundesregierung setzt mit dem vorliegenden Haushalt die richtigen Prioritäten. Wir investieren in Bildung und Forschung, wir investieren in die Menschen in unserem Land.\n\n({0})\n\nEine gute Aus- und Weiterbildung, exzellente Forschung und eine hohe Innovationskraft bleiben entscheidend für unser Land. Sie bleiben entscheidend für ein gutes Leben jedes Einzelnen, für den Zusammenhalt unserer Gesellschaft und für die Wettbewerbsfähigkeit unserer Wirtschaft. Deswegen investieren wir auch im kommenden Jahr mehr als 18 Milliarden Euro in Bildung und Forschung. Hinzu kommen die Milliarden für den digitalen Wandel an unseren Schulen.\n\n({1})\n\nAn dieser Stelle möchte ich auch die steuerliche Forschungsförderung erwähnen. Mit ihr stärken wir die Innovationskraft unserer Unternehmen, insbesondere der mittelständischen Wirtschaft. Damit sind wir gut aufgestellt, um den Wandel in unserer Arbeitswelt und den Weg hin zu einer nachhaltigen sozialen Marktwirtschaft tatkräftig unterstützen zu können.\n\nLiebe Kolleginnen und Kollegen, lassen Sie mich als Bildungsministerin sagen: Ich bin sehr froh, dass unsere jungen Menschen sich wieder politisch engagieren. Sie engagieren sich für ein Menschheitsthema.\n\n({2})\n\nDas freut mich besonders; denn die Schöpfung zu bewahren, den natürlichen Lebensraum zu erhalten, dem Klimawandel entgegenzutreten – das sind Kernthemen meines Hauses.\n\n({3})\n\nAus Deutschland heraus, von der Bundeskanzlerin initiiert, treiben wir die Forschung seit Jahren entscheidend voran. Ohne die Unterstützung der deutschen Klimaforschung hätte es den Prozess für das Weltklimaabkommen von Paris in dieser Form nicht gegeben.\n\nIn der nächsten Woche fahre ich nach Tromsø in Norwegen. Von dort wird unser deutsches Forschungsschiff „Polarstern“ zu einer internationalen Arktisexpedition aufbrechen. Auf diese größte Arktisexpedition aller Zeiten haben wir seit Jahren hingearbeitet. Die Arktis ist die Klimaküche der Welt. Dürre, Stürme und Starkregen, auch hier in Deutschland, werden wesentlich von dort mit beeinflusst. Es ist die Arktis, die uns einen tiefen Blick hinein in die Zukunft unseres Klimas und des Wetters erlaubt.\n\nWir wissen heute schon viel, um heute zu handeln. Wir möchten aber auch, dass wir morgen genug wissen, um morgen zu handeln. Wir sind uns unserer Verantwortung für unsere Erde bewusst. Sie ist und bleibt unsere Lebensgrundlage. Deshalb treiben wir die technologischen Innovationen zum Schutz unseres Klimas voran. Wir denken Ökologie, Wirtschaft, Soziales und Technologie zusammen. Wir sind diejenigen, die in einem gereiften demokratischen und rechtsstaatlichen System leben. Deshalb haben wir die Kraft. Wir können deshalb das Klimainnovationsland Deutschland bauen; denn Klimaschutz ist auch Technologiepolitik, ist auch Innovationspolitik. Umwelttechnik „Made in Germany“ ist schon heute ein Exportschlager, und Klimainnovationen „Made in Germany“ sollen auch zukünftig unser Markenzeichen sein.\n\n({4})\n\nWir setzen auf die CO2-Reduktion in industriellen Prozessen und auf speicherbare grüne Energieträger.\n\nNehmen wir das Projekt Carbon2Chem. Dort wird Hüttengas in chemische Grundstoffe umgewandelt. Carbon2Chem kann den CO2-Ausstoß eines Stahlstandortes um bis zu 70 Prozent verringern. Wir wollen die Industrie in Deutschland halten. Wir unterstützen die Industrie, CO2-frei zu werden.\n\n({5})\n\nBei den Energieträgern setzen wir auf speicherbaren grünen Wasserstoff; denn grüner Wasserstoff wird zentraler Energieträger der Zukunft.\n\n({6})\n\nWir wollen die Voraussetzungen für eine wasserstoffbasierte Wirtschaft schaffen. Dafür müssen wir noch einige Fragen beantworten: Wie können wir grünen Wasserstoff wirtschaftlich in großen Mengen erzeugen? Wie können wir ihn speichern? Wie können wir ihn transportieren?\n\nLiebe Kolleginnen und Kollegen, unsere zweite Herausforderung, unsere zweite Herkulesaufgabe ist der digitale Wandel. Digitale Technologien ermöglichen es uns, die Zukunft zu gestalten; denn Digitalisierung, gut gemacht, ermöglicht bessere Bildung, bessere Gesundheit, bessere Mobilität, bessere Energie. Für diesen digitalen Wandel wollen wir uns technologisch rüsten. Unser Ziel ist es, Deutschland zum führenden Standort für KI in der Welt zu machen.\n\n({7})\n\nWir bauen dafür aktuell das Deutsche Forschungszentrum für Künstliche Intelligenz und die KI-Zentren aus. Zudem schaffen wir eine exzellente sichere Dateninfrastruktur nach europäischen Standards. Gaia-X ist Ihnen ja mittlerweile ein Begriff. Ein europäisches Cloudsystem nach dem Vorbild des International Data Space aufzubauen – das ist unser Programm, um gerade auch der mittelständischen Wirtschaft eine leistungsfähige Infrastruktur zur Verfügung zu stellen.\n\n({8})\n\nLast, but not least: Wir gründen gerade die Agentur zur Förderung von Sprunginnovationen. Sie soll bahnbrechende Ideen in Deutschland aufspüren und daraus Produkte machen und damit neue Märkte erschließen.\n\nLiebe Kolleginnen und Kollegen, ich glaube, wir können sagen: Wir gestalten dieses Land, unser Land, unsere Zukunft. Das ist unsere Gestaltungsaufgabe. Und diesen Weg können wir nur gemeinsam gehen. Auf diesem Weg brauchen wir jeden in unserer Gesellschaft, jeden Menschen mit seinen Talenten, jeden Menschen an seinem Ort, Menschen, die Lust haben, sich auf Neues einzulassen, Menschen, die lernen wollen, Menschen, die diese Welt verstehen und gestalten wollen, Großmütter, die mit ihren Enkeln per WhatsApp chatten, fünfzigjährige Fachkräfte, die sich in neuen KI-Technologien fortbilden, aber auch junge Menschen, die wissen, dass man das Smartphone mal weglegen muss. Lassen Sie uns ein Land werden, das optimistisch in die Zukunft geht. Wir haben sehr gute Voraussetzungen dafür.\n\nIch bin froh, dass uns die OECD in dieser Woche bestätigt hat, dass Deutschland in der Bildung im internationalen Vergleich gut aufgestellt ist. Gerade in der Aus- und Weiterbildung sowie in der MINT-Bildung sind wir spitze.\n\n({9})\n\nTrotzdem haben wir noch Luft nach oben. Wir brauchen noch mehr Fachkräfte. Im 50. Jahr des Berufsbildungsgesetzes sind die berufliche Bildung und die duale Ausbildung wichtiger denn je, und mit der BBiG-Novelle unterstreichen wir das.\n\nAuch beim DigitalPakt für Schulen geht es vorwärts; die ersten Gelder werden gerade abgerufen.\n\nAuch mit den Wissenschaftspakten haben wir in diesem Jahr finanzielle Sicherheit und Planbarkeit für unsere außeruniversitären Forschungseinrichtungen, für die Deutsche Forschungsgemeinschaft und für die Hochschulen geschaffen – im Übrigen für längere Zeit als je zuvor.\n\n({10})\n\nUnd – ganz aktuell – mit dem Tenure-Track-Programm haben wir gerade heute Mittag unser Ziel erreicht. Der zentrale Impuls für mehr Planbarkeit und Transparenz im Karriereverlauf von jungen Wissenschaftlerinnen und Wissenschaftlern ist gesetzt. So locken wir die Besten der Besten zu uns, und so machen wir Deutschland stark für die Zukunft.\n\nLiebe Kolleginnen und Kollegen, genau vor einer Woche haben wir das Futurium eröffnet. Dieses spektakuläre Zukunftshaus liegt gleich hier um die Ecke. Im Futurium kann jeder sehen: Bildung und Forschung sind unsere Stärke. Deutschland ist und Deutschland bleibt das Land der Erfinder, Tüftler und Denker. Wie groß die Herausforderungen auch sein mögen – wir gehen sie an.\n\nIn diesem Haushalt können Sie erkennen: Eine nachhaltige soziale Marktwirtschaft, gesellschaftlicher Zusammenhalt und Zukunftschancen für jeden – das alles liegt uns am Herzen, und diese Aufgaben gehen wir an.\n\nHerzlichen Dank.\n\n({11})"
"1030101","Anja","Karliczek","not found","Minister","2019-10-24T00:00:00.000Z","https://dip21.bundestag.de/dip21/btp/19/19121.pdf","\n\nSehr geehrter Herr Präsident! Liebe Kolleginnen und Kollegen! Meine sehr geehrten Damen und Herren! Deutschland ist eine starke Wirtschaftsnation, Deutschland hat viele gut ausgebildete Menschen, Deutschland ist innovativ. Das hat kürzlich das Weltwirtschaftsforum bestätigt. In puncto Innovationsfähigkeit steht Deutschland im internationalen Vergleich sehr gut da.\n\nAber: Der Bericht sagt auch, dass Deutschlands Wettbewerbsfähigkeit zurückgeht. Trotz Innovationsfähigkeit liegen wir nur noch auf Platz 7. Daraus entsteht für uns Handlungsdruck; denn Deutschland lebt von der Innovation. Fragen der Innovation durch neue, klimaneutrale Geschäftsmodelle sind für uns genauso existenziell wie Fragen der Innovation durch neue Entwicklungen in der Digitalisierung. Das geht nur mit Fortschritt und Innovation. Und Fortschritt und Innovation brauchen Menschen, die Spaß und Freude am Wandel haben, weil sie exzellent ausgebildet und damit theoretisch und praktisch in der Lage sind, diesen Weg zu gestalten.\n\nMit der dualen Ausbildung nach dem Berufsbildungsgesetz haben wir seit 50 Jahren ein exzellentes Instrument für eine hochwertige Ausbildung in Deutschland.\n\n({0})\n\nDas höre ich übrigens immer wieder. Seitdem ich im Amt bin, ist keine Woche vergangen, in der mich nicht ein internationaler Partner gefragt hat, ob wir unser Erfolgsmodell „duale Ausbildung“ nicht auch exportieren wollen. Denn nicht umsonst ist unsere Jugendarbeitslosigkeit niedrig und „Made in Germany“ hoch anerkannt. Qualität war und ist ein Treiber unserer Wirtschaft und damit unseres Wohlstandes, und ein wichtiger Aspekt ist dabei die duale Ausbildung. Sie garantiert den Unternehmen qualifizierte Beschäftigte, den Menschen gute Jobperspektiven und der Gesellschaft eine hohe Dynamik und Flexibilität im Wandel. Neben „Made in Germany“ ist auch die duale Ausbildung ein Markenzeichen unseres Landes.\n\n({1})\n\nDoch trotzdem ist der Erfolg kein Selbstläufer. Das zeigt ein Blick auf den Ausbildungsmarkt: Das Angebot an Ausbildungsplätzen war zuletzt größer als die Nachfrage, und hinzu kommt, dass Angebot und Nachfrage nicht immer zusammenfinden. Aus diesem Grund stehe ich heute hier. Wir wollen mit der Novelle des Berufsbildungsgesetzes den Grundstein dafür legen, dass die duale Ausbildung auch zukünftig ihre Qualitätsfunktion und ihre Anpassungsfähigkeit im Wandel wahrnehmen kann.\n\n({2})\n\nDafür brauchen wir moderne Rahmenbedingungen. Ich will drei Punkte ansprechen.\n\nWer ein langes Berufsleben noch vor sich hat, der will sicher sein, dass er einen hochwertigen Einstieg und Aufstiegsperspektiven hat und dass die Aufstiegsstufen, die ein junger Mensch erklimmt, auch anerkannt und gesehen werden. Deshalb gibt es zukünftig drei Fortbildungsstufen, die im internationalen Vergleich verständlich sind. Denn Modernität ist eben auch eine Frage internationaler Anschlussfähigkeit, und die stellen wir heute her.\n\nAber damit ist es nicht genug. Auch die tatkräftige Unterstützung, die Auszubildende im Unternehmen leisten, soll sichtbar werden. Mit einer Mindestausbildungsvergütung, wie wir sie nun vorsehen, ist einerseits Wertschätzung der Leistung verbunden. Andererseits bleiben wir maßvoll, da wir weiterhin auch sehr wertschätzen, dass gerade unsere mittelständische Wirtschaft Hauptanbieter vieler toller Ausbildungsplätze ist.\n\n({3})\n\nDeshalb gilt der Tarifvorrang; denn dort, wo Sozialpartner Verantwortung für Ausbildungsvergütungen übernehmen, darf der Staat diese Verantwortung nicht schmälern.\n\n({4})\n\nEin dritter Punkt, den ich modern und innovativ finde, ist die Teilzeitausbildung. Im Zeitalter immer flexiblerer Lebensmodelle muss es möglich sein, eine Ausbildung auch in Teilzeit zu absolvieren. Deshalb ist diese Option jetzt für alle Auszubildenden offen. Wichtig ist, dass möglichst viele junge Menschen, egal in welcher familiären Situation sie sich befinden, eine Ausbildung für sich als guten Einstieg ins Berufsleben erkennen. Mit der Verbesserung bei der Teilzeitausbildung leisten wir auch dazu unseren Beitrag.\n\n({5})\n\nLiebe Kolleginnen und Kollegen, die duale Ausbildung wieder sichtbar in die Mitte unserer Gesellschaft zu rücken, ist mir ein Herzensanliegen. Denn erstens ist die duale Ausbildung ein Herzstück unserer Wirtschaft und damit unserer Gesellschaft, zweitens werden wir genau deshalb wieder mehr über die Qualität und die Leistungsfähigkeit dieses Bildungsweges für Wirtschaft und Gesellschaft sprechen, und drittens braucht eine Wirtschaft, die gerade so stark im Wandel steht, wie wir es aktuell erleben, flexible Ausbildungsmöglichkeiten. Praktische und theoretische Kenntnisse und Fähigkeiten sind gleichermaßen gefragt.\n\nDeshalb freue ich mich sehr, wenn wir heute hier eine Novelle beschließen, die Wertschätzung, Modernität und Innovationsfähigkeit verbindet. Deshalb bitte ich herzlich um Zustimmung zu diesem Gesetz.\n\n({6})"
