id,firstname,lastname,faction,position,date, url,speech
"1004236","Gesine","Lötzsch","DIE LINKE.","Member of Parliament","2018-03-16T00:00:00.000Z","https://dip21.bundestag.de/dip21/btp/19/19021.pdf","\n\nSehr geehrter Herr Präsident! Meine Damen und Herren! Wir diskutieren heute schon den zweiten Tag über Steuersenkungen für Besserverdienende. Ich finde das ist wirklich zu viel, meine Damen und Herren.\n\n({0})\n\nDie AfD und die FDP wollen den Solidaritätszuschlag abschaffen. Das ist nicht verwunderlich. Denn für beide Parteien ist ein starker Sozialstaat Teufelszeug. Ihr Mantra lautet: Steuersenkung – koste es, was es wolle.\n\nSie wollen einen schwachen Staat, weil Sie immer noch glauben – insbesondere Sie von der FDP –, dass der Markt alles regeln könne. Können Sie sich denn nicht zehn Jahre zurückerinnern? Dieser Irrglaube, diese Marktgläubigkeit, ist doch spätestens seit der Bankenkrise 2008 gründlich widerlegt.\n\n({1})\n\nDie Banken haben Milliarden verzockt, und der Staat – also die Bürgerinnen und Bürger dieses Landes – hat die Banken gerettet. Ich finde, das darf sich auf keinen Fall wiederholen.\n\n({2})\n\nDie FDP behauptet nun, mit der Abschaffung des Solidaritätszuschlages wolle sie die Bürger entlasten. Doch welche Bürger meinen Sie?\n\n({3})\n\n– Nein, Sie entlasten nicht alle. Ein Single muss mehr als 1 500 Euro brutto im Monat und eine vierköpfige Familie mehr als 4 000 Euro verdienen, um überhaupt den Soli zahlen zu müssen. Diese Menschen werden durch die Abschaffung des Soli nicht entlastet.\n\nWas Sie wirklich wollen, meine lieben Kolleginnen und Kollegen von der FDP, ist: Sie wollen die Reichen – das reichste Zehntel – in unserem Land weiter entlasten.\n\n({4})\n\nDas ist bekanntermaßen die Spezialität der FDP: Denen, die schon jetzt nicht mehr wissen, wohin mit dem Geld, wollen Sie noch mehr Geld geben.\n\nIch dachte, Sie hätten aus der Mövenpick-Spende gelernt, die dazu geführt hat – falls es jemand vergessen haben sollte –, dass Sie damals in den Koalitionsverhandlungen die Senkung des Mehrwertsteuersatzes für Hotelübernachtungen durchgesetzt haben.\n\n({5})\n\nIch dachte, Sie hätten aus dieser Mövenpick-Spende gelernt.\n\n({6})\n\nSie sind seitdem die Mövenpick-Partei, und ich denke, die Bürgerinnen und Bürger dieses Landes sollten das nicht vergessen.\n\n({7})\n\nAls Haushälterin muss ich mich auch wundern, dass Sie mutwillig Lücken in den Haushalt reißen wollen, ohne Ideen zu haben, wie Sie diese Lücken schließen können. Denn nur auf eine brummende Konjunktur zu setzen, ist ziemlich fahrlässig, meine Damen und Herren.\n\n({8})\n\nAuch die Koalition will den Solidaritätszuschlag abschaffen. Sie lässt sich aber etwas mehr Zeit dafür. Ich glaube, an dieser Stelle müssen wir auf den Kardinalfehler des Koalitionsvertrages zu sprechen kommen, der durch die Abschaffung des Solis noch verstärkt wird: Sie waren wieder nicht bereit, eine wirklich gerechte Steuerreform durchzuführen. Das ist aber die eigentliche Aufgabe, vor der dieses Land steht, meine Damen und Herren.\n\n({9})\n\n45 Deutsche besitzen so viel wie die gesamte ärmere Hälfte der Bevölkerung zusammen. Das kann doch nicht gerecht sein. So kann sich ein Land nicht gut entwickeln, und hier muss man ansetzen.\n\n({10})\n\nKolleginnen und Kollegen von der SPD, Sie sind doch mit dem Versprechen einer Vermögensteuer und der Forderung nach mehr Gerechtigkeit in den Wahlkampf gezogen. Das ist heute leider alles vergessen.\n\nAnders die Bundeskanzlerin: Sie hat den sogenannten Familienunternehmen im Wahlkampf versprochen, dass es keine Vermögensteuer geben wird. Punktsieg für die Kanzlerin – wieder einmal. An dieser Stelle muss man für die Öffentlichkeit eines sagen: „Familienunternehmen“ ist ein niedliches Wort. In anderen Ländern nennen wir sie „Oligarchen“, und das trifft es viel besser.\n\n({11}): Ui, ui, ui! – Lisa Paus [BÜNDNIS 90/DIE GRÜNEN]: Russland zum Beispiel!)\n\nOhne eine wirklich gerechte Steuerreform werden wir in diesem Land auch keine gerechte Gesundheitspolitik, keine gerechte Arbeitsmarktpolitik und keine gerechte Rentenpolitik erreichen können.\n\n({12})\n\nMeine Damen und Herren, wir haben gegenwärtig Haushaltsüberschüsse. Wir haben die Möglichkeit, in Solidarität zu investieren. Dafür steht Die Linke: für ein solidarisches und soziales Land.\n\n({13})\n\nDafür kämpfen wir.\n\nHerzlichen Dank.\n\n({14})"
"1004609","Gesine","Lötzsch","DIE LINKE.","Member of Parliament","2018-03-22T00:00:00.000Z","https://dip21.bundestag.de/dip21/btp/19/19023.pdf","\n\nVielen Dank, Herr Präsident. – Meine sehr geehrten Damen und Herren! Herr Scholz, heute Morgen haben wir den Medien entnommen, dass Sie 2021 Bundeskanzler werden wollen. Vorhin haben Sie sinngemäß gesagt: Ein deutscher Finanzminister kennt kein Parteibuch, und Sie wollen die Politik von Ex-Finanzminister Schäuble eins zu eins fortsetzen. – Da frage ich mich: Für welche Partei wollen Sie eigentlich Bundeskanzler werden? Die SPD kann ja nicht gemeint gewesen sein.\n\n({0})\n\nIn allen Debatten hat die schwarze Null eine große Rolle gespielt. Natürlich werde auch ich etwas dazu sagen. Was mich an dieser Diskussion besonders ärgert, ist, dass die ganze Debatte um die schwarze Null nur dazu dient, davon abzulenken, dass bei uns, in der Bundesrepublik Deutschland, die Steuern nicht gerecht erhoben werden. Und das ist der Kardinalfehler.\n\n({1})\n\nSie wollen keine gerechte Steuerreform, obwohl die SPD im Wahlkampf insbesondere darauf verwiesen hat, dass sie die Vermögensteuer durchsetzen will. Wir sollten uns einmal in der Welt umgucken: 27 der 33 wirtschaftlich entwickelten Staaten besteuern Vermögen höher als Deutschland. Wir sind also Schlusslicht bei der gerechten Verteilung von Reichtum, und das finde ich unangemessen für unser Land.\n\n({2})\n\nEs ist wirklich Zeit, Reichtum umzuverteilen, um die weitere Spaltung der Gesellschaft zu verhindern.\n\nDie Bundeskanzlerin, Frau Merkel, hat gestern in ihrer Regierungserklärung gesagt: Es ist eine Schande für Deutschland, dass es Kinderarmut gibt. – Ja, da hat sie recht. Aber sie ist seit 2005 Bundeskanzlerin, und sie ist persönlich mit ihrer Regierung für diesen Zustand verantwortlich. Dieser Verantwortung muss sie sich stellen.\n\n({3})\n\nMit diesem Koalitionsvertrag und den Vorhaben, die hier vorgetragen worden sind, stellt man sich dieser Verantwortung nicht. Ja, es ist richtig: Sie haben einige Maßnahmen ergriffen. Mein Kollege und Fraktionsvorsitzender Dietmar Bartsch hat das gestern schon positiv benannt. Das muss ich jetzt also nicht wiederholen.\n\nAber was wir brauchen, um Kinderarmut zu bekämpfen, ist eine deutliche Erhöhung des Kindergeldes, und zwar für alle. Auch die Menschen, die Hartz IV beziehen, müssen von der Kindergelderhöhung profitieren. Alles andere ist absurd. Es ist eine absurde Ungerechtigkeit, und das werden wir als Linke niemals akzeptieren, meine Damen und Herren.\n\n({4})"
"1004611","Gesine","Lötzsch","DIE LINKE.","Member of Parliament","2018-03-22T00:00:00.000Z","https://dip21.bundestag.de/dip21/btp/19/19023.pdf","\n\nNein. – Wir brauchen eine eigenständige Kindergrundsicherung. Das ist ein Weg, den wir in dieser Gesellschaft gemeinsam einschlagen müssen. Und wir brauchen natürlich auch die Unterstützung von Familien, insbesondere von Alleinerziehenden. Sie werden viel zu oft alleingelassen, und das darf nicht sein, meine Damen und Herren.\n\n({0})\n\nWir haben gestern die Diskussionen verfolgt, wofür mehr Geld ausgegeben werden soll. Die Bundeskanzlerin hat etwas vornehm formuliert, dass man mehr Geld für Rüstung brauche. Wer nicht genau zugehört hat, konnte das vielleicht überhören. Aber ich finde es völlig unverantwortlich, dass weiterhin mehr Geld in die Rüstung gesteckt werden soll. Das macht nur die Rüstungsunternehmen reich. Die Menschen in unserem Land haben nichts davon. Ganz im Gegenteil: Unser Leben wird durch mehr Rüstung und Rüstungsexporte noch unsicherer. Das können wir nicht akzeptieren, meine Damen und Herren.\n\n({1})\n\nHerr Scholz, Sie haben über Ost-West gesprochen und gesagt: Mit der deutschen Einheit sind wir so weit gekommen, dass im Prinzip vieles gut ist. – Aber ich frage Sie: Können Sie nicht sehen, dass wir noch immer keine gleichen Löhne haben? Wir haben noch immer keine gleichen Renten. Wir haben noch immer keine gleiche Verteilung von Zukunftschancen in unserem Land.\n\nWenn wir uns alle möglichen Parameter, zu Einkommen, Vermögen oder zur Verteilung von Unternehmen, in unserem Land anschauen, dann sehen wir eine krasse Ost-West-Spaltung, und die wird nicht kleiner, sondern größer. Das dürfen wir doch nicht hinnehmen. Das kann man doch nicht ignorieren. Die Linke steht für das gesamte Land, und sie steht dafür, dass auch der Osten gerecht behandelt wird.\n\n({2})\n\nSie haben – das haben etliche Kollegen schon erwähnt; aber ich will es trotzdem auch noch einmal ansprechen – als eine der ersten Amtshandlungen im Finanzministerium durchgesetzt, dass in den Ministerien 209 hochdotierte Stellen geschaffen werden. Herr Seehofer, der schon angesprochen wurde, bekommt einen zusätzlichen Heimatstaatssekretär und eine Abteilung „Heimat“ mit drei Unterabteilungen: „Raumordnung“, „Gesellschaftlicher Zusammenhalt“ und „Gleichwertigkeit der Lebensverhältnisse“. Ich frage mich wirklich: Hat sich denn vorher in den Ministerien niemand um diese Themen gekümmert? – Augenscheinlich nicht! Aber es ist ein absolutes Armutszeugnis, dass wir zu einer derartigen Situation gekommen sind. Man kann viel über die Bundesregierung sagen, auf jeden Fall ist sie nicht besonders klein. Die Selbstbedienungsmentalität, die bei den erwähnten hochdotierten Stellen zum Ausdruck kommt – mehr Häuptlinge, weniger Indianer –, ist eine Verhöhnung aller Menschen, die nicht wissen, wie sie mit ihrem Geld über den Monat kommen sollen.\n\nWir als Linke stehen als soziale Opposition für die Menschen, die geringe Renten haben, die nicht wissen, wovon sie ihre Mieten zahlen sollen. Wir setzen uns dafür ein, dass es in diesem Land gerecht zugeht. Ein gerechtes Land ist – das ist meine tiefe Überzeugung – besser für alle, nicht nur für die Menschen, die wenig haben, sondern auch für die Mittelschicht und die Reicheren. Den Reicheren sollte es ein Herzensanliegen sein, zu einem gerechten Land beizutragen.\n\nHerzlichen Dank.\n\n({3})"
"1006739","Gesine","Lötzsch","DIE LINKE.","Member of Parliament","2018-05-15T00:00:00.000Z","https://dip21.bundestag.de/dip21/btp/19/19031.pdf","\n\nVielen Dank, Herr Präsident. – Meine sehr geehrten Damen und Herren! Der Titel des Koalitionsvertrages lautet: „Ein neuer Aufbruch für Europa – Eine neue Dynamik für Deutschland – Ein neuer Zusammenhalt für unser Land“.\n\n({0})\n\nAber, meine Damen und Herren, nichts, aber auch gar nichts davon ist mit diesem Haushalt eingelöst.\n\n({1})\n\nDas ist nicht nur eine Blamage für Olaf Scholz, sondern vor allem fatal für die Menschen in unserem Land. Sie beten weiter das Mantra von der schwarzen Null herunter. Ich frage mich, warum die SPD unbedingt das Finanzministerium übernehmen wollte, wenn sie die Politik von Wolfgang Schäuble eins zu eins weiterführen will.\n\n({2})\n\nSie versuchen, den Menschen einzureden, mit der schwarzen Null wären alle Probleme gelöst. Nein, damit fangen viele Probleme erst einmal an. Wir als Linke sagen Ihnen: Wir brauchen endlich ein gerechtes Steuersystem. Die SPD hat im Wahlkampf die Einführung der Vermögensteuer gefordert, wollte Steuerschlupflöcher schließen. Davon ist nichts mehr zu hören, und das ist falsch, meine Damen und Herren.\n\n({3})\n\nIch sage Ihnen: Wenn die Vermögenden nicht stärker besteuert werden, werden Armut und Vermögen in unserem Land zunehmen. Das spaltet unser Land, und das können wir nicht hinnehmen.\n\n({4})\n\nSie investieren – trotz aller schönen Worte, die Sie hier gefunden haben, Herr Scholz – weniger als nötig in die Zukunft. Das ist rücksichtslos gegenüber nachfolgenden Generationen, meine Damen und Herren.\n\n({5})\n\nDer Deutsche Städtetag hat berechnet, dass allein in den Kommunen ein Investitionsstau von 126 Milliarden Euro herrscht. Das heißt, es müssen dringend Schulen, Kindergärten, Krankenhäuser, Straßen, Brücken saniert oder neu gebaut werden. Dem Bürger ist es doch egal, wer für welche Aufgabe zuständig ist – er will, dass das Land funktioniert, und darauf hat er auch ein Anrecht, meine Damen und Herren.\n\n({6})\n\nDieser Haushalt ist auch schlecht für Europa. In der Finanzkrise hat die Bundesregierung 280 Milliarden Euro an Zinsen eingespart. Das ist fast der Bundeshaushalt für ein ganzes Jahr. Deutschland ist damit Gewinner der Finanzkrise, und die Bundesregierung hat mit ihrer Kürzungspolitik reihenweise Verlierer produziert. Natürlich wird jetzt in Europa genau beobachtet, wie sich die Bundesregierung verhält: Investiert sie in europäische Solidarität, oder handelt sie weiter nach dem Prinzip „Jeder ist sich selbst der Nächste“? Gibt sie weiter den strengen Zuchtmeister? Wir wissen doch alle, dass die Kürzungsvorgaben der Bundesregierung die Krise in vielen europäischen Ländern verschärft hat. Das dürfen wir nicht weiter zulassen, meine Damen und Herren.\n\n({7})\n\nVöllig verantwortungslos ist die weitere Erhöhung der Rüstungsausgaben. 2016 gaben Sie für das Militär 35,1 Milliarden Euro aus, und innerhalb von nur neun Jahren wollen Sie die Ausgaben fast verdoppeln. Ich frage Sie: Wo ist der Feind der NATO, der im gleichen Zeitraum seine Militärausgaben verdoppeln will? Ich sehe ihn nicht, meine Damen und Herren.\n\n({8})\n\nFür Rüstungsunternehmen wie Rheinmetall oder Airbus ist mehr Geld für die Bundeswehr natürlich ein Segen, für alle anderen ein Fluch. Denn damit bleibt Deutschland Teil des Wettrüstens; damit tragen Sie auch Verantwortung für die weitere Destabilisierung des Friedens in der Welt. Und damit muss endlich Schluss sein.\n\n({9})\n\nSchluss sein muss auch mit den Waffenlieferungen nach Saudi-Arabien und in die Türkei. Viele haben sich ja nun aufgeregt, dass sich zwei Fußballspieler mit Erdogan fotografieren ließen – kann man machen.\n\n({10})\n\n– Sich darüber aufregen. – Viel schlimmer finde ich es, wenn Frau Merkel und Frau von der Leyen mit Erdogan Waffendeals abschließen und damit den Weltfrieden gefährden.\n\n({11})\n\nIch sage Ihnen: Mehr Fußball und weniger Panzer, das wäre besser für uns alle.\n\n({12})\n\nMeine Damen und Herren, ist es wirklich so schwer, zu verstehen, dass unser Land, das extrem von Exporten abhängig ist, alles tun muss, um kalte und heiße Kriege zu vermeiden? Ist es wirklich so schwer, zu verstehen, dass die extreme Exportabhängigkeit unseres Landes in Handelskriegen zum Problem wird?\n\nMeine Damen und Herren, lassen Sie uns den Haushalt in den Haushaltsberatungen vom Kopf auf die Füße stellen. Sorgen wir für mehr Exportunabhängigkeit, sorgen wir für mehr Investitionen, sorgen wir für eine bessere Zukunft und mehr Sicherheit für unser Land.\n\nVielen Dank.\n\n({13})"
"1007291","Gesine","Lötzsch","DIE LINKE.","Member of Parliament","2018-05-17T00:00:00.000Z","https://dip21.bundestag.de/dip21/btp/19/19033.pdf","\n\nVielen Dank. – Herr Präsident! Meine sehr geehrten Damen und Herren! Am 4. Oktober 1957 ereilte die USA etwas, was in die Geschichte als Sputnik-Schock eingegangen ist. Was war geschehen? Der damaligen Sowjetunion war es gelungen, ein unbemanntes Raumschiff, den Sputnik, ins All zu schicken. Niemand in den USA hatte das der Sowjetunion zugetraut. Die Schlussfolgerungen in den USA waren allerdings bemerkenswert und sind für uns noch heute lehrreich. Es wurde nämlich ein breites Stipendienprogramm aufgelegt, und zwar ausdrücklich für Kinder aus Nichtakademikerfamilien. Man hatte erkannt, dass es nicht reicht, wenn sich die Eliten nur aus sich selbst rekrutieren. Ich finde, diese Idee müssen wir aufgreifen, meine Damen und Herren.\n\n({0})\n\nDie Bildungsmauer zwischen oben und unten in unserem Land ist hoch, unverantwortlich hoch. Von 100 Kindern aus Akademikerfamilien beginnen, statistisch gesehen, 79 ein Hochschulstudium. Bei Nichtakademikern schaffen gerade einmal 27 von 100 Kindern den Sprung an die Hochschule. Das sind die Ergebnisse einer aktuellen Untersuchung des Deutschen Zentrums für Hochschul- und Wissenschaftsforschung. An der Ungleichverteilung der Aufstiegschancen hat sich in den letzten elf Jahren kaum etwas verändert. Frau Ministerin, es ist Ihre Aufgabe, diese Bildungsmauern endlich niederzureißen.\n\n({1})\n\nFür Eltern, die wenig Geld haben, bedeutet ein Studium der Kinder ein großes Risiko. Das darf nicht sein. Darum fordert Die Linke ein elternunabhängiges BAföG. Wir können das finanzieren, wenn wir uns von der roten Null verabschieden und Reichtum endlich gerecht besteuern.\n\n({2})\n\nIn der Wissenschaft selbst und in der Gesellschaft insgesamt wird über eine Glaubwürdigkeitskrise der Wissenschaft diskutiert. Ja, wir müssen Wissenschaft neu denken. Frau Ministerin, Sie haben in mehreren öffentlichen Veranstaltungen die Wissenschaft aufgefordert, stärker zu kommunizieren und zu erklären. Doch ich glaube, wir haben nicht nur ein Kommunikationsproblem. Ich möchte mit Erlaubnis des Präsidenten an dieser Stelle den Klimaforscher Hans Joachim Schellnhuber zitieren.\n\n({3})\n\nEr schreibt in der Auseinandersetzung mit Donald Trump und den Leugnern des Klimawandels\n\n({4})\n\n– ja, da melden sich die Richtigen zu Wort –:\n\n… die Gründungsväter der Aufklärung erklärten … mit Nachdruck, dass Erkenntnis ohne Ethik wertlos ist. Diese Ethik stellt an Forscher zwei Ansprüche. Nämlich sich bei der Suche nach der Wahrheit nicht von Interessen beeinflussen zu lassen. Und die aufgefundenen Wahrheiten nach Maßgabe der humanistischen Werte in den Dienst der Gesellschaft zu stellen. Das bedeutet, Mitverantwortung für die Nutzung … der eigenen Erkenntnisse zu übernehmen.\n\nDem kann ich nur voll zustimmen, meine Damen und Herren.\n\n({5})\n\nIm Augenblick muss sich die Wissenschaft gegen Falsch­meldungen wehren; sie muss sich aber auch gegen einen großen Verwertungsdruck wehren. Wir müssen hier als Politikerinnen und Politiker an ihrer Seite stehen und die Wissenschaft davor schützen, von Konzernen immer mehr in ihren Dienst gezwungen zu werden.\n\n({6})\n\nWas für VW oder BASF gut ist, muss automatisch auch für die Gesellschaft gut sein! Wir wissen doch alle, meine Damen und Herren, dass dem nicht so ist. Wir brauchen keine Appelle der Bundesregierung an die Wissenschaft. Wir brauchen verlässliche Rahmenbedingungen. Viele Wissenschaftlerinnen und Wissenschaftler hangeln sich von einer befristeten Stelle zur nächsten; das darf so nicht weitergehen.\n\n({7})\n\nSie sind gezwungen, wertvolle Zeit mit endlosen Projektanträgen und für die Einwerbung von Drittmitteln zu verschwenden.\n\nIm Grundgesetz steht:\n\nKunst und Wissenschaft, Forschung und Lehre sind frei.\n\nAber – das muss ich hinzufügen –: nicht frei von den Gesetzen des Kapitalismus. Mein Appell: Verteidigen wir das Grundgesetz, und zwar in seinem Wortlaut!\n\nVielen Dank.\n\n({8})"
"1007333","Gesine","Lötzsch","DIE LINKE.","Member of Parliament","2018-05-18T00:00:00.000Z","https://dip21.bundestag.de/dip21/btp/19/19034.pdf","\n\nVielen Dank. – Herr Präsident! Meine sehr geehrten Damen und Herren! Die Größe des Einzelplans Arbeit und Soziales täuscht; denn von den knapp 139 Milliarden Euro fließen fast 100 Milliarden Euro in die Rente; das wurde hier schon gesagt. Damit bleiben also nur 39 Milliarden Euro für Arbeitsförderung und Soziales übrig. Das ist weniger, als die Bundeswehr bekommt, und das ist doch ein klares Missverhältnis.\n\n({0})\n\nWir alle wissen doch, dass der innere Friede nicht durch massive Aufrüstung gesichert werden kann. Inneren Frieden gibt es nur, wenn die soziale Spaltung in unserem Land überwunden wird. Ein wichtiger Schritt, um diese Spaltung aufzuheben, wäre endlich eine gerechte und soziale Rente, und zwar sehr schnell und nicht auf die lange Bank geschoben.\n\n({1})\n\nIn meine Sprechstunde kam eine Rentnerin und rechnete mir vor, dass sie nach der Rentenerhöhung 10 Euro weniger im Monat hat, weil ihr aufgrund der Rentenerhöhung das Wohngeld von 70 auf 29 Euro gekürzt wurde. Das ist sicher kein Einzelfall. Das schafft Frust und Ärger.\n\nWir müssen auch sehen: Das Armutsrisiko der Neurentner steigt und steigt, von derzeit 16,2 Prozent auf demnächst 20,2 Prozent. In Anbetracht dieser Entwicklung müssen doch wirklich alle Alarmglocken schrillen, und wir dürfen nicht die Jungen gegen die Alten ausspielen, meine Damen und Herren.\n\n({2})\n\nWenn wir uns einmal anschauen, wen die Bundesregierung sanktioniert und wen nicht, dann können wir ein klares Muster erkennen: Wer schwach und schlecht organisiert ist, der muss mit Sanktionen rechnen. Wer dagegen mächtig und gut organisiert ist, muss keine Sanktionen fürchten. Sie sanktionieren die Schwachen, um in der Gesellschaft als harte Hunde und Beschützer der Steuergelder dazustehen. Aber Demütigungen – und nichts anderes sind Sanktionen für Arbeitslose – schaffen Frust und Hass, und das ist nicht gut für den Zusammenhalt unserer Gesellschaft.\n\n({3})\n\nWie zahm die Bundesregierung vorgeht, haben wir doch gerade bei der Rede von Minister Heil gehört. Sie haben auf ein Unternehmen geschimpft, haben sich aber nicht einmal getraut, den Namen dieses Unternehmens öffentlich im Bundestag zu nennen. Sagen wir es laut und deutlich: Das Unternehmen heißt Deliveroo. Ich erwarte von einem Minister, dass er das auch so klar sagt.\n\n({4})\n\nIch kann mich auch nicht erinnern, dass der ehemalige Wirtschaftsminister Gabriel jemals einem Unternehmen mit Sanktionen gedroht hat oder sie gar umgesetzt hätte. Das wäre natürlich auch schlecht für die politische Laufbahn gewesen und auch dafür, hinterher einen guten Posten wie jetzt bei Siemens oder anderen Konzernen zu ergattern.\n\n({5})\n\nIch nenne dieses Vorgehen nachgelagerte Bestechung, und damit muss Schluss sein.\n\nOder welche Sanktionen gibt es von Frau von der Leyen gegen Rüstungsunternehmen, die Schrott liefern? Ich sage nur A400M und Eurofighter. Wer der Bundeswehr Schrott verkauft, wird mit neuen Aufträgen versorgt. Das darf nicht so weitergehen, meine Damen und Herren.\n\n({6})\n\nWir als Linke wollen eine solidarische sanktionsfreie Mindestsicherung, und der erste Schritt muss sein, endlich mit diesen schändlichen Sanktionen Schluss zu machen.\n\n({7})\n\nEs ist richtig, Herr Minister Heil, Vollbeschäftigung anzustreben. Allerdings müssen wir auch der Öffentlichkeit die Frage beantworten, zu welchen Bedingungen die Menschen arbeiten sollen. Wie ist denn jetzt die Realität? Armut trotz Arbeit ist keine Einzelerscheinung. Der Arbeitsmarktforscher Gerhard Bosch von der Universität Duisburg-Essen kritisiert, dass gegen den gesetzlichen Mindestlohn besonders oft in prekären Verhältnissen verstoßen wird. Etwa 1,8 Millionen Anspruchsberechtigte erhalten weniger als 8,50 Euro in der Stunde. Das ist doch eine Schande für unser Land.\n\n({8})\n\n– Ja, aber er wird nicht allen gezahlt. Das habe ich ja gerade vorgetragen. Zuhören, gnädiger Herr!\n\n({9})\n\n– Wenn er mich mit „gnädige Frau“ anspricht, kann ich genauso antworten.\n\n({10})\n\nBei Minijobbern ist der Anteil der Betroffenen, die um ihren Lohn betrogen werden, besonders hoch. Er liegt bei 43,4 Prozent. Herr Heil, Sie müssen etwas dafür tun, dass die Menschen von ihrer Arbeit leben können. Sie müssen die Kontrolle verstärken und Arbeitgeber, die betrügen, sanktionieren. Das wären die richtigen Maßnahmen.\n\n({11})\n\nEinen öffentlichen Beschäftigungssektor zu schaffen, wie es jetzt geplant ist, ist gut. Das ist eine alte Forderung der Linken. Wir müssen dafür allerdings auch genügend Geld einstellen. Wenn der Bundesagentur für Arbeit jetzt schon 1 Milliarde Euro an Personalmitteln fehlen und sie sich diese Mittel an anderer Stelle nimmt, dann fehlt das Geld bei den Arbeitslosen.\n\nWir brauchen einen öffentlichen Beschäftigungssektor. Wir müssen ihn schaffen, und wir müssen ihn gut organisieren. Dafür müssen wir genügend Geld in den Haushalt einstellen. Sonst sind das alles leere Worte.\n\nHerzlichen Dank.\n\n({12})"
