id,firstname,lastname,faction,position,date, url,speech
"1042733","Gesine","Lötzsch","DIE LINKE.","Member of Parliament","2020-06-19T00:00:00.000Z","https://dip21.bundestag.de/dip21/btp/19/19167.pdf","\n\nVielen Dank, Herr Präsident. – Meine sehr geehrten Damen und Herren! Zu Anfang der Krise wurde gerne gesagt: Vor dem Virus sind wir alle gleich. – Dieser Satz war von Anfang an falsch; denn die Krise hat die sozialen Unterschiede nicht nur deutlicher gemacht, sondern sie auch vertieft, und das nehmen wir als Linke nicht hin, meine Damen und Herren.\n\n({0})\n\nEs sind ja eine Reihe von Regeln aufgestellt worden, zum Beispiel 1,50 Meter Abstand zu halten. Aber dazu sagen wir Ihnen: Diesen Abstand muss man sich erst einmal leisten können. Die Arbeiter in der Fleischindustrie, die so fürchterlich ausgebeutet werden, die Saisonarbeiter, die Geflüchteten in den Sammelunterkünften, die können sich diesen Abstand nicht leisten. Sie brauchen unsere Unterstützung. Davon finde ich nichts in diesem Paket, und das muss sich ändern, meine Damen und Herren.\n\n({1})\n\nUnser Anspruch als Linke an das Konjunkturpaket ist ganz deutlich: Wir wollen die Menschen unterstützen, die unter der Pandemie am meisten zu leiden haben, und die, die am meisten geleistet haben. Das Konjunkturprogramm erfüllt diesen Anspruch noch nicht. Wir werden auf jeden Fall im Ausschuss kräftig nachbessern müssen, und dazu rufe ich Sie alle auf, meine Damen und Herren.\n\n({2})\n\nWir fordern mehr Geld für Menschen, die in systemrelevanten Berufen arbeiten. Wir wollen einen dauerhaften Risikozuschlag für das Pflegepersonal. Klatschen allein hilft nicht, meine Damen und Herren vom marktradikalen Flügel.\n\n({3})\n\nWir wollen, wie die Sozialverbände es auch fordern, einen Pandemiezuschlag von 100 Euro für Menschen, die von Grundsicherung leben müssen, und zwar für alle. Wir sehen es doch alle: Die Tafeln sind geschlossen. Arme Rentner haben keine Möglichkeit mehr, dorthin zu gehen, und sie sind von den steigenden Lebensmittelpreisen überfordert. Sie brauchen dringend unsere Hilfe. – Auch hier müssen wir in den Ausschussberatungen nachbessern.\n\n({4})\n\nMeine Damen und Herren, jetzt ist auch endlich Zeit, die Grundrente zu beschließen. Die Union, also CDU und CSU, sagt ja, das hätte nichts mit Corona zu tun. Aber da frage ich Sie: Was hat denn der Bau von Mehrzweckkampfschiffen für die Bundeswehr mit der Bekämpfung von Corona zu tun? Gar nichts!\n\n({5})\n\nIn der vergangenen Sitzung des Haushaltsausschusses wurden gegen unsere Stimmen fast 9 Milliarden Euro für Kriegsmaterial beschlossen. Doch Kriegsschiffe und andere Waffen werden Corona nicht besiegen. Das darf nicht sein. Kein Konjunkturprogramm für die Rüstungsindustrie, meine Damen und Herren!\n\n({6})\n\nUnd wir können auch nicht im Windschatten der Pandemie Wünsche von Präsident Trump erfüllen. Das darf nicht sein.\n\n({7})\n\nNun ist ja hier mehrfach von der schwarzen Null gesprochen worden. Kollege Jung hat davon gesprochen, andere auch. Ich will hier mal mit einer Legende aufräumen: Die CDU behauptet, dass wir uns Kredite jetzt leisten könnten, weil wir vorher kräftig gespart hätten. Das ist natürlich völliger Unsinn. Die schwarze Null ist eine sehr deutsche Erfindung. Zum Beispiel Japan und die Vereinigten Staaten von Amerika haben diese unsinnige Politik nie verfolgt und haben jetzt trotzdem vergleichbare Konjunkturprogramme gestartet. Sie wollen jetzt das Konjunkturprogramm als Zukunftspaket verkaufen. Ich sage: Das ist nichts anderes als ein Reparaturpaket. Sie versuchen, das wiederaufzubauen, was Sie mit Ihrer schwarzen Null eingerissen haben, und dafür reicht kein Nachtragshaushalt.\n\n({8})\n\nAn dieser falschen Politik der schwarzen Null, an Ihrer Kürzungspolitik werden noch mehrere Generationen zu leiden haben.\n\nZum Abschluss, meine Damen und Herren, will ich ganz deutlich sagen: Es droht Wahlbetrug. Die Regierungsparteien tun jetzt so, als könnten sie Geschenke verteilen. Aber sie sagen nicht, wer nach der Wahl die Rechnung bezahlen soll, und diese Rechnung wird präsentiert werden. Wir sagen, was wir wollen: Wir wollen eine einmalige Vermögensabgabe auf die größten Vermögen für die 1 Prozent Reichsten in unserem Land. Es kann nicht sein, dass der Milliardär und Lufthansa-Großaktionär Thiele mit staatlicher Hilfe noch reicher wird. Diese Krisengewinnler müssen wir besteuern.\n\nWir haben viel zu tun im Ausschuss. Wir sind bereit und vorbereitet. Der Nachtragshaushalt muss für soziale Gerechtigkeit sorgen.\n\nVielen Dank.\n\n({9})"
"1043321","Gesine","Lötzsch","DIE LINKE.","Member of Parliament","2020-07-02T00:00:00.000Z","https://dip21.bundestag.de/dip21/btp/19/19170.pdf","\n\nHerr Präsident! Meine sehr geehrten Damen und Herren! Seit Monaten bewegen wir hier gigantische Summen. Aber bei Menschen, die in Armut leben, kommt wenig oder gar nichts an, und das kann nicht richtig sein, meine Damen und Herren.\n\n({0})\n\nDie Linke fordert einen Pandemiezuschlag in Höhe von 200 Euro pro Monat für Menschen, die von Hartz IV oder Grundsicherung leben müssen. Das wäre christlich und sozial, meine Damen und Herren von der Union.\n\n({1})\n\nUlrich Schneider, der Hauptgeschäftsführer des Paritätischen Wohlfahrtsverbandes, hat uns vorgerechnet: Bei voller Weitergabe der Mehrwertsteuersenkung – aber nur bei dieser! – hätte ein Hartz-IV-Empfänger dann 8,52 Euro mehr im Monat. Arme Menschen, die keinen Anspruch auf kostenfreie Masken haben, könnten sich also davon gerade einmal acht Einmalmasken kaufen, um sich vor dem Virus zu schützen. Auch dieses Beispiel zeigt, dass wir vor dem Virus nicht alle gleich sind, meine Damen und Herren.\n\n({2})\n\nIch denke auch an die vielen Menschen, die im Niedriglohnsektor arbeiten müssen. In der Mehrheit sind das Frauen. Frauen sind die Hauptverliererinnen dieser Krise, und das können wir als Linke nicht hinnehmen.\n\n({3})\n\nWenn diese Niedriglöhnerinnen und Niedriglöhner jetzt hören, dass der Mindestlohn zum 1. Januar 2021 um 15 Cent pro Stunde angehoben werden soll, dann muss das doch wie Hohn in ihren Ohren klingen. Der Mindestlohn soll bis 2022 auf 10,45 Euro steigen. Das müssen wir uns mal vor Augen halten: In siebeneinhalb Jahren eine Steigerung von 1,95 Euro. Das ist wirklich nicht genug, und darum fordern wir als Linke einen Mindestlohn von 12 Euro, und zwar sofort.\n\n({4})\n\nGerade Menschen im Niedriglohnsektor sind besonders hart von Arbeitslosigkeit betroffen. Nicht alle haben Anspruch auf Kurzarbeitergeld; Minijobber haben darauf gar keinen Anspruch. Doch auch das Kurzarbeitergeld reicht für viele Menschen nicht, um ihren Lebensunterhalt zu sichern. Eine Küchenhilfe zum Beispiel mit einem Nettoeinkommen von 1 300 Euro im Monat bekommt 780 Euro Kurzarbeitergeld. Wenn man dann die Miete abrechnet, ist mit dem Geld im Monat nicht mehr viel zu machen.\n\nKollege Rehberg hat ja an alle appelliert, sie sollen jetzt mal ordentlich einkaufen gehen. Ich glaube, Menschen mit diesem Einkommen haben andere Sorgen, als in Einkaufscenter zu fahren. Sie müssen Essen und Trinken kaufen und können nicht mit dem Auto irgendwo hinfahren und die Taschen vollhauen. Das war, glaube ich, für viele ein etwas zynischer Appell, Kollege Rehberg.\n\n({5})\n\nBesonders hart trifft die Krise den Einzelhandel und die Gastronomie. Jetzt, im Windschatten der Pandemie, sollen 62 der 172 Kaufhof-Filialen geschlossen werden. 6 000 Beschäftigte, darunter wiederum viele Frauen, fürchten um ihre Arbeitsplätze. Die Vertreter des marktradikalen Flügels zucken da nur mit den Schultern. Wir aber sagen: Lebendige Städte brauchen eine lebendige Verkaufskultur, und Amazon schafft Geisterstädte. Das wollen wir verhindern, meine Damen und Herren.\n\n({6})\n\nWir hatten ja am Montag eine Anhörung im Haushaltsausschuss. Da haben uns viele Ökonomen kluge Sachen gesagt. Zum Beispiel hat die Ökonomin Friederike Spiecker darauf verwiesen – ich darf zitieren, Herr Präsident –:\n\nWer in einer fragilen gesamtwirtschaftlichen Situation Lohnzugeständnisse gegen Beschäftigungserhalt einzutauschen versucht, scheitert gesamtwirtschaftlich.\n\nUnd darum, sagen wir Ihnen, ist unsere Forderung ökonomisch mehr als sinnvoll, das Kurzarbeitergeld auf einheitlich 90 Prozent des Nettoentgeltes anzuheben, meine Damen und Herren.\n\n({7})\n\nIn dieser Woche rief mich eine 85-jährige Rentnerin an. Sie war völlig entsetzt, dass von einer Rentenerhöhung von 24,18 Euro durch Gegenrechnung von Sozialleistungen nur 3,85 Euro übrig bleiben. Sie könne schon lange nicht mehr ins Theater gehen, und die Haare würde sie sich auch selbst schneiden. Die Rente reiche vorne und hinten nicht. So geht es vielen Armutsrentnern in Deutschland. Und das ist für unser reiches Land eine Schande, meine Damen und Herren.\n\n({8})\n\nDa grenzt es ja schon fast an ein Wunder, dass die Grundrente heute beschlossen werden soll. Die Union hat dem SPD-Minister bis zum Schluss ein Bein gestellt. Er geht jetzt etwas humpelnd vom Platz; denn die Kürzungswut der CDU hat dazu geführt, dass viele Menschen, die darauf gehofft hatten, die Grundrente nicht bekommen werden und in der Grundsicherung feststecken. Wir brauchen also endlich eine armutsfeste Rente. Das sind wir den Menschen in diesem Land schuldig, die ihr ganzes Leben lang gearbeitet haben. Die Linke fordert eine solidarische Mindestrente von 10,50 Euro im Monat.\n\n({9})\n\n- 1 050 Euro. Das war jetzt der Test, ob alle auch gut zuhören.\n\n({10})\n\nWir fordern also eine solidarische Mindestrente von 1 050 Euro im Monat.\n\n({11})\n\nIn unserem Entschließungsantrag fordern wir auch einen Rettungsschirm für Solo-Selbstständige und Studierende. Alle diese Forderungen sind begründet und finanzierbar.\n\nEs gibt ja einiges im Nachtragshaushalt, was auch wir unterstützen; darüber haben wir gestern im Ausschuss diskutiert. Aber anderes stößt auf unseren entschiedenen Widerstand. Sie von der Koalition wollen zum Beispiel rund 10 Milliarden Euro für verschiedene Kriegsgüter ausgeben. Wir brauchen diese Kriegsgeräte nicht, um unsere Sicherheit zu garantieren. Ich sage Ihnen, was das in Wirklichkeit ist: Das sind die teuersten Beruhigungspillen, die je einem cholerischen US-Präsidenten von der Bundesregierung angeboten wurden. Aber sie werden nicht wirken; da bin ich mir ganz sicher. Lassen Sie uns das Geld sinnvoller ausgeben! Gestern haben mir gegenüber wieder viele junge Menschen zum Ausdruck gebracht: Wir wollen eine soziale und eine ökologische Zukunft; wir wollen einen sozialen und ökologischen Umbau. – Das unterstützt Die Linke, meine Damen und Herren.\n\n({12})\n\nIch sage Ihnen auch: Die beste Sicherheitspolitik ist eine konsequente Friedenspolitik. Auch dafür steht Die Linke.\n\nIch will noch etwas zur Lufthansa sagen. Die Bundesregierung hat zugelassen, dass der Milliardär und Lufthansa-Großaktionär Thiele die Lufthansa in Geiselhaft genommen hat. Er hat sich bis zur außerordentlichen Hauptversammlung von Lufthansa gegen den Einstieg des Staates gewehrt. Er hat bis zum Schluss hoch gepokert, um noch mehr Zugeständnisse von der Bundesregierung zu erzwingen. Er befürchtete zu viel Einfluss des Staates auf die Lufthansa. Augenscheinlich haben die Minister Scholz und Altmaier dem Spekulanten Thiele versprochen, dass der Staat im Aufsichtsrat gar keine Rolle spielen wird, keine aktive Rolle, also: Klappe halten und zahlen. Ich finde, das ist der falsche Weg. So darf man mit 9 Milliarden Euro Steuermitteln nicht umgehen, meine Damen und Herren.\n\n({13})\n\nDie Lufthansa befindet sich jetzt in der Geiselhaft eines einzelnen raubeinigen Großaktionärs. Dessen oberstes Prinzip ist der Personalabbau. Ich finde, das muss die Bundesregierung verhindern. Wir können nicht so viel Geld in die Hand nehmen und dann zusehen, wie 22 000 Beschäftigte ihre Arbeit verlieren. Darauf haben wir nicht gewettet. Die Lufthansa muss kontrolliert werden. Unser Geld, unser Steuergeld darf nicht dafür verwendet werden, dass Arbeitslosigkeit entsteht. Dagegen müssen wir uns entschieden zur Wehr setzen, meine Damen und Herren.\n\n({14})\n\nEs ist auch klar, dass nach der Bundestagswahl die Rechnung präsentiert wird. Die Union leidet ja jetzt schon – auch das haben wir am Montag in der Anhörung bemerkt – unter der fehlenden schwarzen Null. Sie würde lieber heute als morgen wieder kräftig die Schuldenbremse wie Daumenschrauben anziehen. Unsere Position ist ganz klar: Die Schuldenbremse ist ein ökonomischer Irrweg. Wenn wir schon über das Grundgesetz in Zukunft mehrfach abstimmen, dann lassen Sie uns doch etwas Vernünftiges entscheiden, nämlich die Schuldenbremse endlich wieder aus dem Grundgesetz zu streichen.\n\n({15})\n\n– Ja, ja.\n\nWir wissen, dass 45 Deutsche genauso viel Vermögen haben wie die ärmere Hälfte der Bevölkerung insgesamt. Ich glaube, aus dieser Rechnung allein wird ganz deutlich, dass die Forderung der Linken nach einer Vermögensabgabe mehr als gerechtfertigt ist.\n\n({16})\n\nSie ist auch von unserem Grundgesetz gedeckt. Eines kann ich Ihnen versprechen: Die Linke wird immer für ein gerechtes, soziales und solidarisches Land kämpfen. Darauf können Sie sich verlassen.\n\n({17})"
"1045335","Gesine","Lötzsch","DIE LINKE.","Member of Parliament","2020-09-17T00:00:00.000Z","https://dip21.bundestag.de/dip21/btp/19/19176.pdf","\n\nVielen Dank. – Herr Präsident! Meine sehr geehrten Damen und Herren! Gleich zu Beginn möchte ich Bundesminister Altmaier zitieren, und zwar sagte er: „Wir“ – also die Bundesregierung – „haben viele Menschen beim Klimaschutz enttäuscht.“ Und da hat er recht. Ja, Sie haben uns wirklich enttäuscht.\n\nDie Bundesregierung hat aber nicht nur die junge Generation enttäuscht. Ich will an dieser Stelle, also gleich zu Anfang, ganz deutlich sagen: Wir als Linke unterstützen den globalen Klimastreik von Fridays for Future am 25. September 2020. Seien Sie alle dabei!\n\n({0})\n\nKlimaschutz ist aber nicht nur etwas für die jüngere Generation, sondern das ist etwas für alle Generationen. Ich möchte, dass auch mein 88-jähriger Vater unter vernünftigen Bedingungen leben kann, und ich glaube, diesen Anspruch sollte jeder haben.\n\nCDU/CSU und SPD haben aber auch die Menschen enttäuscht, die jeden Cent dreimal umdrehen müssen. Niemand in unserem Land darf Klimapolitik als Bedrohung erleben. Ich denke zum Beispiel an die vielen Mieterinnen und Mieter, die zu Recht fürchten müssen, nach einer teuren energetischen Gebäudesanierung ihre Miete nicht mehr bezahlen zu können. Klimaschutz darf nicht auf dem Rücken der Mieterinnen und Mieter ausgetragen werden. Das ist eine klare Forderung unserer Partei.\n\n({1})\n\nDie Bundesregierung hat auch all die Menschen enttäuscht, die vom Auto auf den öffentlichen Nahverkehr umsteigen wollen. Bei vielen blitzen doch nur die Mercedessterne in den Augen, wenn sie an Mobilität denken.\n\n({2})\n\nWir als Linke unterstützen das Bündnis von Verdi und den Umweltverbänden. Die Verdoppelung der Kapazität für Fahrgäste im öffentlichen Nahverkehr bis 2030, einschließlich guter Arbeit für die Beschäftigten, das ist doch ein gutes Ziel. Dafür sollten wir uns alle einsetzen, meine Damen und Herren.\n\n({3})\n\nHerr Altmaier, Ihr 20-Punkte-Plan hat nicht zur Stärkung Ihrer Glaubwürdigkeit beigetragen. Sie spielen doch mit gezinkten Karten. Einerseits versuchen Sie, die Grünen mit Hochglanzbroschüren als Koalitionspartner zu gewinnen;\n\n({4})\n\ndoch in Brüssel treten Ihre Parteifreunde auf die Umweltbremse. Im Europaparlament mobilisieren Abgeordnete der CDU gegen eine fortschrittliche Klimapolitik und stimmen zusammen mit Rechtsextremen und Klimaleugnern gegen Klimaziele. Das darf doch nicht wahr sein!\n\n({5})\n\nDamit fallen Sie, by the way, auch noch Ihrer Parteifreundin Ursula von der Leyen, die ja gestern ein Klimaziel ausgegeben hat – es könnte höher sein –, in den Rücken. Das ist ein doppeltes Spiel, und das sollten wir den Menschen auch ganz deutlich sagen.\n\nAußerdem, Herr Altmaier, kommt Ihr 20-Punkte-Plan exakt nach Verabschiedung der wichtigsten Gesetze zu diesem Thema, nämlich des Klimaschutzgesetzes und des Kohleausstiegsgesetzes. Sie gießen also erst Ihre verkorkste Klimapolitik in Beton, und dann versuchen Sie, sich ein grünes Mäntelchen umzuhängen. Ich glaube, das ist ein Widerspruch, und darauf sollte niemand hereinfallen.\n\nMeine Damen und Herren, die Journalistin Christine Dankbar setzt sich in der „Berliner Zeitung“ mit einer Offenbarung des Vorsitzenden der Unionsfraktion auseinander.\n\n({6})\n\nSie schreibt – ich zitiere –:\n\nEs geht diese Woche im Parlament um unsere Zukunft, versichert Brinkhaus. Darüber werde man reden. „Nicht über laufende Gesetze, nicht über den Haushalt.“ Das heißt kurz und ernüchternd: Diskutiert wird ausgiebig, beschlossen wird nichts.\n\nDie Kolumne heißt übrigens „Politiker im Quasselmodus“.\n\nDie Bundesregierung gibt sich also weiterhin verbal aufgeschlossen, verharrt aber weitgehend in einer Verhaltensstarre. Wir als Linke sagen deutlich: Wir brauchen endlich verbindliche Ziele, um eine Klimakatastrophe zu verhindern, damit es nicht zu spät ist.\n\n({7})\n\nNun wollen Sie die Klimaziele vorrangig durch marktwirtschaftliche Maßnahmen erreichen. Hierzu soll der europäische Emissionshandel reformiert werden; aber damit sind Sie doch bereits gescheitert. Es hat nicht funktioniert, und es ist auch unsozial.\n\n({8})\n\nWer sich in Zukunft teure Produkte mit einem hohen CO2-Preis leisten kann, der wird weiter zum Beispiel mit seinem Privatjet fliegen und mit dem ökologischen Zeigefinger auf die Menschen zeigen, die sich das nicht leisten können.\n\n({9})\n\nWir brauchen also zusätzlich Ordnungspolitik. Wir haben hier vor einiger Zeit 9 Milliarden Euro für die Lufthansa zur Verfügung gestellt. Wir als Linke haben gesagt: Das muss mit klaren Forderungen verbunden sein: Sicherung der Arbeitsplätze, Einstellung der Inlandsflüge. Das haben Sie nicht aufgegriffen, und das war ein schwerer Fehler. In Frankreich wurde in der Coronakrise die Air France unterstützt. Die Bedingung, die dort gestellt wurde, war: keine Inlandsflüge. – Wenn das in Frankreich geht, warum geht das in Deutschland nicht? Ich denke, das liegt nur an dieser Regierung, und das muss sich ändern, meine Damen und Herren.\n\n({10})\n\nDer Plan enthält natürlich auch sinnvolle Vorschläge. Herr Altmaier, Sie haben geschrieben, Sie wollen jedes Jahr einen bestimmten Prozentsatz des Bruttoinlandsproduktes für Klimaschutz und Wirtschaftsförderung zur Verfügung stellen. Das ist erst mal keine schlechte Idee. Die Frage ist nur: Was heißt das konkret, und wofür?\n\nAn dieser Stelle ist ganz deutlich darauf hinzuweisen, dass es eine andere Kopplung an das Bruttoinlandsprodukt nicht mehr geben darf. Es muss endlich Schluss damit sein, dass die Bundesregierung in jedem Jahr 2 Prozent des Bruttoinlandsproduktes für Rüstung ausgeben will. Das sind 68 Milliarden Euro im Jahr, und dabei sind die Kosten, das Leid und die Umweltzerstörung noch nicht eingerechnet, die mörderische Kriege kosten. Keiner kann ernsthaft – das sage ich Ihnen ganz deutlich – für Umweltschutz eintreten und gleichzeitig Kriege befürworten.\n\nMeine Damen und Herren, wir als Linke sagen: Nachhaltigkeit geht nur sozial, gerecht und friedlich – anders geht es nicht. Dazu braucht es einen Richtungswechsel in der Politik. Wir als Linke sind darauf vorbereitet.\n\nVielen Dank.\n\n({11})"
"1045641","Gesine","Lötzsch","DIE LINKE.","Member of Parliament","2020-09-17T00:00:00.000Z","https://dip21.bundestag.de/dip21/btp/19/19176.pdf","\n\nVielen Dank. – Frau Präsidentin! Meine sehr geehrten Damen und Herren! Die Linke unterstützt alle Schritte, die die Kommunen unterstützen, und darum werden wir auch der Grundgesetzänderung zustimmen. Nicht nur die Grünen und die FDP, auch Die Linke stimmt der Grundgesetzänderung zu, meine Damen und Herren.\n\n({0})\n\nAber mit dieser Grundgesetzänderung sind natürlich nicht alle Probleme gelöst. Häufig fiel vor einigen Monaten der Satz: Vor dem Virus sind wir alle gleich. – Dieser Satz war von Anfang an falsch. Die Pandemie hat arme Menschen ärmer gemacht, und in allen großen Programmen, die hier beschlossen wurden, sind die Interessen und Bedürfnisse dieser Menschen nicht richtig berücksichtigt worden. Wir wollen, dass arme Menschen wirksam unterstützt werden, meine Damen und Herren.\n\n({1})\n\nIn der Pandemie ist auch die Kluft zwischen armen und reichen Kommunen größer geworden. Katja Wolf, Oberbürgermeisterin von Eisenach, berichtete in der Anhörung im Haushaltsausschuss, wie hart Eisenach von der Coronakrise getroffen ist. Der Ausgleich für den Ausfall der Gewerbesteuern sei zwar schön; doch die Oberbürgermeisterin wies darauf hin, dass die Stadt auch Ausfälle bei Gebühren, bei der Einkommens-, Übernachtungs- und Sondernutzungsteuer hat. Das macht in Eisenach die Hälfte aller Mindereinnahmen aus. Dafür gibt es keine Kompensation, und Eisenach ist kein Einzelfall.\n\n({2})\n\nIch will vielleicht einmal an den Steuereinnahmen verdeutlichen, wie groß die Unterschiede sind. Pro Einwohner erzielen die finanzstarken Städte fast zweieinhalbmal so hohe Steuereinnahmen wie die finanzschwachen. Die Differenz ist in den vergangenen Jahren nicht kleiner, sondern größer geworden. Ich gebe Ihnen ein Beispiel: Die kreisfreie Stadt Halle an der Saale hat pro Kopf Steuereinnahmen von 243 Euro – das war 2017 –, und Frankfurt am Main hat pro Kopf Gewerbesteuereinnahmen von 2 345 Euro. Das ist fast das Zehnfache. Ich finde, wir brauchen mehr Solidarität, um die Spaltung in unserem Land in reiche und arme Kommunen zu überwinden, meine Damen und Herren.\n\n({3})\n\nIch fordere die Bundesregierung auf: Geben Sie den Kommunen ihre Handlungsfähigkeit zurück! Streichen Sie die Altschulden der armen Kommunen!\n\n({4})\n\nHerr Scholz, Sie haben vor einiger Zeit diesen sehr sinnvollen Vorschlag gemacht. Von dem ist nichts mehr zu hören. Wir haben von Anfang an gesagt: Wir als Linke unterstützen die Entschuldung der Kommunen. Ich finde, Sie sollten Ihren eigenen Vorschlag wieder aufgreifen, Herr Scholz.\n\n({5})\n\nGerade die armen Kommunen müssen in ihre Zukunft investieren. Wir brauchen einen Investitionsfonds, um die Investitionskrise in unserem Land endlich zu beenden.\n\nGrundsätzlich muss man sagen: Nur in der Krise lässt sich Politik grundsätzlich ändern. Die Linke ist dazu bereit. Die Linke ist vorbereitet.\n\nVielen Dank.\n\n({6})"
