id,firstname,lastname,faction,position,date, url,speech
"1017192","Gesine","Lötzsch","DIE LINKE.","Member of Parliament","2018-12-12T00:00:00.000Z","https://dip21.bundestag.de/dip21/btp/19/19070.pdf","\n\nJa. – Nun hat es ja schon viele Ankündigungen gegeben, auch zu anderen Steuern. Die Frage ist: Wann werden Sie zumindest für Deutschland dafür sorgen, dass die Konzerne, die hier große Gewinne machen, auch entsprechend besteuert werden?"
"1020317","Gesine","Lötzsch","DIE LINKE.","Member of Parliament","2019-02-21T00:00:00.000Z","https://dip21.bundestag.de/dip21/btp/19/19083.pdf","\n\nVielen Dank. – Herr Präsident! Meine sehr geehrten Damen und Herren! Die Linke begrüßt, dass es gestern im Vermittlungsausschuss zu einer Einigung kam; denn wir haben eigentlich viel zu lange geredet, um Selbstverständliches zu klären. Wir brauchen mehr Initiative, mehr Geld und mehr Zusammenarbeit im Bereich der Bildung. Es gibt eindeutige Gewinner: Das sind unsere Kinder und Enkel, und das finden wir gut, meine Damen und Herren.\n\n({0})\n\nWir sagen Ihnen: Bundestag und Bundesrat müssen auch weiterhin alles dafür tun, damit unsere Kinder und Enkel eine bessere Schul- und Hochschulbildung bekommen.\n\nDieser lange Anlauf war ja nur nötig, weil 2006 bei der Föderalismuskommission II CDU und SPD das unsinnige Kooperationsverbot festgelegt haben. Die Linke hat schon damals gesagt: Das ist eine ärgerliche Bildungsbremse. – Und diese Bildungsbremse muss endlich gelöst werden, meine Damen und Herren.\n\n({1})\n\nEs kann nicht genug Quellen geben, um die Zukunft unserer Kinder und Enkel zu sichern. Natürlich können wir zum Teil auch die Sorgen der Länder verstehen. Sie wollen keine Kompetenzen an den Bund verlieren, und häufig können sich Bundesländer keine Fifty-fifty-Kofinanzierung leisten. Darum ist das zu Recht geändert worden.\n\nMeine Damen und Herren, aber auch der Bundestag muss dafür Sorge tragen, dass das Geld, das wir für die Schulen bereitstellen, wirklich in den Schulen ankommt. Wir müssen dafür Sorge tragen, dass das Geld, das der Deutsche Bundestag für den sozialen Wohnungsbau zur Verfügung stellt, auch beim sozialen Wohnungsbau ankommt. Ich denke, beide Seiten haben da eine große Verantwortung.\n\n({2})\n\nWir wissen alle, dass die 5 Milliarden Euro, die jetzt für den DigitalPakt beschlossen wurden, nicht ausreichen werden, um unser Bildungssystem auf die digitalen Herausforderungen vorzubereiten. Wir dürfen auch nicht vergessen, dass mit der Digitalisierung nicht alle Probleme des Lebens gelöst werden. Zum Glück gibt es auch noch eine analoge Welt. Ich denke dabei an fehlende Lehrerinnen und Lehrer, wofür wir gemeinsam Lösungen finden müssen. Wir brauchen also nicht nur einen DigitalPakt, sondern auch einen Analogpakt, meine Damen und Herren.\n\n({3})\n\nDa immer gefragt wird: „Wo soll denn das ganze Geld herkommen?“, sage wir Ihnen als Linke eindeutig: Wir brauchen nicht mehr Geld für die Rüstung, wir brauchen mehr Geld für die Bildung. Ich möchte, dass unsere Zukunft in den Klassenzimmern, in den Ausbildungsstätten, an den Hochschulen und Universitäten und nicht auf den Schlachtfeldern entschieden wird.\n\nMeine Damen und Herren, die Linke stimmt zu.\n\n({4})"
"1023383","Gesine","Lötzsch","DIE LINKE.","Member of Parliament","2019-04-11T00:00:00.000Z","https://dip21.bundestag.de/dip21/btp/19/19095.pdf","\n\nVielen Dank. – Herr Präsident! Meine sehr geehrten Damen und Herren! Die Antragstellerin will ein Gespenst durch Europa schicken, ein Gespenst mit dem Namen Target2. Doch das eigentliche Problem ist ein anderes: Europa ist eine Steueroase für Vermögende und für viele ein Armenhaus. Dafür trägt diese Bundesregierung eine horrende Verantwortung. Dieser Verantwortung muss sie sich stellen.\n\n({0})\n\nIm Jahre 2018 war Deutschland wieder Exportweltmeister, und darauf sind viele Bürgerinnen und Bürger in unserem Land stolz. Im Warenhandel übertrafen unsere Exporte um gut 228 Milliarden Euro die Importe. Das klingt gut, aber es gibt ein Problem: Die Käufer unserer Produkte werden ihre eigenen Produkte bei uns nicht los. Dazu sagt die Bundesregierung lapidar: Da habt ihr Pech gehabt, dann müsst ihr eben besser produzieren. – Um unsere Produkte trotzdem weiterhin kaufen zu können, nehmen sie natürlich Kredite auf. Ohne diese Kredite könnten sie nichts mehr kaufen, und unsere Exporte würden dramatisch einbrechen. Diesen Zusammenhang muss doch jeder verstehen, selbst die Bundesregierung. Zumindest meine Fraktion hat ihn verstanden.\n\n({1})\n\nDoch die Bundesregierung tut alles, damit sich andere Länder weiter verschulden und wirtschaftlich auf keinen grünen Zweig kommen. Das Ungleichgewicht wird größer und nicht kleiner. Das ist der falsche Weg.\n\n({2})\n\nDie Frage ist doch: Wie können wir weiterhin unsere Produkte verkaufen, ohne andere Länder tiefer in die Krise zu treiben? Die Linke hat dafür drei Vorschläge.\n\nErstens. Wir müssen stärker in Deutschland investieren. Wer mit offenen Augen durch unser Land geht, sieht, dass die Infrastruktur systematisch verfällt. Unzählige Brücken sind vom Einsturz gefährdet. Es fehlen Schulen, Kindergärten und Wohnungen. Was macht der SPD-Finanzminister? Er will ab 2020 die Investitionen bei 39,6 Milliarden Euro einfrieren. In Anbetracht sinkender Wachstumsprognosen wird das wie eine Wachstumsbremse wirken. Das ist wirklich verantwortungslos.\n\n({3})\n\nDer nächste absurde Vorschlag kommt von der CDU: Sie will die Steuern für Vermögende senken. Dabei ist doch sonnenklar, dass die, die schon sehr viel Geld haben und schon jetzt nicht wissen, wie sie es ausgeben sollen, sich mit dem Geld nicht noch einen fünften Porsche kaufen werden, um ein naheliegendes Beispiel zu nehmen. Nein, Steuersenkungen für Vermögende stärken nicht die Binnennachfrage, ganz im Gegenteil.\n\n({4})\n\nZweitens. Löhne und Renten müssen angehoben werden. Die Bundesregierung kann die nächste Finanzkrise nur verhindern, wenn sie dafür sorgt, dass Menschen mit sehr wenig Einkommen mehr Geld in die Tasche bekommen. Wir als Linke sagen: Jeder muss von seiner Arbeit leben können, und zwar gut.\n\n({5})\n\nHöhere Löhne werden ausgegeben und stärken so direkt die Binnennachfrage. Unsere Forderung lautet also: höhere Mindestlöhne. Wir fordern 12 Euro Mindestlohn pro Stunde.\n\n({6})\n\nDer Mindestlohn in Deutschland liegt unter der Niedriglohnschwelle von 10,80 Euro. Fast 8 Millionen Menschen in unserem Land arbeiten im Niedriglohnsektor. Wenn wir den Niedrigstlohnsektor gemeinsam energisch bekämpfen, leisten wir einen direkten Beitrag zur Stärkung der Binnennachfrage und zur Stärkung des Gleichgewichtes. Das sollte doch ein vernünftiges Ziel sein.\n\n({7})\n\nDrittens. Wir wollen die Spaltung Europas beenden. Im Antrag wird die Spaltung in Nord- und Südeuropa als Problem beschrieben. Doch das lenkt vom eigentlichen Problem ab: Wir haben in Europa eine ungeheure Vermögenskonzentration in den Händen einer Handvoll Oligarchen. Allein in Deutschland besitzen 45 Personen mehr als die ärmere Hälfte der Bevölkerung. Das ist doch nicht normal. Das gehört geändert.\n\n({8})\n\nEs ist also höchste Zeit, Vermögen endlich gerecht zu besteuern. Wir müssen den Steuerbetrug in Europa bekämpfen, und zwar konsequent. Allein durch die Steuerhinterziehung gehen der Europäischen Union jährlich 850 Milliarden Euro verloren. Stellen Sie sich doch einmal vor, was man damit alles anfangen könnte. Es ist doch absurd, dass der Apple-Konzern im Jahr 2014 auf 1 Million Euro Gewinn nur 50 Euro Steuern zahlen musste. So kann das nicht weitergehen.\n\n({9})\n\nSo etwas kann nur geschehen, wenn an der Spitze der EU-Kommission mit Herrn Juncker jemand steht, der jahrelang hinter dem Rücken der Europäerinnen und Europäer schmutzige Steuerdeals mit Großkonzernen abgeschlossen hat. Wer es nicht weiß: Herr Juncker ist ein Parteifreund von Frau Merkel. Auch darüber sollte man nachdenken.\n\n({10})\n\nDie Bundesregierung ist, wie gesagt, nicht besser als Herr Juncker. Sie haben die Einführung einer Internetsteuer für Google, Apple und Amazon verhindert. Sie versprechen uns seit zehn Jahren eine Finanztransaktionsteuer, die es bis heute nicht gibt. Sie haben sich als Vermögensverwalter für die wenigen qualifiziert. Als Vertreter der Mehrheit der Bürgerinnen und Bürger in unserem Land haben Sie sich gründlich disqualifiziert, meine Damen und Herren von der Bundesregierung.\n\n({11})\n\nCDU/CSU und SPD haben Europa mit einer brutalen Kürzungspolitik gespalten und entsolidarisiert. Wir stehen vor einem europäischen Trümmerhaufen. Europa geht nur friedlich und sozial oder gar nicht. Bei der Europawahl am 26. Mai sollte jeder bei der Stimmabgabe darüber nachdenken, die linken Kräfte in Europa zu stärken und die rechten zu schwächen.\n\nVielen Dank.\n\n({12})"
"1025906","Gesine","Lötzsch","DIE LINKE.","Member of Parliament","2019-06-06T00:00:00.000Z","https://dip21.bundestag.de/dip21/btp/19/19104.pdf","\n\nVielen Dank. – Herr Präsident! Meine sehr geehrten Damen und Herren! Jetzt kommt das Kontrastprogramm.\n\n({0})\n\nDie Schuldenbremse ist nämlich neoliberaler Unsinn und eine gefährliche Zukunftsbremse. Die Bundesregierung verhält sich wie ein Fahrschüler, der den ersten Tag auf der Straße ist und unentwegt Gaspedal und Bremse verwechselt.\n\n({1})\n\nWenn die Regierung bremsen müsste, gibt sie Gas,\n\n({2})\n\nund wenn sie Gas geben müsste, bremst sie.\n\n({3})\n\nEin Totalschaden ist bei solch einem Fahrstil nicht ausgeschlossen.\n\n({4})\n\nUnd, meine Damen und Herren, der Schaden ist bereits eingetreten. Die Schuldenbremse ist zur Zukunftsbremse geworden; denn wenn es um mehr Investitionen geht, dann fährt die Bundesregierung mit angezogener Handbremse. Es gibt einfach zu viele kaputte Straßen und Brücken, es fallen einfach zu viele Züge, Busse und Straßenbahnen aus, und es fehlen überall bezahlbare Wohnungen, Geburtskliniken, Kindergärten und Schulen.\n\n({5})\n\nDie Schuldenbremse hat also nicht nur notwendige Investitionen verhindert, sondern auch zu einem massiven Personalabbau in Krankenhäusern, Pflegeheimen und Bauämtern geführt. Das ist der falsche Weg, meine Damen und Herren.\n\n({6})\n\nIch habe – darauf ist ja schon angespielt worden – den Finanzminister in der Sitzung des Haushaltsausschusses am 15. Mai gefragt, ob er eine Gesellschaft plane oder existierende staatliche Gesellschaften nutzen wolle, um die Schuldenbremse zu umgehen. Ich fand die Antwort, ehrlich gesagt, nicht eindeutig. Er verneinte wortreich, aber nicht besonders glaubhaft. Wir als Linke sagen: Man muss nicht drum herumreden. Es gibt nur eine vernünftige Lösung, nämlich die Schuldenbremse abzuschaffen, meine Damen und Herren.\n\n({7})\n\nDie Steuereinnahmen sprudeln nicht mehr so heftig. Die aktuelle Steuerschätzung fiel katastrophal aus. Der Finanzminister stellte fest, dass der Staat bis 2023 insgesamt 124 Milliarden Euro weniger zur Verfügung haben wird, als noch im November geschätzt. Mit sinkendem Wirtschaftswachstum sinken auch die Steuereinnahmen; das ist ja irgendwie logisch.\n\nDie Bundesregierung hat – das ist auch Ausdruck kurzsichtiger Politik – die Wirkung der aufziehenden Handelskriege völlig unterschätzt. Den Exportweltmeister Deutschland treffen die Einschränkungen des Handels besonders hart.\n\n({8})\n\nAber die Bundesregierung hat nicht für eine ausgeglichene Handelsbilanz gesorgt, und das ist ein folgenreicher Fehler, meine Damen und Herren.\n\n({9})\n\nEs ist höchste Zeit, die Binnennachfrage zu stärken und eben nicht nur auf das Pferd „Export“ zu setzen.\n\nUnd, meine Damen und Herren, Sie müssen bei der Energiewende endlich Tempo machen. Das fordern jeden Freitag zu Recht Tausende Schülerinnen und Schüler weltweit. Sie sollten sie unterstützen und nicht – wie immer – auf der Bremse stehen.\n\n({10})\n\nAuf die Bremse treten müssten Sie bei der Miete. Doch da haben Sie kein Problem, wenn Heuschrecken wie Deutsche Wohnen bei Mieterhöhungen das Gaspedal durchtreten.\n\nDie Schuldenbremse, meine Damen und Herren, ist eine Fehlkonstruktion. Das bestätigen inzwischen auch führende Ökonomen.\n\n({11})\n\nIch zitiere den wissenschaftlichen Direktor des Instituts für Makroökonomie und Konjunkturforschung, Sebastian Dullien. Er sagt: „Die Schuldenbremse ist ein gewaltiger Reinfall.“ Recht hat der Mann.\n\n({12})\n\nStattdessen fordert er eine verlässliche Investitionsstrategie des Staates für die nächsten Jahrzehnte.\n\n({13})\n\nDer Vizepräsident des Leibniz-Institutes für Wirtschaftsforschung Halle, Oliver Holtemöller, hält die schwarze Null für kein ökonomisch sinnvolles Konzept. Ich zitiere:\n\nSie führt dazu, dass man ausgerechnet in einer Zeit, in der sich die Konjunktur abschwächt, die Steuern erhöhen oder die Ausgaben kürzen muss.\n\nSogar Michael Hüther, der Direktor des arbeitgebernahen Instituts der deutschen Wirtschaft – das sage ich vor allen Dingen an die mehr rechte bzw. mittlere Seite des Hauses, je nachdem, wie Sie sich selber definieren mögen; da bin ich ja großzügig –,\n\n({14})\n\nbezeichnet die Schuldenbremse als – ich zitiere – „wachstumspolitisch blind“, weil durch das Kreditverbot – ich zitiere weiter -„wichtige Zukunftsinvestitionen“ nicht getätigt werden könnten. Wenn das aus so vielen Richtungen kommt, dann müssten Sie doch mal anfangen, darüber nachzudenken, und dürften sich nicht fortwährend selber loben, meine Damen und Herren.\n\n({15})\n\nWas fordert Die Linke? Wir fordern ein Investitionsprogramm, das nicht nur das Wachstum stabilisiert, sondern auch neue Arbeitsplätze in unserem Land schafft.\n\n({16})\n\nDenken wir nur an die Tausenden Arbeitsplätze, die in der Automobilindustrie, in der Finanzindustrie und durch die Digitalisierung bedroht sind. Diese Bedrohungen lösen wir nicht mit einer schwarzen Null auf, sondern nur mit Investitionen in neue Technologien.\n\nDoch Sie, meine Damen und Herren, wollen lieber wieder Milliarden in Todestechnologien wie die Entwicklung eines neuen Kampfflugzeugs stecken. Das wurde gestern Hals über Kopf im Haushaltsausschuss beschlossen. Eine schwerwiegende Fehlentscheidung, meine Damen und Herren!\n\n({17})\n\nIch musste an 1987 zurückdenken. Da wurden die ersten Zahlen für das Konzept des Eurofighters genannt. Die Zahlen haben sich Jahr für Jahr vervielfacht, und Sie haben aus dem Eurofighter-Desaster nichts gelernt. Nun soll wieder ein neues Milliardenabenteuer begonnen werden. Da, meine Damen und Herren, müssten wir auf der Bremse stehen, und zwar alle gemeinsam.\n\n({18})\n\nZur Finanzierung unserer Vorschläge müssen Schulden nicht erhöht werden, dafür reicht schon eine Steuerreform, die dafür sorgt, dass Vermögen und Einkommen in unserem Land gerecht besteuert werden. Doch so eine Steuerreform verhindert die Große Koalition. Und deshalb brauchen wir eine neue, eine linke Mehrheit in diesem Land, meine Damen und Herren.\n\n({19})\n\nWir fordern alle Fraktionen auf, die Schuldenbremse aus dem Grundgesetz zu streichen; sonst bremsen wir uns zu Tode, und das wäre verantwortungslos. Wir stehen für die Zukunft, meine Damen und Herren.\n\n({20})"
"1027522","Gesine","Lötzsch","DIE LINKE.","Member of Parliament","2019-09-10T00:00:00.000Z","https://dip21.bundestag.de/dip21/btp/19/19110.pdf","\n\nVielen Dank. – Herr Präsident! Meine sehr geehrten Damen und Herren! Ich glaube, diesem Selbstlob muss man deutlich etwas entgegensetzen.\n\n({0})\n\nIn diesem Haushalt steht deutlich zu viel für Rüstung, zu wenig für Investitionen und viel zu wenig für Soziales. Dieser Haushalt bedroht dadurch die Sicherheit der Menschen in unserem Land, und das darf nicht sein, meine Damen und Herren.\n\n({1})\n\nAugenscheinlich reagiert die Bundesregierung nur noch auf dumpfe Reize. Beispiel: US-Präsident Trump stößt wüste Drohungen aus. Sein Botschafter hat bereits mit dem Abzug der US-Truppen aus unserem Land gedroht, wenn wir den Rüstungskonzernen nicht noch mehr Geld in den Rachen werfen. Wir als Linke sagen: Zieht die Truppen ab! Das würde viel Geld sparen und die Sicherheit in unserem Land erhöhen.\n\n({2})\n\nUnd nehmt die abscheulichen Atomwaffen gleich mit. Europa muss endlich atomwaffenfrei werden!\n\n({3})\n\nViele wissen es gar nicht: Von Ramstein in Deutschland aus werden Todesdrohnen nach Jemen geschickt. Das ist furchtbar. Furchtbar ist auch, dass die Bundesregierung zulässt, dass von deutschem Boden aus Mordkommandos gesteuert werden. Die US-Truppen sind offensichtlich zu einem Sicherheitsrisiko für unser Land geworden, und das muss ein Ende haben.\n\n({4})\n\nIn diesen Tagen ist bekannt geworden, dass die Bundesregierung eine Schallmauer durchbrochen hat. Sie will zum ersten Mal in der Geschichte der Bundesrepublik, nach NATO-Kriterien berechnet, über 50 Milliarden Euro für das Militär ausgeben. Meine Damen und Herren, wer das Wettrüsten beschleunigt, macht diese Welt unsicherer. Auch in dieser Frage wird die Bundesregierung zu einem Sicherheitsrisiko für unser Land, und das darf nicht sein.\n\n({5})\n\nJeder siebte Euro aus dem Bundeshaushalt soll in das Wettrüsten fließen. Das entspricht einer Rüstungsquote von 14 Prozent. Die Investitionsquote dagegen stagniert bei 11,1 Prozent. Nur jeder neunte Euro wird in die Zukunft investiert. Ich sage Ihnen: Statt sich eine Wettrüstungsquote von der NATO vorschreiben zu lassen, sollten wir lieber eine dynamische Investitionsquote in unser Grundgesetz schreiben. Wir brauchen einen robusten Rüstungsdeckel, wir brauchen Investitionen, meine Damen und Herren!\n\n({6})\n\nAllein bei der Deutschen Bahn gibt es einen Investitionsstau von 57 Milliarden Euro. Und jeder, der zumindest ab und zu mit der Bahn fährt, weiß, wovon ich rede. Aber womit beschäftigt sich der Minister, der über den größten Investitionstopf verfügt, nämlich Herr Scheuer? Er kämpft mit der Abwicklung der gescheiterten Maut. Ich finde, Herr Scheuer ist eine personifizierte Investitionsbremse. Einen solchen Minister brauchen wir nicht! Er ist zu einem Klumpenrisiko geworden.\n\n({7})\n\nNun haben wir in dieser Debatte schon wieder viel über die Schuldenbremse und die schwarze Null gehört. Das sind natürlich alles Nebelkerzen. Dass die Schuldenbremse ökonomischer Unsinn ist, hat sich inzwischen sogar bis in die Reihen ihrer einstigen Befürworter herumgesprochen. Doch in diesem Haus gibt es anscheinend immer noch mehr neoliberale Buchhalter als sachverständige Ökonomen.\n\n({8})\n\nDie Koalition hat sich selbst an Armen und Beinen gefesselt. Die eine Fessel ist die Schuldenbremse, und die andere Fessel ist der Ausschluss von Steuererhöhungen für Vermögende.\n\n({9})\n\nDiese Selbstfesselung ist ein Sicherheitsrisiko, das wir uns nicht leisten können, meine Damen und Herren.\n\n({10})\n\nUm endlich wieder handlungsfähig zu werden, müssen diese Fesseln gelöst werden. Wir wollen höhere Vermögensteuern und eine echte Finanztransaktionsteuer, Herr Scholz, nicht so ein Placebo, wie Sie es gerade vorgeschlagen haben. Dann bekommen wir wirklich Spielraum für Zukunftsinvestitionen.\n\n({11})\n\nDiese Bundesregierung ist auch ein Sicherheitsrisiko, weil sie nichts gegen die zunehmende Spaltung der Gesellschaft tut.\n\nNun wird ja immer hervorgehoben, wie groß der Etat für Arbeit und Soziales ist. Aber man muss wissen, dass über 100 Milliarden Euro davon in die gesetzliche Rente gehen. Das heißt, für Arbeit und Soziales im engeren Sinne stehen lediglich 38,94 Milliarden Euro zur Verfügung. In Anbetracht einer drohenden Rezession ist das grob fahrlässig. Hier muss nachgesteuert werden, meine Damen und Herren.\n\n({12})\n\nDas Armutsrisiko für Menschen, die neu in die Rente gehen, wird sich in den nächsten elf Jahren in Ostdeutschland fast verdoppeln. Wir brauchen also sofort, meine Damen und Herren, eine solidarische Mindestrente.\n\n({13})\n\nDoch selbst für die Grundrente, die ja immerhin im Koalitionsvertrag steht, haben Sie keine Vorsorge im Haushalt getroffen. Das Gleiche trifft für den Klimaschutz zu. Und das ist ein Armutszeugnis für diese Regierung.\n\n({14})\n\nMeine Damen und Herren, nutzen wir die Haushaltsberatungen! Dann haben wir die Chance, unser Land sicherer, gerechter und solidarischer zu machen. Dafür steht Die Linke. Gestalten wir eine gute Zukunft!\n\n({15})"
"1028002","Gesine","Lötzsch","DIE LINKE.","Member of Parliament","2019-09-12T00:00:00.000Z","https://dip21.bundestag.de/dip21/btp/19/19112.pdf","\n\nVielen Dank. – Herr Präsident! Meine sehr geehrten Damen und Herren! Familien, Senioren, Frauen und Jugend, das sind verdammt viele Menschen, Frau Giffey, die von Ihrem Ministerium Unterstützung erwarten. Dafür hat die Bundesregierung nur knapp 12 Milliarden Euro eingestellt. Wir finden, das ist entschieden zu wenig.\n\n({0})\n\nNur eine Vergleichszahl: Für Rüstung und Militär will die Bundesregierung im kommenden Jahr 50 Milliarden Euro ausgeben. Das ist ein grobes Missverhältnis.\n\n({1})\n\nUns sind Familien, Senioren, Frauen und Jugend mehr wert, meine Damen und Herren.\n\n({2})\n\nMehr als 2,7 Millionen Kinder in unserem Land wachsen in Armut auf, und das ist für unser reiches Land ein absolut unhaltbarer Zustand. 41,5 Prozent der Alleinerziehenden in Deutschland sind arm. Das ist eine erschreckend hohe Zahl. Das dürfen Sie als Familienministerin doch nicht hinnehmen, Frau Giffey.\n\n({3})\n\nAuch kinderreiche Familien mit drei oder mehr Kindern sind besonders häufig arm. Die Armutsquote liegt in diesem Bereich bei 30 Prozent. Das Kindergeld ist erhöht worden – das ist gut –, jedoch geht die Erhöhung am tatsächlichen Bedarf vieler Familien vorbei. Familien, die Hartz IV bekommen, sind nach wie vor von der Erhöhung des Kindergeldes faktisch ausgeschlossen, und das ist grob ungerecht, meine Damen und Herren.\n\n({4})\n\nGleichzeitig werden Familien mit hohen Einkommen über den Kinderfreibetrag nach wie vor um bis zu 100 Euro stärker entlastet als Familien im unteren und mittleren Einkommensbereich über das Kindergeld. Ich finde, das ist Klientelpolitik für die Besserverdienenden in unserem Land. Das muss sich ändern.\n\n({5})\n\nEin Kind aus einer armen Familie darf vom Staat nicht schlechter gestellt werden als ein Kind aus einer reichen Familie. Wir brauchen endlich eine wirksame Kindergrundsicherung, die verhindert, dass Kinder in Armut aufwachsen müssen;\n\n({6})\n\ndenn Armut demütigt, Armut grenzt aus, und durch Armut verschwendet unsere Gesellschaft auch Talente. Und nichts davon dürfen wir zulassen.\n\n({7})\n\n500 Millionen Euro haben Sie für das Sondervermögen „Ausbau ganztägiger Bildungs- und Betreuungsangebote für Kinder im Grundschulalter“ eingestellt. Das ist gut. Doch vergessen wir nicht: Uns fehlen bis zum Jahr 2025 circa 26 000 Grundschullehrerinnen und Grundschullehrer. Wir haben jetzt schon einen dramatischen Lehrernotstand. Wir brauchen also ein Bund-Länder-Programm für unsere Kinder. Bund und Länder müssen kooperieren; denn die schönste Schule nutzt unseren Kindern nichts, wenn dort keine Lehrerinnen und Lehrer sind, die unterrichten.\n\n({8})\n\nDass es für Bund und Länder nicht einfach ist, zu kooperieren, wissen alle, die schon mal im Vermittlungsausschuss gesessen haben. Aber für unsere Kinder lohnt sich diese Anstrengung.\n\nStichwort „Demokratieförderung“. Die Landtagswahlen in Sachsen und Brandenburg haben wieder deutlich gemacht, wie dringend wir ein Demokratiefördergesetz brauchen.\n\n({9})\n\nSchon in der vergangenen Legislaturperiode haben wir darüber diskutiert. Das Vorhaben ist an CDU und CSU gescheitert. – Sie können brüllen. Wer brüllt, hat unrecht, meine Damen und Herren. -\n\n({10})\n\nDemokratieförderung ist kein Projekt, sondern eine Daueraufgabe. Ich frage mich: Wann wollen die Unionsparteien endlich damit beginnen, unsere Demokratie wirklich wirksam zu schützen? Das geht nämlich nicht mit mehr Polizei, sondern nur mit mehr Menschen, die sich mit Zivilcourage gegen Nazis zur Wehr setzen.\n\n({11})\n\nEs ist gut, dass das Bundesprogramm „Demokratie leben!“ nun entfristet werden soll. Allerdings kann Die Linke nicht akzeptieren, dass die Mittel für die Maßnahmen zur Stärkung von Vielfalt, Toleranz und Demokratie gekürzt werden sollen. Sind für das Jahr 2020, also das kommende Haushaltsjahr, noch 107,5 Millionen Euro eingeplant, stehen für 2023 nur noch 30,5 Millionen Euro für diese Maßnahmen bereit. Das entspricht einer Kürzung um zwei Drittel. Das ist nicht hinnehmbar, meine Damen und Herren.\n\n({12})\n\nIch glaube, alle Menschen, die sich in der ganzen Republik gegen Nazis zur Wehr setzen, die sich für Toleranz, Vielfalt und Demokratie einsetzen, gehören unterstützt und gefördert. Wir dürfen sie nicht alleine lassen. Nutzen wir die Haushaltsberatungen, um diesen Haushalt solidarischer, gerechter und sicherer zu machen.\n\nVielen Dank.\n\n({13})"
