id,firstname,lastname,faction,position,date, url,speech
"1063976","Gesine","Lötzsch","DIE LINKE.","Member of Parliament","2021-09-07T00:00:00.000Z","https://dip21.bundestag.de/dip21/btp/19/19239.pdf","\n\nHerzlichen Dank. – Frau Präsidentin! Meine sehr geehrten Damen und Herren! Wir haben ausreichend guten Impfstoff, wir haben hervorragende Virologinnen und Virologen, Ärztinnen und Ärzte, Krankenpfleger und Krankenschwestern. Aber trotzdem erleben wir im Augenblick fast einen Impfstillstand. Da muss man doch die Bundesregierung fragen, warum sie es nicht schafft, aus diesen hervorragenden Voraussetzungen etwas zu machen. Ich glaube, sie muss ihre Verantwortung endlich eingestehen, meine Damen und Herren, und darf nicht die Bürgerinnen und Bürger beschimpfen.\n\n({0})\n\nHeute nun will die Bundesregierung völlig überstürzt – nicht einmal eine Anhörung im Bundestag wurde zugelassen; da muss ich Ihnen, Kollegin Dittmar, ausdrücklich widersprechen; völlig überstürzt! – die Verhältnisse zwischen Arbeitgebern und Arbeitnehmern über den Haufen werfen. Ich sage Ihnen: Arbeitsrecht und Datenschutz sind nichts für schönes Wetter. Gerade in Krisen muss damit sorgfältig umgegangen werden. Alles andere zerstört Vertrauen, und da machen wir nicht mit, meine Damen und Herren.\n\n({1})\n\nDie Virologen haben ja recht: Unsere Impfquote ist zu niedrig. Also müssen wir über die Frage sprechen, warum Pandemieminister Spahn mit seiner Impfstrategie es eben nicht geschafft hat, sie zu erhöhen. Zurzeit liegt sie nach Aussagen des RKI bei 61,3 Prozent vollständig Geimpfter. Man kann mir doch nicht weismachen, dass es in Deutschland fast 40 Prozent Hardcore-Impfgegner gibt. Da macht doch die Bundesregierung etwas falsch.\n\n({2})\n\nWarum sind – die Frage müssen wir uns doch stellen – in Dänemark schon 73,1 Prozent und in Portugal 76,8 Prozent geimpft? Haben Sie da mal nachgefragt? Einige Fehler liegen ja auf der Hand: Anfang 2020 hat Minister Spahn eine neue Abteilung „Gesundheitssicherheit, Gesundheitsschutz, Nachhaltigkeit“ gegründet. Zum Leiter wurde ein General der Bundeswehr berufen, der dort ausdrücklich auch in Uniform erscheinen sollte. Spätestens da war mir klar: Diese Sache muss schiefgehen. Ein Virus kann doch nicht mit militärischer Logik besiegt werden.\n\n({3})\n\nWir werden auch in Zukunft keine Kriege gegen Krankheiten gewinnen. Was wir brauchen, sind Information, Aufklärung, Überzeugung. Dafür braucht man keine Generäle, sondern Psychologen, Kommunikationsexperten, also Aufklärung, Überzeugung und Gelegenheiten, kein Gerede über Krieg, meine Damen und Herren.\n\n({4})\n\nEs gibt auch ein Misstrauen gegenüber der Pharmaindustrie. Die Preispolitik ist nicht transparent, und viele haben den Eindruck, dass es Pfizer, BioNTech und anderen eben nicht nur um die Bekämpfung der Pandemie, sondern auch um Profite geht. Auch dem müssen wir uns deutlich entgegenstellen, meine Damen und Herren.\n\n({5})\n\nWas nun das Impfen betrifft, haben wir historische Vorbilder. Ich kann nur empfehlen, sich ein Beispiel an Elvis Presley zu nehmen. 1956 ließ sich Elvis Presley vor einem Auftritt öffentlich gegen Polio impfen. Danach explodierte die Immunisierungsquote in den USA unter Teenagern in nur sechs Monaten. Also: Wir brauchen die richtigen Vorbilder, meine Damen und Herren.\n\n({6})\n\nUnsere Botschaften sind ganz klar:\n\nErstens. Unausgegorene Gesetzesänderungen, wie sie hier vorliegen, zerstören Vertrauen zwischen Arbeitgebern und Arbeitnehmern; das lehnen wir ab.\n\nZweitens. Es muss jetzt wieder geimpft werden. Dafür brauchen wir Vertrauen, Glaubwürdigkeit und Anreize, und der Zugang muss niedrigschwellig sein. Ich nenne Ihnen mal ein Beispiel: In meinem Wahlkreis in Berlin-Lichtenberg haben wir hinter einem großen Möbelhaus – den Namen nenne ich jetzt nicht – ein Drive-und-Walk-in-Impfzentrum errichtet. Da kommen täglich Hunderte Menschen vorbei. Das widerspricht doch der These von der allgemeinen Impfmüdigkeit. Es muss mehr solcher Gelegenheiten geben; das wäre der richtige Weg, meine Damen und Herren.\n\n({7})\n\nDrittens. Pandemien besiegen wir nicht allein mit Impfstoffen, sondern vor allen Dingen mit Solidarität in unserem Land und mit den Ländern, die immer noch zu wenig Impfstoff haben. Darum wiederhole ich ganz deutlich unsere Forderung: Geben Sie endlich die Patente frei! Das ist eine Frage der Solidarität, aber auch eine Frage des Selbstschutzes, meine Damen und Herren.\n\n({8})\n\nIch gebe dem Kollegen Kubicki recht: Es ist wirklich sehr ungünstig, dass wir beide Themen in einem Komplex behandeln müssen. Wir haben uns in der vergangenen Sitzung ja sehr ausführlich damit befasst, wie das Sondervermögen aufgebaut werden soll. Ich möchte für meine Fraktion ganz deutlich sagen: Wir unterstützen die Aufbauhilfen. Wir sind in unseren Gedanken bei den Menschen, die so vieles erlitten haben, und wir bedanken uns ausdrücklich bei allen Helferinnen und Helfern und bei allen Spenderinnen und Spendern. Da hat sich gezeigt, dass es in unserem Land bei den Menschen viel Solidarität gibt.\n\n({9})\n\nWir müssen aber auch Schlussfolgerungen ziehen. Wir brauchen endlich einen effektiven Hochwasserschutz, und wir brauchen einen wirksamen Katastrophenschutz. Nun beschließen wir ja wieder viel Geld, und darum sage ich ganz deutlich: Wir wollen vor der Wahl wissen, wer die Rechnung bezahlen soll. CDU/CSU und FDP wollen vor allen Dingen die Vermögenden nach der Wahl steuerlich entlasten, und die Wählerinnen und Wähler müssen wissen: Diese Parteien sind die Vermögensverwalter der Reichen in diesem Land und nicht die der Mehrheit.\n\nWir als Linke wollen die 119 deutschen Milliardäre zur Kasse bitten. Keiner von denen muss fürchten, nach der von uns eingeführten Vermögensabgabe als armer Millionär sein Leben fristen zu müssen; das versprechen wir. Wir wollen eine gerechte Gesellschaft. Wir treten an für eine andere Steuerpolitik, damit die Menschen in diesem Land wieder besser leben können.\n\nHerzlichen Dank.\n\n({10})"
"1064021","Gesine","Lötzsch","DIE LINKE.","Member of Parliament","2021-09-07T00:00:00.000Z","https://dip21.bundestag.de/dip21/btp/19/19239.pdf","\n\nVielen Dank. – Frau Präsidentin! Meine sehr geehrten Damen und Herren! Um es gleich vorwegzunehmen: Wir als Linke werden dem Vermittlungsergebnis zustimmen. Als wir hier im Bundestag den Gesetzentwurf diskutiert haben, haben wir uns enthalten, weil wir wollten, dass in dieses Gesetzespakt auch die Qualitätssicherung hineingeschrieben wird. Nun gab es ja im Vermittlungsausschuss die Debatte bzw. das Ringen um die beste Lösung. Wir als Linke stehen dafür, dass alle Kinder gute Chancen haben, und dazu gehört natürlich auch der Rechtsanspruch auf eine Ganztagsbetreuung.\n\n({0})\n\nAn dieser Stelle will ich auch erwähnen, dass es in vielen Ländern – gerade im Osten Deutschlands – dieses Angebot schon gibt und dass nicht nur viele Eltern davon profitieren, sondern dass es vor allen Dingen ja auch ein Recht für die Kinder ist, mit anderen Kindern zusammen zu sein, zu lernen und Neues zu entdecken.\n\nAber: Ich glaube, dass uns diese ganze Diskussion und das Verfahren im Vermittlungssauschuss noch einmal ganz deutlich vor Augen geführt haben, was wir im Grundgesetz brauchen. Wir brauchen nämlich eine Gemeinschaftsaufgabe „Bildung“, und dafür setzen wir uns als Linke ein. Das werden wir auch in der nächsten Legislaturperiode wieder einbringen. Ich glaube, die Lehre aus den verschiedenen Vermittlungsergebnissen und auch aus der Frage, wie wir mit dem DigitalPakt umgehen, ist: Wir brauchen endlich die Verankerung der Gemeinschaftsaufgabe „Bildung“ im Grundgesetz. Dafür setzen wir uns ein. Das wäre besser für alle Kinder und Jugendlichen in unserem Land, das würde die Bildungschancen erhöhen, und das würde dieses ständige Hickhack verhindern. Also: Lassen Sie uns gemeinsam dafürstimmen!\n\nVielen Dank.\n\n({1})"
"1064202","Gesine","Lötzsch","DIE LINKE.","Member of Parliament","2021-11-11T00:00:00.000Z","https://dip21.bundestag.de/dip21/btp/20/20002.pdf","\n\nVielen Dank. – Frau Präsidentin! Meine sehr geehrten Damen und Herren! Ich habe das Statistische Bundesamt gefragt, wie viele Menschen zu wenig Geld haben, um ihre Wohnung zu heizen. Ich muss Ihnen sagen: Die Antwort hat mich erschüttert. 7,4 Millionen Menschen – 7,4 Millionen Menschen! – in unserem Land haben zu wenig Geld, um ihre Wohnung warm zu halten. Das sind Menschen aller Altersgruppen; auch Kinder und Alte sind dabei. Das ist ein unhaltbarer Zustand!\n\n({0})\n\nMeine Damen und Herren, das müssen wir ändern, und zwar sofort. Keiner soll in unserem reichen Land in seiner Wohnung frieren müssen.\n\n({1})\n\nDie amtierende Bundesregierung getragen von Union und SPD hat alles getan, um die Stromrechnungen der Konzerne zu reduzieren – mein Kollege Ralph Lenkert hat in der vorigen Debatte darauf hingewiesen –, doch sie hat nichts, aber auch gar nichts getan, um zu verhindern, dass 7,4 Millionen Menschen in ihren Wohnungen frieren. Das ist ein Armutszeugnis, und hier besteht Handlungsbedarf.\n\n({2})\n\nVon den Ampelparteien habe ich zu diesem Thema bisher noch nichts gehört. Ich hoffe, dass Sie heute hier im Bundestag anlässlich unseres Antrages versprechen, dass in diesem Winter in diesem Land kein Mensch frieren muss, weil er zu wenig Geld hat. Wir fordern einen wirksamen Keiner-soll-frieren-Plan, meine Damen und Herren.\n\n({3})\n\nUnsere wichtigsten Forderungen: 200 Euro sofort für jeden Menschen, der an der Armutsgrenze lebt. Die Hartz-IV-Sätze müssen sofort deutlich angehoben werden. Übrigens hat sich bei einer Umfrage herausgestellt, dass auch die Anhängerinnen und Anhänger der Parteien, die sich anschicken, eine Ampel zu bilden, der Auffassung sind, dass das Geld für die Hartz-IV-Empfänger erhöht werden muss. Also handeln Sie, meine Damen und Herren!\n\n({4})\n\nDas Wohngeld muss auf der Basis der Bruttowarmmiete gezahlt werden, und Strom- und Gassperren wegen Zahlungsunfähigkeit müssen endlich verboten werden, meine Damen und Herren.\n\n({5})\n\nJetzt kommt in der Regel von der FDP der Zwischenruf, wer das alles bezahlen soll. Diese Frage ist sehr leicht zu beantworten: Auf der einen Seite gibt es 7,4 Millionen Menschen, die nicht genug Geld haben, um ihre Wohnung zu heizen. Gleichzeitig gibt es 119 Milliardäre; sie wissen häufig nicht, wo sie ihr Geld anlegen sollen. Mit einer gerechten Besteuerung von Vermögen könnten wir diese ungerechte Verteilung endlich beenden, meine Damen und Herren!\n\n({6})\n\nLeider haben SPD und Grüne im Laufe der Koalitionsverhandlungen schon ihren ersten Wahlbetrug begangen. Sie haben sich blitzschnell von ihrer Forderung aus dem Wahlkampf nach einer Vermögensteuer verabschiedet. Das ist eine fatale Entscheidung, meine Damen und Herren!\n\n({7})\n\nIn den Koalitionsverhandlungen wurde bisher nur eines deutlich: Diese Koalition wird offensichtlich von Herrn Lindner geführt.\n\n({8})\n\nDa ist die soziale Kälte vorprogrammiert. Ich finde, Herr Scholz hätte im Wahlkampf nur eine einzige Bedingung an die FDP stellen müssen: Armut darf es in diesem reichen Land nicht geben.\n\n({9})"
"1064396","Gesine","Lötzsch","DIE LINKE.","Member of Parliament","2021-11-18T00:00:00.000Z","https://dip21.bundestag.de/dip21/btp/20/20003.pdf","\n\nVielen Dank. – Frau Präsidentin! Meine sehr geehrten Damen und Herren! Im Wahlkampf erklärte der jetzige Schattenkanzler Lindner: Es gibt viel zu tun. – Das ist unbestreitbar richtig im Hinblick auf die Finanzierung unseres Gesundheitssystems. Die Krankenhäuser sind dramatisch unterfinanziert. Die Menschen, die im Gesundheitssystem arbeiten, sind am absoluten Limit, und viele von ihnen sind unterbezahlt. Das darf so nicht weitergehen.\n\n({0})\n\nUm das hier ganz klar zu sagen: Wir brauchen nicht nur eine Finanzspritze, wir brauchen eine grundlegende Änderung der Finanzierung unseres Gesundheitssystems. SPD und Grüne haben den Wählerinnen und Wählern ein Ende der Zweiklassenmedizin versprochen. Damit könnte man ja heute starten. Also ist unser Vorschlag: Schaffen Sie sofort die ungerechte Beitragsbemessungsgrenze ab, und starten Sie mit der versprochenen solidarischen Bürgerversicherung.\n\n({1})\n\nIch bin ja sehr gespannt, ob es die Bürgerversicherung in den Koalitionsvertrag schaffen wird.\n\n({2})\n\nDie Vermögensteuer haben Sie ja bereits nach der Wahl beerdigt. Ich kann Sie nur auffordern, nicht auch noch dieses Wahlversprechen zu brechen, meine Damen und Herren.\n\n({3})\n\nMan muss es doch mal ganz anschaulich erklären: Derjenige, bei dem im Monat 10 000 Euro aufs Konto kommen, bekommt die Gesundheitsversorgung zum Schnäppchenpreis. Darum kann man die Abschaffung der Beitragsbemessungsgrenze sofort beschließen, und zwar hier und heute.\n\n({4})\n\nWenn Sie sich dazu nicht durchringen können, dann heben Sie die Beitragsbemessungsgrenze doch wenigstens an.\n\nDie Ampel geht offensichtlich – wie die abgewählte Regierung – den einfachen Weg: Sie lassen sich den Zuschuss von den Steuerzahlerinnen und Steuerzahlern bezahlen. Wir als Linke fordern eine solidarische Bürgerversicherung und die Abschaffung der Beitragsbemessungsgrenze. So geht Solidarität.\n\nVielen Dank.\n\n({5})"
"1064767","Gesine","Lötzsch","DIE LINKE.","Member of Parliament","2021-12-16T00:00:00.000Z","https://dip21.bundestag.de/dip21/btp/20/20009.pdf","\n\nVielen Dank. – Frau Präsidentin! Meine sehr geehrten Damen und Herren! Es geht um 60 Milliarden Euro. Das ist mehr als der gesamte Verteidigungsetat – damit wir einmal wissen, um welche Größenordnung es geht. Diese 60 Milliarden will Finanzminister Lindner der Kontrolle des Bundestages weitgehend entziehen.\n\n({0})\n\nDas ist ein Angriff auf das Parlament und auf das Grundgesetz. Ein denkbar schlechter Einstieg, Herr Lindner!\n\n({1})\n\nIn der Opposition hat die FDP ein solches Vorgehen als verfassungswidrig gebrandmarkt, und auf einmal soll das alles verfassungskonform sein. Wir sagen Ihnen ganz klar: Nein, das ist es nicht!\n\n({2})\n\nMeine Damen und Herren, die alte Bundesregierung war der Auffassung, dass man die Pandemie mit Verordnungen bekämpfen könne. Der Bundestag wurde als Störfaktor ausgeschaltet. Wir haben gesehen, wohin das führte: Maskendealer schossen wie Pilze aus dem Boden, und in der Unionsfraktion konnten wir Anzeichen von Clankriminalität erkennen.\n\n({3})\n\nIch erinnere nur an den CSU-Abgeordneten Nüßlein. Er hat sein Mandat missbraucht, um dubiose Geschäfte zu machen. Das ist nicht vergessen. Korruption darf nicht länger straffrei sein, meine Damen und Herren.\n\n({4})\n\nGrundrechte einzuschränken und dem Parlament die Kontrollrechte zu entziehen, das ist einer Demokratie unwürdig. Wenn Sie mehr Fortschritt wagen wollen, dann geht das nur, in Anlehnung an Willy Brandt, mit mehr Demokratie. Ohne Demokratie gibt es keinen Fortschritt, meine Damen und Herren.\n\n({5})\n\n240 Milliarden Euro hat der Bundestag für die Bekämpfung der Pandemie als Kreditermächtigung bewilligt. 60 Milliarden wurden nicht ausgegeben. „Warum nicht?“, fragen wir. Haben wir etwa genügend Luftfilter in den Schulen? Nein. Haben wir etwa ausreichend Pflegekräfte? Nein. Und jetzt kommt der Höhepunkt: Haben wir ausreichend Impfstoffe? Auch das nicht. Das ist doch nicht zu fassen, meine Damen und Herren!\n\n({6})\n\nIn der vergangenen Woche hat der Bundestag eine einrichtungsbezogene Impfpflicht beschlossen; über eine allgemeine Impfpflicht wird diskutiert. Ex-Minister Jens Spahn erklärte immer wieder: Es ist ausreichend für alle da. – Und dann kommt der neue Minister, Karl Lauterbach, macht eigenhändig, wie er uns gestern im Haushaltsausschuss erklärt hat, die Inventur und sagt: Wir haben zu wenig. – Es ist doch unglaublich: Wir sind voll in der vierten Coronawelle und haben zu wenig Impfstoff. Das ist eine große Enttäuschung für uns und für die Menschen im Land, meine Damen und Herren.\n\n({7})\n\nSie haben viel Geld für die Rettung von DAX-Konzernen ausgegeben, aber Sie haben kein Geld ausgegeben für die Menschen, die sich mit 450‑Euro-Jobs über Wasser halten mussten und ohne Kurzarbeitergeld vor dem Nichts stehen. Sie haben nichts unternommen, um ausgebildete Pflegekräfte wieder in den Beruf zurückzuholen. Ja, das kostet Geld, aber das Geld war auch da. Die alte Regierung war unfähig und unwillig, dieses Geld sinnvoll auszugeben, und darum wurde sie auch zu Recht abgewählt.\n\nAber das Täuschungsmanöver von Herrn Lindner hat doch nur einen einzigen Grund: Sie brauchen dringend Geld, und Sie wollen nicht die Steuern für die Vermögenden erhöhen. Sie verhalten sich nicht wie ein Bundesfinanzminister, Sie verhalten sich wie ein Vermögensverwalter der Superreichen. Da kann ich nur sagen, meine Damen und Herren: Aufgabe verfehlt!\n\n({8})\n\nIch fordere SPD und Grüne ganz deutlich auf: Machen Sie dieses Spiel nicht mit! Sie hatten in Ihren Wahlprogrammen erklärt, Sie wollten die Vermögenden zur Finanzierung dieses Landes heranziehen. Davon dürfen Sie sich nicht verabschieden! Das ist unser Appell an Sie, meine Damen und Herren.\n\n({9})\n\nAlso: Ziehen Sie diesen Nachtragshaushalt zurück, und übernehmen Sie unseren sinnvollen Vorschlag! Wir wollen eine Vermögensabgabe für die reichsten 0,7 Prozent – ich wiederhole: 0,7 Prozent – der Bevölkerung in diesem Land. Da hätten wir hohe Einnahmen. Das wäre der richtige Weg. Das wäre sozial gerecht und nachhaltig.\n\nVielen Dank.\n\n({10})"
"1064810","Gesine","Lötzsch","DIE LINKE.","Member of Parliament","2021-12-16T00:00:00.000Z","https://dip21.bundestag.de/dip21/btp/20/20009.pdf","\n\nFrau Präsidentin! Meine sehr geehrten Damen und Herren! Die neue Koalition nennt sich nun „Fortschrittskoalition“. Darum prüfen wir jedes Gesetz, ob es diesem Anspruch auch gerecht wird. Was dieses Gesetz betrifft, sage ich: Es ist kein Fortschritt!\n\n({0})\n\nJa, wir haben im März 2020 dem Wirtschaftsstabilisierungsfonds zugestimmt. Was waren unsere Gründe? Wir wollten möglichst viele Arbeitsplätze retten. Doch dem Gesetz – das habe ich auch seinerzeit in der Rede gesagt – fehlten damals schon klare soziale und ökologische Regelungen, und die vermissen wir auch in dem neuen Gesetz. Das kann nicht gehen, meine Damen und Herren.\n\n({1})\n\nDie Lufthansa – das ist schon von der FDP erwähnt worden – wurde mit Steuergeldern gerettet, aber das Management hat daraufhin Tausende Beschäftigte entlassen. Die Mitarbeiterinnen und Mitarbeiter, die bleiben durften, mussten kräftige Geldeinbußen hinnehmen. Auf der anderen Seite war das Management nicht bereit, die Öffentlichkeit über seine Aktivitäten in Steueroasen zu unterrichten. Das ist nicht hinzunehmen! Das passt nicht zusammen.\n\n({2})\n\nWenn hier schon die KfW erwähnt worden ist, will ich doch einmal der Öffentlichkeit sagen, dass in der KfW – also der Kreditanstalt für Wiederaufbau, unserer staatlichen Förderbank – sehr viel Geld bewegt wird. Im Jahr 2020 zum Beispiel waren es 135 Milliarden Euro an Förderung. Im Verwaltungsrat der KfW sind aber nicht alle Parteien vertreten, und das ist demokratisch nicht hinnehmbar, meine Damen und Herren.\n\n({3})\n\nDie Großen hatten es leicht, an diese Fördergelder zu kommen. Ich bin immer wieder entsetzt, mit welchem bürokratischen Aufwand kleine und mittlere Unternehmen zugeschüttet werden und wie bedingungslos große Konzerne Milliarden an Steuergeldern bekommen. Das darf so nicht weitergehen, meine Damen und Herren.\n\n({4})\n\nFortschritt muss heißen: klare soziale und ökologische Vorgaben. Doch diesen Fortschritt kann ich in diesem Gesetz leider nicht erkennen.\n\nMeine Damen und Herren, es ist Zeit für mehr Solidarität. Es ist Zeit, dass die Vermögenden ihren Beitrag leisten. Es ist Zeit für eine Vermögensabgabe.\n\nHerzlichen Dank.\n\n({5})"
"1065589","Gesine","Lötzsch","DIE LINKE.","Member of Parliament","2022-01-14T00:00:00.000Z","https://dip21.bundestag.de/dip21/btp/20/20012.pdf","\n\nVielen Dank. – Herr Präsident! Meine sehr geehrten Damen und Herren! Zurzeit erleben wir drei globale Krisen gleichzeitig: erstens die Coronapandemie, zweitens die Klimakrise, und beide Krisen verschärfen die dritte Krise: die Verteilungskrise. Die muss endlich überwunden werden, meine Damen und Herren.\n\n({0})\n\nDas Vermögen konzentriert sich immer stärker in den Händen einiger weniger Milliardäre, die die Welt unter sich aufgeteilt haben. In der Bundesrepublik besitzen die reichsten 10 Prozent zwei Drittel des gesamten Vermögens. 45 Deutsche besitzen so viel wie die ärmere Hälfte der Bevölkerung. Das ist zutiefst ungerecht und beschneidet Lebenschancen, meine Damen und Herren.\n\n({1})\n\nMehr noch: Die extreme Ungleichheit ist eine große Gefahr für die Demokratie, für die gesellschaftliche Entwicklung, für den Fortschritt. Auch deshalb muss sie überwunden werden, meine Damen und Herren.\n\n({2})\n\nDie Lösung all dieser Krisen kostet viel Geld und Mut. Allein die zusätzlichen staatlichen Ausgaben für den Klimaschutz werden für den Zeitraum bis 2030 auf jährlich 46 Milliarden Euro geschätzt, sagt uns die Agora Energiewende. Ich sage Ihnen: Mit Schuldenbremse und Steuergeschenken an Reiche werden diese Krisen nicht zu lösen sein, meine Damen und Herren.\n\n({3})\n\nWir wissen doch alle – oder sollten es wissen –: Das Verfallsdatum der neoliberalen Ideen war spätestens mit der Finanzkrise 2008 erreicht. Das darf nicht vergessen werden.\n\nWir haben in den vergangenen Monaten die alte Regierung immer wieder gefragt: Wem sollen die Kosten der Krise aufgebürdet werden? – Wir haben keine Antwort erhalten. Auch diese Regierung hat die öffentliche Antwort auf diese Frage verweigert. Das nehmen wir nicht hin!\n\n({4})\n\nWir sagen Ihnen ganz deutlich: Es darf nicht sein, dass die Krisenkosten wieder bei den Armen und den Menschen mit kleinen und mittleren Einkommen abgeladen werden, wie das schon bei den Kosten der Finanzkrise war. Das ist nicht zu akzeptieren!\n\n({5})\n\nAlle fragen sich, warum die FDP – der kleinste Koalitionspartner – die Koalitionsverhandlungen für sich entschieden hat. Kolleginnen und Kollegen von SPD und Grünen, Sie wissen doch, welchen immensen Schaden die veralteten neoliberalen Ideologien in den letzten 20 Jahren angerichtet haben.\n\nWir alle – natürlich auch die Grünen – wissen: Die Klimakrise kann mit Marktmechanismen nicht bewältigt werden. Dafür braucht es andere, meine Damen und Herren.\n\n({6})\n\nDas Resultat sehen wir schon jetzt an den Stromzählern. Was tun Sie denn gegen die Explosion der Energiepreise? Warum führen Sie nicht wieder Preiskontrollen ein? Wo ist das angekündigte Klimageld? Hier muss gehandelt werden!\n\n({7})\n\nJeder, der es sehen will, sieht das Marktversagen an allen Ecken und Enden. Medikamentenmangel ist Marktversagen.\n\n({8})\n\nHyperglobalisierung ist ein Drahtseilakt ohne Netz und doppelten Boden. Die Pandemie hat uns allen gezeigt: Das Drahtseil kann reißen. Lieferketten zerbröseln. Und dann stehen wir ohne Medikamente und Schutzkleidung da.\n\nWarum, frage ich Sie, haben wir kein Netz und keinen doppelten Boden? Ich kann die Frage beantworten: Weil es im Kapitalismus um hohe Profite und niedrige Kosten geht. Sicherheit ist nur ein unliebsamer Kostenfaktor. Das darf so nicht weitergehen, meine Damen und Herren!\n\n({9})\n\nEine verantwortungsvolle Regierung ist für die Sicherheit in einem Land zuständig. Soziale und gesundheitliche Sicherheit kostet nun einmal Geld. Denn Sicherheit wird nicht allein durch Polizei und Militär garantiert. Das ist altes Denken.\n\n({10})\n\nMeine Damen und Herren, viele führende Ökonomen fordern eine gerechte Verteilung von Vermögen in unserer Gesellschaft. Wir auch; denn es ist der richtige Weg.\n\n({11})\n\nWir brauchen das Geld, um in eine sichere Zukunft zu investieren.\n\nMit dem Nachtragshaushalt, Herr Lindner, haben Sie sich ein paar Buchungstricks ausgedacht. Aber das wird Ihnen auf lange Sicht nicht helfen. Sie müssen Farbe bekennen. Wer die Krisen bewältigen will, muss endlich eine mutige, gerechte Steuerreform durchsetzen. Wir als Linke fügen hinzu: Wir wollen eine einmalige Vermögensabgabe für Milliardäre und Multimillionäre. Das würde 0,7 Prozent der Bevölkerung in unserem Land betreffen. Das ist doch wirklich nicht zu viel verlangt, meine Damen und Herren.\n\n({12})\n\nAbschließend: Herr Lindner, Sie haben Ihre Ministerkollegen aufgerufen, sparsamer zu sein. Ich beginne gleich mit dem Vorschlag: Verzichten wir auf ein neues Wettrüsten! Wenn wir 2 Prozent des Bruttoinlandsproduktes für Rüstung ausgeben, gefährden wir die Welt.\n\n({13})\n\nWir müssen auf friedliche Koexistenz setzen. Das ist Fortschritt, und dafür stehen wir.\n\nVielen Dank, meine Damen und Herren.\n\n({14})"
"1066655","Gesine","Lötzsch","DIE LINKE.","Member of Parliament","2022-02-16T00:00:00.000Z","https://dip21.bundestag.de/dip21/btp/20/20016.pdf","\n\nVielen Dank, Frau Präsidentin. – Herr Minister, Sie sprachen über die Entlastung der Bürgerinnen und Bürger. Allerdings war mir das, ehrlich gesagt, nicht konkret genug. Ich kann auch begründen, warum ich das genauer wissen will: Nach Angaben zum Beispiel von Eurostat hatten 15,5 Prozent der Alleinerziehenden in Deutschland im Jahr 2020 nicht ausreichend Geld, um ihre Wohnungen so zu heizen, dass sie nicht frieren müssen. Aber nicht nur Alleinerziehende haben nicht ausreichend Geld, um die Energiekosten zu tragen. Darum würde ich gerne wissen, wie Sie sich konkret vorstellen, diese Menschen zu entlasten: ob Sie aus den zusätzlichen Steuermehreinnahmen etwas zurückgeben wollen und, wenn ja, wie und an welche Personengruppen."
