id,firstname,lastname,faction,position,date, url,speech
"1053682","Gökay","Akbulut","DIE LINKE.","Member of Parliament","2021-01-27T00:00:00.000Z","https://dip21.bundestag.de/dip21/btp/19/19205.pdf","\n\nSehr geehrte Frau Präsidentin! Liebe Kolleginnen und Kollegen! Die Koalition hat sich das Ziel gesetzt, das Patentgesetz und andere Gesetze im Bereich des gewerblichen Rechtsschutzes zu modernisieren. Wenn Sie es sich schon auf die Fahne schreiben, das Patentrecht zu modernisieren, dann sollten Sie endlich anfangen, nicht nur von Erfindern, sondern auch von Erfinderinnen im Gesetzestext zu schreiben.\n\n({0})\n\nDiese Anmerkung gilt auch für alle anderen Gesetzentwürfe, die Sie derzeit vorlegen. Es ist kein Zufall, dass Gesetze traditionell die grammatikalisch männliche Form verwenden und die weibliche Form nicht vorkommt. Es waren ja schließlich auch fast immer Männer, die sich damit Rechte sicherten. Dies sollte man gerade im Bereich des Patentrechts, wo es um Ideen und Innovationen geht, ändern und mit gutem Beispiel vorangehen;\n\n({1})\n\ngerne auch in diverser Sprache.\n\nLiebe Kolleginnen und Kollegen, wir unterstützen das Anliegen der Bundesregierung, Patentnichtigkeitsverfahren zu beschleunigen und den Geheimnisschutz in Patentstreitsachen zu verbessern, haben aber auch Kritik an dem derzeitigen Gesetzentwurf. Der Entwurf benachteiligt weiterhin Einzelerfinderinnen und ‑erfinder. Mit dem neuen Gesetzentwurf trägt die Patentinhaberin das Risiko der Rechtsbeständigkeit und der oder die potenziell Verletzte das Risiko der Rechtsdurchsetzung. Große Unternehmen haben hier die nötigen Geldmittel, um solche Verfahren zu führen. Im Zweifel können sie auch einfach das Risiko eines Prozesses und der Folgekosten eingehen.\n\nZwar gibt die Koalition vor, dass sie hier eine Anpassung vornimmt; das ist jedoch nicht ausreichend. Das im Gesetzentwurf zitierte Urteil „Wärmetauscher“ des BGH macht deutlich, dass es einer Ergänzung der vorgesehenen Regelungen um weitere Kriterien oder Regelbeispiele bedarf; das hat auch der Bundesrat festgestellt. Außerdem sollte die Recherchepflicht mit aufgenommen werden.\n\nWir fordern einen besseren Schutz, insbesondere für Einzelerfinderinnen und ‑erfinder. Aber auch Forschungsorganisationen und ‑initiativen, kleine und mittelständische Unternehmen und Start-ups benötigen einen starken und differenzierten Patent- und Innovationsschutz. Ihre Kritik an den vorgesehenen Regelungen sollte berücksichtigt und mit aufgenommen werden.\n\nBeim Patentrecht geht es trotz der Offenlegung der hinter dem Patent stehenden Idee auch um eine Privatisierung von Wissen. Als Linke setzen wir uns für eine linke und emanzipatorische Politik ein. Dabei stellen wir klar, dass Beteiligungsmöglichkeiten und der öffentliche Zugang zu Wissen für Innovationen wichtig sind.\n\n({2})\n\nDies berücksichtigt der aktuelle Entwurf der Koalition jedoch nicht.\n\nEine Modernisierung des Patentrechts unter Berücksichtigung der verschiedenen Kritikpunkte der Sachverständigen ist notwendig. Wir freuen uns auf die Anhörung hierzu und werden unsere konkreten Vorschläge in den folgenden Ausschusssitzungen einbringen.\n\nVielen Dank.\n\n({3})"
"1054946","Gökay","Akbulut","DIE LINKE.","Member of Parliament","2021-02-11T00:00:00.000Z","https://dip21.bundestag.de/dip21/btp/19/19209.pdf","\n\nSehr geehrte Frau Präsidentin! Liebe Kolleginnen und Kollegen! Zur heutigen letzten Beratung des von der Koalition eingebrachten Gesetzentwurfes zur Änderung des Gesetzes über die Änderung von Familiennamen und Vornamen kann ich nur sagen: Einen so kurzen Gesetzentwurf hatten wir hier schon lange nicht mehr vorliegen. Dennoch verfolgt dieser Gesetzentwurf ein wichtiges und richtiges Anliegen: Das Namensänderungsgesetz stammt aus dem Jahre 1938. Es beinhaltet noch Formulierungen wie „Reichsminister“ und „Deutsches Reich“. Mit der neuen Änderung wäre das Dritte Reich endlich aus dem Gesetz komplett verbannt. Jetzt muss dieser Geist hier auch noch aus dem Parlament verbannt werden.\n\n({0})\n\nAls Linksfraktion unterstützen wir natürlich diese Initiative.\n\nDass es aber so lange gedauert hat, bis Sie auf die Idee gekommen sind, rechtliche Relikte aus dem Dritten Reich zu entfernen, ist schon bitter, Herr Frei. Es sind über 71 Jahre seit Bestehen der Bundesrepublik, und trotzdem müssen Rechtsanwenderinnen und Betroffene noch den Begriff „Deutsches Reich“ in Gesetzestexten lesen und studieren. Und wenn Sie schon hier von Modernisierung sprechen, dann wäre es auch jetzt eine gute Gelegenheit gewesen, sprachlich wirklich ins 21. Jahrhundert zu kommen und auch das moderne Gendern bei diesem Gesetzentwurf durchgängig einzubeziehen.\n\nEbenfalls in letzter Beratung debattieren wir heute in diesem Rahmen den Gesetzentwurf der FDP zur Änderung des Ehe- und Geburtsnamensrechts. Die Linke begrüßt diesen Gesetzentwurf der FDP, da er den Anspruch der Namensvielfalt aufgreift und versucht, den geänderten Lebenswirklichkeiten unserer Gesellschaft gerecht zu werden. Die Möglichkeit, einen echten Doppelnamen als gemeinsamen Ehenamen bestimmen zu können, verschafft eine Wahl auf Augenhöhe und Parität für viele Ehepartner, was wir natürlich unterstützen.\n\n({1})\n\nAllerdings geht die Initiative der FDP nicht weit genug; denn dieser Gesetzentwurf löst nur ein Teilproblem des zivilrechtlichen Namensrechts. Das Gesamtgefüge der Norm und ihre Rechtsprobleme und Rechtspraxis bleiben leider unberücksichtigt. Das gilt vor allem im Hinblick auf die Regelung des § 1355 Absatz 5 Satz 2 BGB, wonach die geschiedenen Ehepartnerinnen und Ehepartner ihren Geburtsnamen wieder annehmen können. Häufig führt das aber dazu – und das ist ja das große Problem –, dass die Namensgleichheit eines Ehepartners mit den Kindern wegfällt, da sich diese der Änderung nicht anschließen können; so lautet ja die Entscheidung des Bundesverfassungsgerichtes vom 18. Februar 2004. Oftmals verzichten viele Eltern daher auf diese Möglichkeit. Hier müssen Optionen berücksichtigt werden, die auch schon in der Sachverständigenanhörung eingebracht worden sind.\n\nAls Linksfraktion setzen wir uns für eine umfassende Novellierung ein, die auch diese Probleme aufgreift und hier nicht nur punktuelle Lösungen liefert.\n\nVielen Dank.\n\n({2})"
"1055201","Gökay","Akbulut","DIE LINKE.","Member of Parliament","2021-02-12T00:00:00.000Z","https://dip21.bundestag.de/dip21/btp/19/19210.pdf","\n\nSehr geehrte Frau Präsidentin! Liebe Kolleginnen und Kollegen! Die AfD möchte uns wieder mal ihre rassistische Hetze auf die Tagesordnung setzen. Mit Ihrem Antrag und Ihrem Gesetzentwurf zum Staatsangehörigkeitsrecht bedienen Sie erneut Ihren völkischen Nationalismus\n\n({0})\n\nund nichts anderes. Das sehen wir auch heute hier in dieser Debatte.\n\n({1})\n\nZum Staatsangehörigkeitsrecht haben wir als Linksfraktion klare Positionen. Im Gegensatz zur AfD setzen wir uns für ein modernes Einbürgerungs- und Staatsangehörigkeitsrecht ein, das Einbürgerungen erleichtert und vor allem die Partizipation stärkt. Hier möchte ich auch noch mal darauf hinweisen, Herr Amthor: Aktuell erfolgen über 60 Prozent der Einbürgerungen unter Beibehaltung der bisherigen Staatsangehörigkeit.\n\n({2})\n\nDoppelte Staatsangehörigkeit bzw. Mehrsprachigkeit ist nun mal Realität in vielen Teilen unserer Gesellschaft, europaweit und weltweit, und das sollte nicht problematisiert, sondern erleichtert werden.\n\n({3})\n\n– Nein, das ist kein Problem.\n\nViele Kommunen und Bundesländer führen aktuell erfolgreich mehrsprachige Einwanderungskampagnen durch, und diese Kampagnen werden auch von den größten Migrantenselbstorganisationen unterstützt, die auch entsprechende Forderungen aufstellen.\n\nWenn Migrantinnen und Migranten wie Sasa Stanisic, Gewinner des Deutschen Buchpreises und Autor, aufgrund der restriktiven Aufenthaltsregelungen und Einbürgerungsverfahren sagen, dass sie nach dem heute geltenden Recht nicht in Deutschland hätten bleiben dürfen, dann ist das ein Alarmsignal. Denn Migrantinnen und Migranten wie Sasa Stanisic liefern im Gegensatz zur AfD einen wichtigen Beitrag für unsere vielfältige Gesellschaft.\n\n({4})\n\n– Natürlich. Wenn Sie in Ihrem Gesetzentwurf von einem vermeintlichen Zerfall der Wertebasis sprechen, wird deutlich, dass Sie am völkischen Nationalismus hängen geblieben sind.\n\n({5})\n\nWenn hier irgendwelche Werte zerfallen, dann, weil Sie weiterhin zu Hess und Hatze aufrufen.\n\n({6})\n\n– Hass und Hetze. Und Fratze, wie Sie.\n\nSie fordern in Ihrem Antrag, dass Einbürgerungswillige nicht durch verfassungsfeindliche Handlungen jeglicher Art auffällig geworden sein dürfen. Interessant, denn Sie alle hier und die meisten bzw. ein größerer Teil Ihrer Parteimitglieder würden ja nach Ihren eigenen Regelungen an einer Einbürgerung scheitern.\n\n({7})\n\n– Natürlich. – Alleine die Formulierung „Die Entscheidung, wer zu einem Staatsvolk gehören soll, muss mit der Überlegung einhergehen, wer willens und fähig ist, für ein Land Verantwortung zu übernehmen und sich gut zu integrieren“ zeigt, dass diese Fähigkeit Ihrer Ansicht nach bestimmten Gruppen komplett abgesprochen werden soll.\n\n({8})\n\nWer soll denn hier überhaupt darüber entscheiden? Sie etwa? Alte weiße Männer mit Hundekrawatten sicher nicht. Davon hatten wir ja genug.\n\n({9})\n\nIhr Papier zum Staatsangehörigkeitsrecht, das Sie zum Jahresbeginn aus Angst vor einer Beobachtung durch den Verfassungsschutz vorgelegt haben, kann und wird Ihre völkische Ausrichtung nicht überdecken. Mit Ihrem heute aufgesetzten Antrag machen Sie deutlich: Sie stehen weiterhin zu einem völkischen Staatsangehörigkeitsverständnis.\n\n({10})\n\nÜbrigens sollten Sie bedenken, dass das völkische Staatsangehörigkeitsverständnis –"
"1055203","Gökay","Akbulut","DIE LINKE.","Member of Parliament","2021-02-12T00:00:00.000Z","https://dip21.bundestag.de/dip21/btp/19/19210.pdf","\n\n– für das Bundesverfassungsgericht ausschlaggebend war, die Verfassungsfeindlichkeit der NPD 2017 festzustellen."
"1055205","Gökay","Akbulut","DIE LINKE.","Member of Parliament","2021-02-12T00:00:00.000Z","https://dip21.bundestag.de/dip21/btp/19/19210.pdf","\n\nWir hoffen, dass es bei Ihnen nicht so lange dauern wird.\n\nVielen Dank.\n\n({0})"
"1057371","Gökay","Akbulut","DIE LINKE.","Member of Parliament","2021-03-25T00:00:00.000Z","https://dip21.bundestag.de/dip21/btp/19/19218.pdf","\n\nSehr geehrte Frau Präsidentin! Sehr geehrte Kolleginnen und Kollegen! Bei einem Ziel sind wir uns alle einig: Im Kampf gegen sexualisierten Missbrauch von Kindern darf es absolut keine Toleranz geben. Bei der Bekämpfung dieser Taten gibt es Handlungsbedarf. Wir unterstützen die Zielsetzung der Bundesregierung und einige der Maßnahmen wie die Fortbildung der Richterinnen und Richter; aber die Umsetzung in diesem Gesetzentwurf weist immer noch verschiedene Mängel auf.\n\nIn der Anhörung des Rechtsausschusses haben nahezu alle Experten den Gesetzentwurf der Bundesregierung grundlegend kritisiert. Wir haben erwartet, dass die Bundesregierung zumindest die grundlegenden Mängel hier korrigiert, genauso wie sie die verfehlte Begriffsbildung der sexualisierten Gewalt geändert hat, nachdem sieben von acht Sachverständigen dies kritisiert haben. Leider ignoriert die Bundesregierung nach wie vor wichtige Anregungen der Experten, der Staatsanwälte, der Richter und der Strafrechtler. Die Enttäuschung bei den Juristinnen und Juristen aus der Praxis ist deshalb groß.\n\n({0})\n\nDie Bundesregierung konzentriert sich auf die Strafverschärfung als Mittel zur Abschreckung. Es wurde jedoch in vielen Studien nachgewiesen, dass es hier keinen Zusammenhang gibt. Deutlich wirksamer wären präventive Maßnahmen wie umfangreicher Personalausbau in der Jugendarbeit, bei den Telefonhotlines, bei den Beratungsstellen, bei den Therapieplätzen und in den Frauenhäusern. Die Bundesregierung begründet ihre Strafverschärfung mit den schrecklichen Fällen aus Staufen, Münster, Bergisch Gladbach und Lügde. Dies macht jedoch wenig Sinn, da die sich schon unter der aktuellen Rechtslage als Verbrechen darstellen.\n\nWie schon von Sachverständigen kritisiert, werden die Verschärfungen in der Praxis bei der Umsetzung zu Problemen führen. Denn die pauschale Hochstufung zum Verbrechen und das Fehlen einer Regelung zu minderschweren Fällen führen dazu, dass die erforderlichen Differenzierungsmöglichkeiten nicht mehr gegeben sind. Beispielsweise ist verfahrensrechtlich mit der Verbrechenseinstufung bei sehr leichten Fällen eine Einstellung ausgeschlossen. Es muss dann immer bei allen Fällen eine Hauptverhandlung durchgeführt werden, die für die Opfer eine Belastung darstellt. Dazu ein einfaches Beispiel: Ein 21-Jähriger küsst einvernehmlich eine 14-Jährige. Es kommt zu einer Gerichtsverhandlung, in der keine Strafe ausgesprochen wird.\n\n({1})\n\nMit solchen Verfahrensregelungen werden die Gerichte zusätzlich belastet und können nicht schwere Sexualstraftaten verfolgen, weil ihre Kapazitäten hier gebunden werden.\n\nDie Bundesregierung ignoriert leider diese Bedenken der Juristen. Ich möchte einen der Sachverständigen aus der Anhörung, den Strafrechtler Professor Dr. Eisele zitieren. Er kritisiert zu Recht, dass im Bereich der Kinderpornografie leider darauf verzichtet wurde, die Strafrahmen nach der Schwere der abgebildeten Missbrauchshandlungen abzustufen, sodass etwa zwischen einem einzigen Posing-Foto und Videoaufnahmen mit schweren Vergewaltigungshandlungen an kleinen Kindern nicht hinreichend differenziert wird.\n\nAlso: Wir stimmen mit Ihnen überein, dass sexueller Missbrauch von Kindern besser bekämpft werden muss, aber nicht in dieser Form und vor allem nur bei Einbeziehung der Fachwelt. Deshalb können wir dem Gesetzentwurf der Bundesregierung und den Änderungen nicht zustimmen.\n\n({2})"
"1057562","Gökay","Akbulut","DIE LINKE.","Member of Parliament","2021-03-25T00:00:00.000Z","https://dip21.bundestag.de/dip21/btp/19/19218.pdf","\n\nSehr geehrter Herr Präsident! Liebe Kolleginnen und Kollegen! Die AfD bringt hier einen Gesetzentwurf ein, mit dem sie ihre rechte Hetze weiterhin legitimieren möchte. Ich erinnere daran, dass Frau Storch\n\n({0})\n\nAnfang 2016 auf Social Media den Schusswaffengebrauch gegen Menschen an der Grenze gefordert hat.\n\n({1})\n\nDiese gefährlichen rechten Beiträge in der digitalen Welt schaffen Stimmung, mobilisieren und stärken rassistische Netzwerke.\n\n({2})\n\nAus Worten werden schließlich Taten, wie wir sie in Halle, in Hanau und im Falle von Walter Lübcke mitverfolgt haben.\n\n({3})\n\nIm November 2017 wurde bekannt, dass unter den Mitgliedern der geschlossenen Facebook-Gruppe „Patrioten“ 48 Mandatsträger der AfD zu finden waren, davon 15 aus der Bundestagsfraktion und 33 aus den Landtagen.\n\n({4})\n\nNeben rassistischen, frauenverachtenden, homophoben und gewaltverherrlichenden Beiträgen versendete ein Mitglied der Gruppe\n\n({5})\n\neine Fotomontage mit einem Bild von Anne Frank auf einer Pizzaschachtel, versehen mit der Aufschrift „Die Ofenfrische, locker und knusprig zugleich“. Diese zutiefst verachtende Form des Antisemitismus in den Reihen der AfD zeigt auch,\n\n({6})\n\ndass wir uns gemeinsam sowohl in den sozialen Netzwerken als auch in allen anderen Lebensbereichen konsequent gegen Antisemitismus und Rassismus stellen müssen.\n\n({7})\n\nJens Maier und andere Abgeordnete der Bundestagsfraktion gehörten zu den aktiven Mitgliedern dieser Facebook-Gruppe. Als Ihre Facebook-Gruppe als Rassistentruppe dann öffentlich aufgeflogen ist und sie sich davon distanzieren wollten,\n\n({8})\n\nist die baden-württembergische Landtagsabgeordnete der AfD, Christina Baum, der Gruppe sogar noch extra beigetreten und forderte die Mitglieder dieser Gruppe auf: Bleibt standhaft und seid mutig! – Dies, meine Damen und Herren, hat nichts mit Meinungsvielfalt zu tun.\n\n({9})\n\nSie verbreiten auch in dieser Debatte hier wieder Fake News und stellen es so dar, als ob der Raum im Internet komplett überreguliert wäre. Ich als Frau mache eher eine gegenteilige Erfahrung. Frauen, vor allem diejenigen mit Migrationsgeschichte, bekommen immer mehr rassistische und sexistische Kommentare und Drohungen ab. Diese Art der Kommentare und Beiträge sind jedoch keine Meinungen, sondern stellen Straftatbestände dar. Ich habe hier auch einige Anzeigen gemacht und Verfahren gewonnen.\n\n({10})\n\nBeleidigungen und rechte Hetze sind keine Meinungsvielfalt.\n\n({11})\n\nSie haben in einem demokratischen Diskurs nichts zu suchen. Darum gibt es Regeln für den Umgang im Netz. Die sozialen Netzwerke müssen hier auch ihrer Verantwortung gerecht werden und die Rechte der Nutzerinnen und Nutzer stärken.\n\n({12})\n\nDas Netzwerkdurchsetzungsgesetz der Bundesregierung ist bisher ineffektiv geblieben und rechtlich höchst problematisch. Wir fordern spezialisierte Abteilungen in den Bereichen der Justiz und Polizei, die das bestehende Strafrecht im Internet endlich auch konsequent durchsetzen.\n\nIhr Gesetzentwurf gehört in den Papierkorb wie alle anderen.\n\nVielen Dank.\n\n({13})"
"1064120","Gökay","Akbulut","DIE LINKE.","Member of Parliament","2021-11-11T00:00:00.000Z","https://dip21.bundestag.de/dip21/btp/20/20002.pdf","\n\nSehr geehrte Frau Präsidentin! Liebe Kolleginnen und Kollegen! Mindestens zehn Menschen sind bereits an der Grenze von Polen zu Belarus gestorben – zehn Menschen, die nicht hätten sterben müssen, hätte man geltendes Recht an der EU-Außengrenze eingehalten. Täglich werden Menschen Opfer von illegalen Pushbacks von Polen nach Belarus und an anderen europäischen Grenzen.\n\n({0})\n\nIch selber betreue einige solcher Fälle als Abgeordnete und stehe im Austausch mit vielen NGOs. Ich möchte hier noch mal betonen, dass für die EU Menschenrechte Maßstab politischen Handelns sein müssen\n\n({1})\n\nund nicht die Erzählung, dass geflüchtete Menschen als Waffen eingesetzt werden.\n\n({2})\n\nSchutzsuchende sind keine Waffen und keine Kriegsparteien.\n\nDie Zurückweisung von Geflüchteten ohne individuelle Prüfung des Asylverfahrens ist ein eindeutiger Verstoß gegen die Genfer Flüchtlingskonvention, gegen die Europäische Menschenrechtskonvention und gegen geltendes EU-Asylrecht.\n\n({3})"
"1064122","Gökay","Akbulut","DIE LINKE.","Member of Parliament","2021-11-11T00:00:00.000Z","https://dip21.bundestag.de/dip21/btp/20/20002.pdf","\n\nNein, danke. Wir müssen weitermachen. – Diese Rechte können nicht durch nationale Gesetzgebung ausgehebelt werden, wie es derzeit Polen immer wieder versucht. Hiergegen muss die Europäische Kommission endlich vorgehen.\n\nDie EU darf sich gegenüber Lukaschenko nicht erpressbar machen, heißt es immer wieder. Aber die EU hat sich doch selbst in diese Lage gebracht, weil sie die Aufnahme einer überschaubaren Zahl von Schutzsuchenden als Bedrohung dargestellt hat.\n\n({0})\n\nDoch was sind ein paar Tausend Menschen auf 450 Millionen europäische Bürgerinnen und Bürger verteilt? Die Situation an der Grenze ist doch einfach untragbar.\n\n({1})\n\nErschreckend ist, wie sehr das rechte Narrativ der Abschottung um jeden Preis inzwischen die Asyldebatte in Deutschland bestimmt. 2015 wurde die Forderung der AfD, die Grenzen zu schließen und Flüchtlinge zurückzuweisen, notfalls mit Zäunen und Schießbefehl, noch einhellig zurückgewiesen. Aber inzwischen wird der Bau von Mauern propagiert, und man nimmt tote Menschen an der polnisch-belarussischen Grenze hier anscheinend achselzuckend in Kauf.\n\nWir möchten uns aber nicht an diese Bilder gewöhnen. Deutschland und die Europäische Union dürfen nicht weiter Teil des Wettbewerbs der Brutalität sein und das menschenverachtende Spiel Lukaschenkos, bei dem alle Gesetze und Flüchtlingskonventionen nicht mehr gelten, befeuern. Diese menschenverachtende Migrationspolitik der Europäischen Union muss endlich beendet werden. Die NGOs brauchen dringend und so schnell wie möglich Zugang, damit sie den Menschen helfen und sie unterstützen können, weil die Europäische Union und auch die Bundesregierung systematisch in der Migrationsfrage versagen. Diese menschenverachtende Flüchtlingspolitik muss endlich beendet werden.\n\nVielen Dank.\n\n({2})"
"1066529","Gökay","Akbulut","DIE LINKE.","Member of Parliament","2022-04-07T00:00:00.000Z","https://dip21.bundestag.de/dip21/btp/20/20015.pdf","\n\nSehr geehrte Frau Präsidentin! Liebe Kolleginnen und Kollegen! Sehr geehrte Damen und Herren! Mit dem vorliegenden Gesetzentwurf soll es größere Rechtssicherheit bei der Besetzung der Leitung der Antidiskriminierungsstelle des Bundes geben. Dieses Vorhaben begrüßen wir durchaus; denn es ist untragbar, dass die Leitung dieser Behörde seit Jahren vakant ist.\n\n({0})\n\nWir leben in Zeiten, in denen rassistisch, antisemitisch und queerfeindlich motivierte Beleidigungen und Übergriffe erschreckende Dimensionen erreicht haben. Ressentiments und Vorurteile in der Bevölkerung sind auf einem beängstigend hohen Niveau; ich spreche hier auch aus eigener Erfahrung. Es ist daher inakzeptabel, dass die Antidiskriminierungsbehörde des Bundes nur kommissarisch geleitet wird. Das ist ein fatales Zeichen für die Betroffenen und für all diejenigen, die sich in der Antidiskriminierungsarbeit engagieren.\n\n({1})\n\nWir freuen uns, dass hier endlich eine Neuregelung geschaffen wird, bei der die Leitung dieser Behörde durch das Parlament gewählt wird. Die Wahl durch den Bundestag schafft größere Transparenz, wertet diese Leitungsstelle auf und erspart uns in Zukunft hoffentlich Peinlichkeiten bei der Besetzung, wie wir sie unter der ehemaligen Familienministerin Franziska Giffey erleben mussten.\n\nMit diesem Gesetzentwurf soll auch etwas mehr Klarheit über die Rolle der Antidiskriminierungsstelle im Gesamtgefüge der Bundesverwaltung geschaffen werden. Das gelingt jedoch nur begrenzt. So soll die Stelle bei allen Vorhaben, die ihre Aufgabenbereiche berühren, beteiligt werden. Das ist zwar ein Fortschritt gegenüber dem Status quo; aber insgesamt bleibt der Gesetzentwurf weit hinter den Anforderungen des Evaluierungsberichtes zum Allgemeinen Gleichbehandlungsgesetz von 2016 zurück.\n\n({2})\n\nDamals wurde empfohlen, die Antidiskriminierungsstelle in eine eigenständige oberste Bundesbehörde umzuwandeln, um ihre Unabhängigkeit von Regierungen auch langfristig zu garantieren. Diesen Schritt wollte die ach so fortschrittliche Ampelkoalition offenbar nicht gehen. Stattdessen erfolgt lediglich eine Umbenennung in „Die oder der Unabhängige Bundesbeauftragte für Antidiskriminierung“. Doch anders als der neue Titel vermuten lässt, ist die Antidiskriminierungsstelle weiterhin dem Bundesfamilienministerium untergeordnet. Ihre Leitung bleibt unter der Rechtsaufsicht der Bundesregierung. Von einer unabhängigen Behörde, Herr Lehmann, kann hier wirklich nicht die Rede sein.\n\nAuch in anderen Fragen kann der Gesetzentwurf viele Erwartungen leider nicht erfüllen. Eine Erweiterung der Diskriminierungsmerkmale findet hier nicht statt; kein Wort zum Verbandsklagerecht, keine wesentlichen Erweiterungen der Befugnisse der oder des Bundesbeauftragten für Antidiskriminierung. So versäumt die Ampel die Chance, mit einer grundlegenden Reform einen Beitrag zur Stärkung und vor allem zur Verbesserung der Handlungsfähigkeit der Antidiskriminierungsarbeit des Bundes zu schaffen.\n\nVielen Dank.\n\n({3})"
