id,firstname,lastname,faction,position,date, url,speech
"1025380","Gökay","Akbulut","DIE LINKE.","Member of Parliament","2019-05-16T00:00:00.000Z","https://dip21.bundestag.de/dip21/btp/19/19101.pdf","\n\nSehr geehrter Herr Präsident! Liebe Kolleginnen und Kollegen! Wir feiern diesen Monat das 70-jährige Bestehen des Grundgesetzes. Das Grundgesetz ist eine große Errungenschaft in Bezug auf die Menschenrechte und den Rechtsstaat, gerade im Hinblick auf die davorliegende NS-Zeit.\n\nDas Grundgesetz hat uns die Grundrechte – Artikel 1 bis Artikel 19 – gebracht, die Freiheits- und Gleichheitsrechte gewährleisten, die der Staat schützen und wahren muss. Es reicht aber nicht, sich auf den bestehenden Errungenschaften auszuruhen. Wir müssen das Recht auch fortentwickeln und an die gesellschaftlichen Veränderungen anpassen.\n\n({0})\n\nSchließlich sind es über 10 Millionen Menschen ohne deutsche Staatsangehörigkeit, die ihren Lebensmittelpunkt hier in Deutschland und in unserer Gesellschaft haben.\n\n({1})\n\nEine Anpassung ist daher zeitgemäß und auch angebracht.\n\nDie deutschen Grundrechte müssen in Menschenrechte umgewandelt werden. Rechte wie die Versammlungs- und die Vereinigungsfreiheit, die Berufsfreiheit und das Recht auf Freizügigkeit wurden damals nur deutschen Staatsbürgerinnen und Staatsbürgern zuerkannt. Beispielsweise steht in Artikel 8 des Grundgesetzes, dass „alle Deutschen“ das Recht haben, sich zu versammeln. Dort wird explizit nur auf deutsche Staatsbürger Bezug genommen, anders als zum Beispiel in der UN-Menschenrechtscharta, in der Europäischen Menschenrechtskonvention oder in der Europäischen Grundrechtecharta. Dort werden beispielsweise die Versammlungs- und die Vereinigungsfreiheit ausdrücklich allen Menschen bzw. jeder Person zuerkannt. Das muss im Grundgesetz angepasst werden.\n\nDie historische Begründung, warum dort nur „Deutschen“ steht, ist aus heutiger Sicht nicht mehr tragbar. Sachfremde Erwägungen haben damals dominiert und dazu geführt, dass man anders als noch im ersten Entwurf für das Grundgesetz, dem Chiemseer Entwurf, nicht „alle Menschen“ formuliert hat. Das wurde unter anderem im Hinblick auf die Gefahr, die von bolschewistischen Vereinigungen ausgehe, begründet.\n\nEiner der vehementesten Gegner der Formulierung „alle Menschen“ war damals übrigens der CDU-Abgeordnete Hermann von Mangoldt, der zur NS-Zeit ein Befürworter der Rassengesetze war und sie durch juristische Schriften auch legitimierte.\n\n({2})\n\nIn seinem späteren Kommentar zum Grundgesetz wurde noch argumentiert, dass eine Ausdehnung der deutschen Grundrechte auf Nichtdeutsche die Gefahr der Überfremdung bedeuten würde.\n\n({3})\n\nWir denken, dass gerade in dieser Zeit, in der Menschen mit Migrationshintergrund und Schutzsuchende vermehrt Anfeindungen und Angriffen durch die Rechten und Neonazis in Deutschland und ganz Europa ausgesetzt sind, mit der entsprechenden Änderung ein wichtiges Zeichen von Weltoffenheit, Antirassismus und Teilhabe gesetzt werden würde.\n\n({4})\n\nDiese gleichen Rechte sollten ausdrücklich in die speziellen Grundrechtsparagrafen aufgenommen werden, um einmal mehr zu zeigen, dass der Deutsche Bundestag an der Seite aller Menschen steht, die hier in Deutschland leben.\n\nDenjenigen, die sagen, dass diese Änderung nicht nötig sei, weil Nichtdeutsche über einfache Gesetze, über das Auffanggrundrecht oder über die allgemeine Handlungsfreiheit geschützt sind, möchte ich entgegenhalten, dass so aber nicht dasselbe Schutzn iveau erreicht wird. Das hat das Bundesverfassungsgericht selbst in seiner heute noch gültigen Entscheidung von 1978 klargestellt.\n\nEigentlich dürfte auch Herr Seehofer nichts dagegen haben; schließlich ist die Bayerische Verfassung da ja vorbildlich: Sie spricht bei allen genannten Grundrechten explizit von allen Bewohnerinnen und Bewohnern Bayerns, ohne eine Unterscheidung im Hinblick auf die Staatsbürgerschaft zu machen.\n\nMenschenrechte sind unteilbar und sollten für alle Menschen in unserer Gesellschaft gelten. Dies muss auch auf unsere Verfassungswirklichkeit übertragen werden.\n\nVielen Dank für Ihre Aufmerksamkeit.\n\n({5})"
"1026494","Gökay","Akbulut","DIE LINKE.","Member of Parliament","2019-06-07T00:00:00.000Z","https://dip21.bundestag.de/dip21/btp/19/19105.pdf","\n\nSehr geehrter Herr Präsident! Liebe Kolleginnen und Kollegen! Wir debattieren heute über mehrere Gesetzentwürfe, unter anderem den Entwurf eines Dritten Gesetzes zur Änderung des Asylbewerberleistungsgesetzes, der als sogenannter Beitrag zur Integration geflüchteter Menschen dienen soll, aber neben geringen Verbesserungen erhebliche Einschränkungen mit sich bringt.\n\nEs ist zynisch, dass Sie in Ihrem Gesetzentwurf das Urteil des Bundesverfassungsgerichtes vom 18. Juli 2012 zitieren; denn Sie haben offensichtlich nicht verstanden, was das höchste Gericht dieses Landes damit sagen wollte. Die in Artikel 1 Grundgesetz garantierte Menschenwürde ist migrationspolitisch nicht zu relativieren.\n\n({0})\n\nDas bedeutet auch, dass eine weitere Kürzung für Leistungsempfängerinnen und -empfänger nicht hinnehmbar ist. Dennoch steht es so in Ihrem Gesetzentwurf.\n\n({1})\n\nSie schlagen unter anderem eine 10-prozentige Leistungskürzung bei Bewohnern in Gemeinschaftsunterkünften vor, nur weil Menschen da zusammenwohnen. Diese Zwangsverpartnerung von Menschen, die sich nicht einmal kennen, ist schlichtweg untragbar. Oder finden Sie es gut, mit Ihrem Nachbarn Ihr Duschgel zu teilen?\n\n({2})\n\nSie sollten sich schämen, dass Sie denjenigen, die sowieso wenig bis gar keine Ressourcen haben und hierherkommen, um endlich in Würde und Schutz zu leben, auch noch das letzte Hemd wegnehmen.\n\nAuch die SPD-Abgeordnete Daniela Kolbe sprach in der ersten Lesung dieses Gesetzes davon, dass die Begründung an den Haaren herbeigezogen sei. Das sei aber einem politischen Kompromiss geschuldet – einem Kompromiss auf Kosten von Grund- und Menschenrechten. Dazu sagen wir Nein, liebe SPD.\n\n({3})\n\nDas sagen wir auch zu dem gesamten migrationspolitischen Paket, das Sie hier durchpeitschen wollen. Was wir diese Woche erlebt haben, entbehrt aller Grundsätze einer parlamentarischen Demokratie. Wo bleiben eigentlich die Turbopakete der Großen Koalition zur Wohnungs-, Renten- und Umweltpolitik? Wo bleibt da das schnelle Durchpeitschen? Da brauchen wir schnelle und gute Lösungen.\n\n({4})\n\nLiebe Kolleginnen und Kollegen, wir fordern die Abschaffung des Asylbewerberleistungsgesetzes. Für Schutzsuchende sollten die gleichen Regelungen gelten wie für alle anderen Menschen in unserer Gesellschaft. Wir wollen deshalb eine Überführung in das allgemeine System der sozialen Sicherung nach den Sozialgesetzbüchern.\n\n({5})\n\nHerr Heinrich von der CDU hat in der ersten Lesung dieses Gesetzentwurfs sogar eingeräumt, dass es der CDU hier darum geht, nicht noch mehr Anreize zu schaffen. Das ist einfach perfide.\n\n({6})\n\nHier hat sich das Bundesverfassungsgericht ganz klar positioniert. Ich zitiere – vielleicht hören Sie ja auch zu –:\n\nMigrationspolitische Erwägungen, die Leistungen an Asylbewerber und Flüchtlinge niedrig zu halten, um Anreize für Wanderungsbewegungen durch ein im internationalen Vergleich eventuell hohes Leistungsniveau zu vermeiden, können von vornherein kein Absenken des Leistungsstandards unter das physische und soziokulturelle Existenzminimum rechtfertigen.\n\nAber genau das passiert mit diesem Gesetz. Damit widersprechen Sie ganz klar dem Bundesverfassungsgericht.\n\n({7})\n\nIn Bezug auf Anreize möchte ich hier wiederholen, was Experten in der Anhörung am Montag dieser Woche gesagt haben: Es gibt keine Empirie dazu, dass Menschen aufgrund der gesetzlichen Rahmenbedingungen in Deutschland nach Deutschland kommen. – Ihre Begründung mit den Pull-Faktoren können Sie sich sparen; das ist einfach untragbar. Die Linke trägt diesen Verfassungsbruch der GroKo nicht mit.\n\nVielen Dank.\n\n({8})"
"1027015","Gökay","Akbulut","DIE LINKE.","Member of Parliament","2019-06-27T00:00:00.000Z","https://dip21.bundestag.de/dip21/btp/19/19107.pdf","\n\nVielen Dank, dass Sie die Frage zulassen. – Wir haben in der letzten Sitzungswoche gesehen, wie hier sehr kurzfristig Gesetzespakete verabschiedet werden, ohne dass wir uns damit rechtlich und inhaltlich auseinandersetzen können. Das ist unsere Kritik an diesem Verfahren.\n\nIch möchte des Weiteren wissen – viele verschiedene Sachverständige haben das Ganze begleitet –, was Sie unter „Einordnung in deutsche Lebensverhältnisse“ konkret verstehen. Das wollen Sie festschreiben. Wir haben keine homogene Kultur und Gesellschaft. Es gibt Regenbogen- und Patchworkfamilien in ganz unterschiedlichen Konstellationen. Wie sollen die Behörden dies nachprüfen können? Wie soll die Umsetzung klappen?\n\nIn Bezug auf die Mitgliedschaft in einer terroristischen Organisation und den daraus resultierenden Staatsangehörigkeitsentzug möchte ich gerne wissen, wie das betreffende Verfahren ausgestaltet werden soll. Mit wem wollen Sie da zusammenarbeiten, um jemandem die Mitgliedschaft oder Taten in einer terroristischen Organisation nachzuweisen?"
"1029811","Gökay","Akbulut","DIE LINKE.","Member of Parliament","2019-10-18T00:00:00.000Z","https://dip21.bundestag.de/dip21/btp/19/19119.pdf","\n\nSehr geehrte Frau Präsidentin! Liebe Kolleginnen und Kollegen! Die AfD versucht mit diesem Gesetzentwurf zur Änderung des Aufenthaltsgesetzes, den rechtlichen Rahmen wieder einmal zu verschieben – und zwar ganz weit nach rechts außerhalb des rechtlichen Rahmens. Das ist aber mit uns nicht zu machen.\n\n({0})\n\nNach Ihrem Wunsch sollen Flüchtlinge für den Erhalt einer Niederlassungserlaubnis die gleichen Anforderungen erfüllen müssen wie alle anderen Drittstaatsangehörige.\n\n({1})\n\nDie Genfer Flüchtlingskonvention von 1951 ist das Ergebnis der Schreckensherrschaft zur Zeit des Zweiten Weltkriegs. Der völkerrechtlich verbindliche Vertrag regelt das Grundrecht auf Asyl. Sie sprechen in Ihrem Gesetzentwurf von einer nicht gerechtfertigten „Privilegierung von … Flüchtlingen“. Das ist schlichtweg falsch. Wenn Sie wirklich etwas gegen die wahren Privilegierten in unserer Gesellschaft unternehmen möchten, dann sollten Sie sich vielleicht für die Erbschaft- oder Vermögensteuer aussprechen.\n\n({2})\n\nNach Artikel 34 der Genfer Flüchtlingskonvention gilt der Grundsatz, die „Eingliederung und Einbürgerung der Flüchtlinge zu erleichtern“. Und natürlich gibt es gute Gründe dafür, dass Menschen, die als Geflüchtete hierherkommen, anders zu behandeln sind als beispielsweise Fachkräfte, die hier für ein Unternehmen arbeiten. Menschen, die flüchten, haben häufig nicht die Möglichkeiten, die solche Fachkräfte oder andere Gruppen haben; denn sie können die ökonomischen Anforderungen meistens nicht bereits nach wenigen Jahren erfüllen. Unter Berücksichtigung dieser Tatsachen hat man gerade Artikel 34 der Genfer Flüchtlingskonvention geschaffen. Das ist auch gut so.\n\nSchlimmer als dieser Gesetzentwurf der AfD, von der man ja nichts anderes erwarten kann, ist, dass auch die Große Koalition mit dem sogenannten Integrationsgesetz die Voraussetzung für die Aufenthaltsverfestigung bei anerkannten Flüchtlingen verschärft hat. Durch diese Verschärfungen sollen im Grunde genommen Flüchtlinge nicht wirklich ankommen, sie sollen „abschiebbar“ gehalten werden. Auch nach jahrelangem Aufenthalt und trotz Arbeit und guter Integration sollen sie nach wie vor mit einer Abschiebung rechnen müssen.\n\nDie Betroffenen stecken oftmals jahrelang in einem Teufelskreis. Sie haben keine sichere Aufenthaltsperspektive und deshalb kaum Chancen auf dem Arbeits- oder Ausbildungsmarkt. Ohne Sicherung des Lebensunterhaltes bekommen sie aber keinen gesicherten Aufenthaltsstatus. Dennoch haben laut den aktuellen Zahlen des Institutes für Arbeitsmarkt- und Berufsforschung knapp 40 Prozent der Geflüchteten inzwischen einen Arbeits- oder Ausbildungsplatz.\n\nAußerdem bereichern sie auch unsere Gesellschaft kulturell im Gegensatz zu der AfD.\n\n({3})\n\nSo ging der Deutsche Buchpreis diese Woche an Sascha Stanisic. Ein junger Mensch, der als Kriegsflüchtling aus Bosnien nach Deutschland kam, bereichert nun die deutsche Literatur, und das ist auch gut so.\n\n({4})\n\nDiese Beispiele sollten unsere Perspektive sein: die Menschen hier ankommen lassen, ihnen aufenthaltsrechtliche Sicherheiten geben, sie bei der Integration unterstützen und ihnen die gleichen Rechte einräumen. Menschen fliehen vor Krieg und Verfolgung, verlieren ihre Wohnung, Perspektive, Freunde und Familienmitglieder. Der einzige Weg aus diesem Elend ist nun mal die Flucht – so wie aktuell aus Syrien, Jemen und vielen anderen Kriegs- und Krisenherden, die Sie ja nicht sehen wollen oder können.\n\nMan möchte niemandem wünschen, in der Haut der Menschen zu stecken, die diesen Schritt wagen müssen. Mit diesem Gesetzentwurf machen Sie deutlich, dass Sie sich von dem Grundsatz, dass Geflüchteten Schutz und eine Perspektive geboten werden muss, distanzieren. Dabei stellt unter anderem die Genfer Flüchtlingskommission das Gegenstück zum Naziregime dar. Sie ist ein Mahnmal für uns und für unsere Gesellschaft. Wir müssen diesen wichtigen Grundsatz verteidigen. Dafür steht Die Linke.\n\nVielen Dank.\n\n({5})"
"1031957","Gökay","Akbulut","DIE LINKE.","Member of Parliament","2019-11-14T00:00:00.000Z","https://dip21.bundestag.de/dip21/btp/19/19127.pdf","\n\nSehr geehrter Herr Präsident! Liebe Kolleginnen und Kollegen! Heute liegt uns erneut das Gesetz zur Umsetzung der zweiten Aktionärsrechterichtlinie vor. Wie wir in der ersten Lesung schon dargestellt haben, geht es unter anderem um mehr Transparenzpflichten und die Frage der Vergütung der Vorstände. Die Koalition schreibt in ihrem Entwurf selbst: Zur Vergütung der Mitglieder der Unternehmensleitung sollen Rahmenregelungen für Vergütungssysteme geschaffen werden.\n\nDass dieses Ziel von der Koalition nicht ernst genommen wurde, zeigte sich unter anderem bei der Anhörung der Sachverständigen im Juni dieses Jahres im Bundestag. Der Leipziger Professor Dr. Tim Drygala bewertete die Umsetzung der Richtlinie als „mutlos“, und sie sei, was die Kompetenzen der Hauptversammlung angehe, „übermäßig restriktiv“. Eine Stärkung der Aktionärsrechte werde mit dem Entwurf sogar möglichst vermieden. – Und was macht die Koalition? Sie hat sich geeinigt. Und Sie von der SPD feiern sich, dass Sie eine Maximalvergütung der Vorstandsmitglieder durchgesetzt haben.\n\n({0})\n\nIch zitiere Sie jetzt, Frau Högl: Der mitbestimmende Aufsichtsrat soll Vorstandsvergütungen der Höhe nach begrenzen.\n\n({1})\n\nIch sage Ihnen ganz ehrlich: Sie glauben doch wohl nicht, dass der Aufsichtsrat seine Vorstandsmitglieder bei ihrer Vergütung ernsthaft begrenzen wird?\n\n({2})\n\nUnserer Auffassung nach sollte es nämlich eine verbindliche Beschränkung für Managergehälter geben.\n\n({3})\n\nDie Gesamtbezüge eines Vorstandsmitglieds sollten nicht mehr als das 20-Fache der Bezüge eines einfachen Mitarbeiters betragen dürfen. Dem wird man auch nicht gerecht, wenn man, wie die Koalition jetzt beschlossen hat, der Hauptversammlung ein Recht einräumt, die Vergütung weiter abzusenken. Denn wir wissen doch, dass dies nur Pseudobefugnisse und ‑lösungen sind, die nicht dazu führen werden, dass sich der Vergütungsabstand und die sogenannte Manager to Worker Pay Ratio signifikant zugunsten der abhängig Beschäftigten entwickeln wird. Vorstände von DAX-Konzernen verdienen heute etwa das 71-Fache, im Extremfall sogar das 160-Fache des Durchschnittsverdienstes ihrer Angestellten. Ein solches Verhältnis von Leistung, Haftung und Vergütung ist hier nicht mehr zu rechtfertigen.\n\n({4})\n\nAn dieser Problematik wird sich auch mit diesem Vorschlag der Koalition nichts ändern.\n\n({5})\n\nMan hätte hier die Möglichkeit gehabt, die Hauptversammlung mit echten und wirkungsvollen Rechten zur Regulierung auszustatten. Entsprechend des öffentlichen und gesellschaftlichen Drucks wäre die Einführung des Vergütungsabstands als ein Korrektiv zu einer gleichgerichteten Entgelterhöhung auch möglich gewesen. Die Koalition hätte hier einen Beitrag dazu leisten können, dass die Schere zwischen Arm und Reich in unserer Gesellschaft nicht noch größer wird. Das hat sie aber mit diesem Gesetzentwurf nicht geschafft. Wieder einmal machen Sie Politik im Interesse der Manager. Deshalb lehnen wir Ihren Gesetzentwurf ab.\n\nVielen Dank.\n\n({6})"
"1033693","Gökay","Akbulut","DIE LINKE.","Member of Parliament","2019-12-12T00:00:00.000Z","https://dip21.bundestag.de/dip21/btp/19/19134.pdf","\n\nSehr geehrte Frau Präsidentin! Liebe Kolleginnen und Kollegen! Das Bundesverfassungsgericht hat mit seiner Entscheidung vom 26. März 2019 den Gesetzgeber dazu verpflichtet, die Ungleichbehandlung im Bereich der Stiefkindadoption durch verfassungskonforme Regelungen zu beheben. Der von der Bundesregierung vorgeschlagene Gesetzentwurf, insbesondere die Einfügung von § 1766a BGB, trägt zwar dazu bei, dennoch handelt es sich hierbei nur um eine Minimallösung. Es müsste mindestens noch der § 1741 Absatz 2 BGB zur Klarstellung geändert werden, so wie es auch die FDP in ihrem kurzfristig vorgelegten Antrag fordert, was auch wir ausdrücklich unterstützen.\n\n({0})\n\nAls Linke sehen wir bei dem Gesetzentwurf der Bundesregierung ein zentrales Problem: Insgesamt ist das Adoptionsrecht immer noch ehezentriert, und das muss sich grundlegend ändern.\n\n({1})\n\nEine Annahme von Kindern ist nach diesem Gesetzentwurf nur für zwei Personen möglich, die in einer verfestigten Lebensgemeinschaft in einem gemeinsamen Haushalt leben. Dort steht ausdrücklich, dass eine verfestigte Lebensgemeinschaft vorliegt, wenn die Personen seit mindestens vier Jahren oder als Eltern eines gemeinsamen Kindes mit diesem in einem eheähnlichen Verhältnis zusammenleben. Die Bezugnahme auf die Eheähnlichkeit als entscheidendes Zugangskriterium für die Stiefkindadoption ist aber mit der Lebensrealität in Deutschland heutzutage nicht mehr vereinbar.\n\nDiese grundlegende Kritik stammt nicht nur von uns, sondern findet sich auch in zahlreichen Stellungnahmen der Fachverbände wie des Paritätischen Gesamtverbandes, aber auch des Deutschen Juristinnenbundes zum Referentenentwurf. Maßstab der Zugangsbedingung für die Ermöglichung einer Stiefkindadoption sollte nicht die Eheähnlichkeit als formales Konstrukt sein. Das Formale entscheidet nämlich nicht darüber, ob das Kind unter tatsächlich guten Bedingungen aufwächst oder nicht.\n\nEntscheidend für die Kindeswohlperspektive ist, dass es eine Verantwortungsgemeinschaft für das Kind gibt, in der es geliebt und gefördert wird, unabhängig davon, ob eine Ehe oder Eheähnlichkeit besteht oder nicht. Und wer bestimmt denn darüber, wie eheähnlich eine Partnerschaft ist?\n\n({2})\n\nEs gibt viele Personen, die in ganz unterschiedlichen Konstellationen leben, diese Verantwortung übernehmen wollen und dies auch können, wie wir vielfach sehen, gerade in unserer vielfältigen, modernen Lebens- und Arbeitswelt. Dem sollten traditionelle Familienkonstruktionen und ‑vorstellungen, die weiterhin auf rechtlicher Ebene verankert sind, nicht im Wege stehen. Entscheidend ist, dass das Kind rechtlich abgesichert ist und dass unabhängig von der jeweiligen Partnerschaftsform für das Kind gesorgt wird; denn für uns als Linke steht nach wie vor das Kindeswohl im Mittelpunkt.\n\nDer Gesetzentwurf ist ein Schritt in die richtige Richtung. Dennoch bezieht er nicht die wichtigen Erwägungen ein, die wir aus der Anhörung und den zahlreichen Stellungnahmen der Fachverbände mitgenommen haben. Der Gesetzentwurf geht im Grunde genommen am Ziel, das Kindeswohl zu schützen, vorbei; denn das Kindeswohl wird nicht durch Konstruktionen wie eheähnliche Partnerschaften geschützt, sondern durch Personen, die die Verantwortung für die Erziehung des Kindes übernehmen.\n\nVielen Dank.\n\n({3})"
"1034810","Gökay","Akbulut","DIE LINKE.","Member of Parliament","2019-12-20T00:00:00.000Z","https://dip21.bundestag.de/dip21/btp/19/19138.pdf","\n\nSehr geehrte Frau Präsidentin! Liebe Kolleginnen und Kollegen! Wir alle haben gehofft, dass die AfD uns diese Woche nicht ihren völkischen Nationalismus und Rassismus auf die Tagesordnung setzt,\n\n({0})\n\naber dann haben Sie doch eine Aktuelle Stunde zum Globalen Flüchtlingsforum in Genf beantragt. Ihnen fällt einfach nichts Neues mehr ein, um im Grunde genommen Ihre Hetze und Ihre Verschwörungstheorien unterzubringen.\n\nIhre Methoden sind uns ja bekannt. Denn schon Ende letzten Jahres haben Sie in Ihrer Aktuellen Stunde zum Globalen Flüchtlingspakt Ihre Kampagne mit Falschinformationen, Lügen und persönlichen Denunziationen verbreitet. Damals haben Sie über Drohszenarien Ihre Verschwörungstheorien propagiert. Herr Friesen von der AfD sprach von einem gigantischen Umverteilungsprogramm, mit dem weitere Flüchtlinge nach Deutschland und Europa umgesiedelt werden sollen.\n\n({1})\n\nUnd was passierte? Nichts von dem, was Sie an Hetze und Fake News verbreitet haben.\n\n({2})\n\nIch muss Ihnen sogar sagen: Das Gegenteil ist der Fall. Es kommen nicht mehr Schutzsuchende nach Deutschland, sondern sogar sehr viel weniger – weniger als die Bundesregierung in ihrem eigens angelegten sogenannten Korridor für Zuwanderung festgelegt hat.\n\nDeutschland hat dementsprechend sogar noch Aufnahmekapazitäten. Dabei wäre es gut und wichtig, dass Deutschland Verantwortung übernimmt, so wie wir als Linksfraktion das mit unserem Antrag zur Aufnahme unbegleiteter minderjähriger Schutzsuchender aus den Hotspots in Griechenland fordern.\n\n({3})\n\nKapazitäten für eine Aufnahme gäbe es, und wie wir in den letzten Tagen und Wochen gesehen haben, wird die Situation vor Ort in Griechenland immer schlechter. Laut Berichten von Ärzte ohne Grenzen verletzen junge Menschen sich selber oder versuchen sogar, sich umzubringen. Diese Zustände sowohl in den Hotspots als auch an den Grenzen der Europäischen Union sind schlichtweg eine Schande für die EU.\n\n({4})\n\nHotspots, die wie Gefängnisse aufgebaut sind, wo Menschen keine medizinische Versorgung erhalten und teilweise sogar in Schichten schlafen müssen, dürfen nicht Standard europäischer Flüchtlingspolitik sein. Wir haben jetzt Winter, und es gibt keine festen Unterkünfte vor Ort. Dabei besteht die reale Gefahr, dass Menschen sterben werden, so wie schon in den letzten Jahren. Gerade diejenigen, die am meisten unter diesen desaströsen Bedingungen leiden, also die unbegleiteten minderjährigen Schutzsuchenden, sollten hier aufgenommen werden.\n\n({5})\n\nSehr geehrte Damen und Herren, das Globale Flüchtlingsforum dient dem Ziel, Flüchtlingsschutz international besser zu gestalten. Das begrüßen wir als Linke natürlich.\n\n({6})\n\nEs ist aber auch ein Schritt in die richtige Richtung, wenn Außenminister Heiko Maas in Genf auf dem Globalen Flüchtlingsforum mitteilt, dass Staaten sich solidarisch zeigen sollen und dass es insgesamt mehr Solidarität im Umgang mit Flüchtlingen geben soll. Derzeit ist allerdings das Gegenteil der Fall, egal wo wir hinschauen. Immer mehr Staaten verweigern eine humanitäre Aufnahme und handeln häufig sogar völkerrechtswidrig, wenn Menschen ihre Grenzen überqueren. Da brauchen wir nicht weit zu schauen. Das kann man sogar innerhalb der EU beobachten.\n\nBlicken wir auf die Situation auf dem Balkan. Kroatien beispielsweise hat massive Völkerrechtsbrüche begangen, indem es Schutzsuchende gewaltvoll und unrechtmäßig im Rahmen illegaler Push-backs nach Bosnien-Herzegowina zurückgewiesen hat.\n\n({7})\n\nUnd die kroatische Präsidentin gibt das in einem Interview sogar öffentlich zu. Das müssen Sie sich mal vorstellen: Das Land, das jetzt die EU-Ratspräsidentschaft übernimmt, begeht an den EU-Außengrenzen offen massive Menschenrechtsverletzungen, und Deutschland und alle anderen EU-Staaten schweigen einfach dazu.\n\nWenn es um Flüchtlingspolitik geht, macht sich die EU auch weiterhin von Staaten wie der Türkei erpressbar. Das darf einfach nicht sein. Wir als Linke haben den EU-Türkei-Deal von vornherein kritisiert; denn er ist nichts anderes als ein Instrument, um Abschottungspolitik zu betreiben.\n\n({8})\n\nDeutschland und die EU dürfen in der Flüchtlingsfrage nicht weiter mit autoritären Regimen, wie dem der Türkei, das selbst völkerrechtswidrige Kriege führt und Menschen zur Flucht zwingt, zusammenarbeiten.\n\n({9})\n\nAber nicht nur durch die Türkei, sondern auch durch Griechenland gibt es Rechtsbrüche. Im Rahmen dieses Deals sollen inzwischen von Griechenland über 60 000 Menschen illegal in die Türkei zurückgewiesen worden sein. Das, was wir brauchen, sind wirksame Mittel, um diese Rechtsbrüche von Staaten zu verhindern.\n\n({10})\n\nDeshalb brauchen wir eine Stärkung der individuellen Rechte von Schutzsuchenden auf europäischer Ebene, aber auch auf internationaler Ebene. Der Global Compact on Refugees und das Engagement im Rahmen des Globalen Flüchtlingsforums sind dabei wichtige Bausteine, und wir hoffen natürlich, dass sich die Situation für die betroffenen Menschen in den nächsten Jahren verbessern wird.\n\nVielen Dank für Ihre Aufmerksamkeit und eine schöne Weihnachtszeit.\n\n({11})"
