id,firstname,lastname,faction,position,date, url,speech
"1044094","Gökay","Akbulut","DIE LINKE.","Member of Parliament","2020-07-03T00:00:00.000Z","https://dip21.bundestag.de/dip21/btp/19/19171.pdf","\n\nSehr geehrter Herr Präsident! Liebe Kolleginnen und Kollegen! In der letzten Debatte vor der Sommerpause möchte die AfD wieder einmal ihre rassistische Hetze auf die Tagesordnung setzen.\n\n({0})\n\nThema dieses Mal sind die Ereignisse in Stuttgart in der Nacht vom 21. Juni. Aber wir alle wissen ja ganz genau, dass es der AfD wieder um rassistische Hetze und vor allem auch um Fake News geht. Wenn Sie hier von nie dagewesener Gewalt in Stuttgart sprechen, dann möchte ich Sie auch an den Schwarzen Donnerstag 2010 in Stuttgart erinnern. Schauen Sie sich auch mal die Bilder von damals an!\n\n({1})\n\nIhnen fällt eigentlich auch nichts Neues ein. Man könnte Sie auch einfach umbenennen in „Rassistische Alternative für Deutschland“; denn mehr haben Sie nicht zu bieten. Sie instrumentalisieren erneut Ereignisse und machen hier ganze Menschengruppen zum Sündenbock Ihrer Politik, die mit Gewalt nichts zu tun haben. Schauen Sie sich auch noch mal die Pressekonferenz der Stuttgarter Polizei an, die da ganz differenziert berichtet.\n\n({2})\n\nVor allem: Hätten Sie in der Sitzung des Innenausschusses diese Woche mal besser zugehört, dann wüssten Sie auch, dass von den 37 Beschuldigten über die Hälfte Deutsche sind.\n\n({3})\n\n– Original-, Ur- oder Biodeutsche, wie auch immer Sie es bezeichnen möchten: Es waren gemischte Jugendgruppen.\n\n({4})\n\nAuch die Polizei spricht von einer heterogenen Gruppe. Wenn Sie nicht mal der Polizei glauben, dann ist das Ihr Problem.\n\n({5})\n\nAngesichts eines Migrationsanteils von 45 Prozent in der Stuttgarter Bevölkerung ist diese Zusammensetzung auch normal. Für Sie ist es auch egal, dass die Kontrolle eines deutschen Jugendlichen Ausgangspunkt für die Ereignisse am 21. Juni war. Hauptsache, Sie können wieder über migrantische Jugendliche herziehen!\n\nWir verurteilen natürlich jede Form von Gewalt sowie die Zerstörung von Geschäften oder auch Plünderungen\n\n({6})\n\nund fordern eine umfassende Aufklärung der Ereignisse in dieser Nacht.\n\n({7})\n\nEs haben sicherlich eine Reihe von vielen verschiedenen Faktoren dazu geführt, dass es zu dieser Entwicklung gekommen ist; aber all das muss noch aufgearbeitet werden. Für uns ist natürlich wichtig, dass diese Situation sich nicht wiederholt. Aber härteres Durchgreifen, mehr Polizeipräsenz, Ausweitung der Polizeibefugnisse, mehr Videoüberwachung etc. werden wenig zur Lösung der Probleme der Jugend beitragen. Wichtig ist, sich die Ursachen genauer anzuschauen, vor allem aber auch, präventive Maßnahmen zu ergreifen, wie zum Beispiel Streetworker-Programme, die aber 2012/2013 aus dem Stuttgarter Haushalt gestrichen worden sind.\n\n({8})\n\nViele Sozialarbeiter und Multiplikatoren in der Jugendarbeit lehnen die Rufe nach mehr „Law and Order“ und nach mehr Härte gegenüber Jugendlichen ab. Die Lokal- und Fachpolitik scheint viel sachlicher mit der Thematik umzugehen als die weit entfernte Bundespolitik heute hier.\n\n({9})\n\nIn Stuttgart ist viel von Partizipation, Aufklärung, Dialog und Integration die Rede. Das ist ein Schritt in die richtige Richtung.\n\nDie AfD ist aber weit davon entfernt, ein Interesse daran zu haben, dass sich die Situation vor Ort für alle verbessert. Viele Jugendliche mit einem sogenannten Migrationshintergrund werden weiterhin tagtäglich Opfer von Rassismus und Diskriminierung. Dazu gehören auch Polizeipraktiken wie Racial Profiling. Hierzu gibt es zahlreiche Studien, unter anderem auch Studien des Deutschen Instituts für Menschenrechte. Rassismus ist in den Behörden, auch innerhalb der Polizeistrukturen, leider kein vereinzeltes Problem, sondern ein strukturelles Problem, das wir ansprechen und angehen müssen.\n\n({10})\n\nDeshalb fordern wir mehr Studien, mehr Analysen, mehr Aufarbeitung und vor allem auch unabhängige Beschwerdestellen.\n\nDie AfD betreibt mit ihrem rassistischen Diskurs weiterhin ein gefährliches Spiel zur Spaltung unserer Gesellschaft. Dabei ist sie selbst die größte Gefahr und vor allem das größte Sicherheitsrisiko in unserer Gesellschaft.\n\n({11})\n\nEs vergeht keine Woche, in der wir nicht davon hören, dass wieder ein Neonazi entdeckt wurde, der für die AfD arbeitet.\n\n({12})\n\nDer Bundestagsabgeordnete René Springer hat einen Neonazi eingestellt, der einer rechtsextremen Prepper-Gruppe angehört, die sich auf einen „Rassenkrieg“ vorbereitet und sich dafür auch bewaffnet hat.\n\n({13})\n\nSie sind der politische Arm solcher rechtsextremen Terrorgruppen.\n\nDie größte Gefahr in unserer Gesellschaft geht weiterhin vom Rechtsextremismus aus; das weiß auch der Bundesinnenminister. Denken wir an Hanau.\n\n({14})\n\nDenken wir an Gökhan Gültekin, an Sedat Gürbüz, an Said Nesar Hashemi, an Mercedes Kierpacz, an Hamza Kenan Kurtovic, Vili-Viorel Paun, Fatih Saracoglu, Ferhat Unvar und Kaloyan Velkov. Sie alle sind Opfer dieses rassistischen Terroranschlags. Ihre Namen dürfen wir nicht vergessen; denn das alles ist auch Ergebnis Ihrer Hetze gewesen.\n\n({15})\n\nDie AfD trägt rassistische und antisemitische Weltbilder –"
"1044096","Gökay","Akbulut","DIE LINKE.","Member of Parliament","2020-07-03T00:00:00.000Z","https://dip21.bundestag.de/dip21/btp/19/19171.pdf","\n\n– in unsere Gesellschaft hinein.\n\nVielen Dank für Ihre Aufmerksamkeit.\n\n({0})"
"1045717","Gökay","Akbulut","DIE LINKE.","Member of Parliament","2020-09-17T00:00:00.000Z","https://dip21.bundestag.de/dip21/btp/19/19176.pdf","\n\nSehr geehrter Herr Präsident! Liebe Kolleginnen und Kollegen! Wir stimmen heute über die Verlängerung des COVID‑19-Insolvenzaussetzungsgesetzes bis zum 31. Dezember 2020 ab. Im März dieses Jahres, zu Beginn der Coronakrise, haben wir dem Gesetzentwurf zugestimmt. Nun soll dieses Gesetz bis zum Ende des Jahres verlängert werden.\n\n({0})\n\nWir stimmen dieser Verlängerung zu, sagen aber auch ganz deutlich: Damit alleine ist es nicht getan.\n\nSechs Monate nach Beginn der Coronakrise haben einige Lebens- und Arbeitsbereiche zu einer neuen Normalität gefunden; die Pandemie ist jedoch noch nicht überstanden. Mit den wieder steigenden Infektionszahlen können wir nur bedingt von einer verbesserten Ausgangslage sprechen. Deshalb gilt es umso mehr, kleine und mittelständische Unternehmen in der Krise zu unterstützen.\n\n({1})\n\nDoch das Krisenmanagement der Bundesregierung ist an dieser Stelle nicht vorausschauend. Mit der Verlängerung des Gesetzes wird die drohende Insolvenzwelle nur verschoben. Ab Beginn des kommenden Jahres werden wir einen schlagartigen Anstieg von Insolvenzanmeldungen sehen. Und was passiert dann? Dann werden nicht nur die Insolvenzgerichte überlastet sein, sondern dann wird auch die Bilanz von bis dahin gesunden Unternehmen in Mitleidenschaft gezogen.\n\nEine Insolvenzflut droht letztendlich auch die Stabilität des Bankensektors zu gefährden. So einen Dominoeffekt müssen wir unbedingt vermeiden. Dabei sollte doch das oberste Ziel sein, dass es gar nicht erst zu Insolvenzen von eigentlich lebensfähigen Unternehmen kommt und vor allem nicht noch mehr Arbeitsplätze verloren gehen.\n\n({2})\n\nDie Unsicherheiten in der Veranstaltungsbranche, in der Gastronomie und in vielen anderen Branchen sind noch groß. Es reicht nicht aus, darauf zu hoffen, dass sich die Unternehmen bis Ende des Jahres von selbst erholen oder sanieren. Stattdessen müssen erprobte Hilfsprogramme verlängert und gegebenenfalls ausgeweitet werden.\n\n({3})\n\nEin konkreter Weg, um Zahlungsausfälle zu vermeiden, wäre, Firmen bei der Rückzahlung von Krediten durch Streckung zu entlasten. Darüber hinaus brauchen wir eine grundsätzliche Debatte darüber, welchen Beitrag der Staat zu einer Belebung der Wirtschaft leisten kann. Der beste Schutz vor Insolvenzwellen ist ein Staat, der investiert und die Menschen in den Mittelpunkt stellt. Höhere Löhne, insbesondere für systemrelevante Berufe, ein Pandemiezuschlag auf niedrige Renten und Hartz-IV-Sätze: Das ist es, was viele Menschen im Moment brauchen. All das wären auch Maßnahmen, die die Kaufkraft und die Konjunktur stärken.\n\n({4})\n\nDas käme auch den von Insolvenzen bedrohten Unternehmen zugute.\n\nWir haben an vielen Stellen gesehen, dass die Coronapandemie die Krisen in genau den Bereichen verstärkt hat, die die Bundesregierung über Jahre hinweg vernachlässigt hat. Statt einem Weiter-so sollte die Bundesregierung in der Krise mehr Verantwortung übernehmen. Eine Verlängerung der Aussetzung der Insolvenzanzeigepflicht muss mit staatlichen Coronahilfen einhergehen, die an konkrete Bedingungen für die Unternehmen geknüpft sind und sozial und ökologisch verträgliches Wirtschaften fördern.\n\nVielen Dank.\n\n({5})"
"1045776","Gökay","Akbulut","DIE LINKE.","Member of Parliament","2020-09-18T00:00:00.000Z","https://dip21.bundestag.de/dip21/btp/19/19177.pdf","\n\nSehr geehrter Herr Präsident! Liebe Kolleginnen und Kollegen! Wir debattieren heute über den Entwurf eines Gesetzes zur Änderung des Kapitalanleger-Musterverfahrensgesetzes der Koalition sowie über Anträge der FDP und der Grünen zu diesem Gesetz.\n\nWorum es hier geht, wird in dem Titel nicht ganz deutlich. Das Gesetz soll geschädigten Anlegern die Durchsetzung von Schadensersatzansprüchen erleichtern, indem es Musterverfahren wegen falscher, irreführender oder unterlassener öffentlicher Kapitalmarktinformationen, etwa in Jahresbroschüren oder Börsenprospekten, ermöglicht. In dem vorliegenden Gesetzentwurf geht es um die Verlängerung des Gesetzes, das bis zum 31. Oktober 2020 befristet ist. Die Bundesregierung möchte jetzt lediglich die Befristung verlängern bis 31. Dezember 2023. Mehr hat sie hier nicht eingebracht. Dabei gibt es seit Jahren viele inhaltliche Ansatzpunkte für eine Novellierung des Kapitalanleger-Musterverfahrensgesetzes. Da waren sich auch die Sachverständigen in der Anhörung einig.\n\nNatürlich muss das Gesetz verlängert werden; da stimmen wir sowohl dem Gesetzentwurf der Koalitionsfraktionen als auch den Anträgen der Grünen und der FDP zu, nicht zuletzt, damit die Verfahren gegen Volkswagen, Porsche usw. weiterlaufen können.\n\n({0})\n\nAber das Gesetz sollte dauerhaft implementiert werden und nicht von einer zeitlichen Befristung zur nächsten entschieden werden. Es geht darum, auch für die Zukunft und dauerhaft Rechtssicherheit für Verbraucherinnen und Verbraucher zu schaffen. Andere Länder sind hier viel weiter.\n\nDas Kapitalanleger-Musterverfahrensgesetz und seine Anwendung sollten evaluiert werden und die Verfahren noch effizienter gestaltet werden. Ein wichtiger Aspekt, der hier auch angesprochen worden ist, ist die Beschleunigung der Verfahren. Es kann nicht sein, dass die Verfahren teilweise so lange dauern, dass sie nicht mehr im Einklang mit den nach Artikel 6 Absatz 1 der Europäischen Menschenrechtskonvention einzuhaltenden Grenzen für ein faires Verfahren beendet werden können.\n\n({1})\n\nWenn die Verfahren so lange dauern, bis eine gute Evaluation im Rahmen der Geltungsdauer des Gesetzes nicht möglich ist, weil die Befristung des Gesetzes schon abgelaufen ist, dann läuft hier etwas schief. Dabei liegen Vorschläge für eine Beschleunigung auf dem Tisch, die hier auch schon angesprochen worden sind. Unter anderem könnten die Verfahren beispielsweise komplett digital geführt werden und vor allem der Zugang zu den digitalen Akten für alle Parteien gewährleistet werden.\n\n({2})\n\nFür uns ist wichtig, dass keine weiteren Insellösungen mehr geschaffen werden, sondern endlich ein ganzheitliches Konzept entwickelt wird. Außerdem muss auch geklärt werden, in welchem Verhältnis das Musterverfahren im Kapitalanleger-Musterverfahrensgesetz und die Musterfeststellungklage gemäß § 606 ff. ZPO zueinander stehen.\n\nVielen Dank für Ihre Aufmerksamkeit.\n\n({3})"
"1047176","Gökay","Akbulut","DIE LINKE.","Member of Parliament","2020-10-08T00:00:00.000Z","https://dip21.bundestag.de/dip21/btp/19/19183.pdf","\n\nSehr geehrter Herr Präsident! Liebe Kolleginnen und Kollegen! Die AfD sucht sich ihre Themen danach aus, wo sie denkt, sie kann daraus politisches Kapital in Form von Hetze schlagen, so wie es heute in dieser Debatte wieder geschieht.\n\nHeute wollen Sie das Fachkräfteeinwanderungsgesetz zurücknehmen. Hätten Sie Ihre Hausaufgaben gemacht, dann wüssten Sie: Die Neuregelungen zur Fachkräfteeinwanderung werden zu keiner Einwanderung in nennenswerter Größenordnung führen. Es ist ganz anders, als Sie es hier darstellen.\n\nDas Fachkräfteeinwanderungsgesetz der Bundesregierung in dieser Form ist viel zu restriktiv. Die Verfahren sind viel zu lang, und die Anerkennung der ausländischen Qualifikationen funktioniert in der Praxis nicht wirklich.\n\n({0})\n\nWas Sie hier wieder versuchen aufzubauen, ist und bleibt ein lächerlicher Mythos. Sie möchten den Menschen durch Hetze wieder Angst machen, um dann darauf eine Sündenbockpolitik aufzubauen. Und dann, wenn Sie glauben, dass keiner zuhört, zeigen Sie Ihr wahres Gesicht, wie zum Beispiel Ihr damaliger Pressesprecher Christian Lüth, der sagte, dass man eingereiste Menschen „erschießen“ oder „vergasen“ sollte. Das haben Nazis in diesem Land schon früher getan, und Sie unterscheiden sich in keinster Weise von deren Ideologie. Dem stehen wir als Linksfraktion entschieden entgegen.\n\n({1})\n\nSie schreiben in dem Antrag über die Entwicklung der Arbeitslosigkeit in Gesundheits- und Pflegeberufen. Mit Ihren Zahlen soll suggeriert werden, dass die Arbeitslosigkeit von Ausländerinnen und Ausländern in diesen Bereichen drastisch zunehme: um 70 bis 110 Prozent. Aber schaut man sich die absoluten Zahlen an, sieht man: Es geht um 1 000 bis 2 000 Menschen. – Absolut lächerlich! Sie wollen wieder einen Mythos bauen, der sich wie immer als Lüge entpuppt. Das Entscheidende ist doch vielmehr: Ohne ausländische Beschäftigte liefe im Bereich der Gesundheitsversorgung und Pflege heute gar nichts mehr.\n\nIhre Politik ist krank. Sie wollten als knallharte rechte Partei in der Zeit des Lockdowns die Grenzen schließen. Als das dann real passierte, wollten Sie doch Zuwanderung und haben sich dafür ausgesprochen, Ausnahmen für Erntehelferinnen und Erntehelfer zu machen. Also kurzum: Wenn es um Ihren deutschen Spargel auf dem Teller geht, können Menschen aus dem Ausland zum Arbeiten kommen. Bei Ihnen geht es um reine Verwertungslogik und nicht um die Menschen. Die Arbeits- und die Unterbringungsbedingungen dieser Menschen sind Ihnen völlig egal.\n\nWir als Linksfraktion kämpfen für bessere Ausbildung, für bessere Bezahlung und für bessere Arbeitsbedingungen für die Beschäftigten, und zwar für alle Beschäftigten, unabhängig von ihrer Herkunft.\n\nVielen Dank.\n\n({2})"
"1049534","Gökay","Akbulut","DIE LINKE.","Member of Parliament","2020-11-06T00:00:00.000Z","https://dip21.bundestag.de/dip21/btp/19/19190.pdf","\n\nSehr geehrte Frau Präsidentin! Sehr geehrte Damen und Herren! Die islamistischen Anschläge der vergangenen Tage in Europa und weltweit sind abscheulich. Unsere Gedanken sind bei den Opfern, den Verletzten und ihren Angehörigen.\n\nGewaltbereite Islamisten und Rechtsextreme wie die AfD in Deutschland haben vieles gemeinsam, beispielsweise gemeinsame Feindbilder, ein autoritäres Weltbild und ein ähnlich konservatives Frauenbild. Rechtsextremisten und Islamisten sind bemüht, sich gegenseitig hochzuschaukeln. Im Bundestag kann man eindeutig sehen, dass die Schaukel regelmäßig von der AfD angestoßen wird. Am anderen Ende dieser Schaukel steht unter anderem Erdogan, der mit seinen Aggressionen und Äußerungen Islamisten weltweit ermutigt und mobilisiert. Dieses gefährliche Pulverfass muss dringend entschärft werden.\n\n({0})\n\nDie Bundesregierung und die demokratischen Fraktionen haben in dieser Debatte vieles gesagt; auch meine Kollegin Amira Mohamed Ali. Der Umgang mit Islamisten wurde in dieser Woche insbesondere in der Aktuellen Stunde thematisiert. Aber wie kommt es, dass die Bundesregierung so wenig Ahnung hat, beispielsweise über eine nachweislich besonders gewaltbereite islamistische Tätergruppe, die sich seit über 20 Jahren in Deutschland aufhält? Wir haben eine Kleine Anfrage zu den in Deutschland lebenden islamistischen Tätern des Sivas-Massakers in der Türkei gestellt. Diese Täter wurden in der Türkei verurteilt, weil sie 1993 bei einem islamistischen Anschlag 33 Menschen wegen ihres alevitischen Glaubens getötet haben. Etwa zwei Dutzend dieser Täter sind damals vor ihrer Verurteilung geflüchtet, teilweise sogar direkt aus dem Gefängnis. Neun dieser Islamisten sollen sich aktuell in Deutschland aufhalten. Wie kann es sein, dass es keine Ermittlungsverfahren in Deutschland gegen diese islamistischen Mörder gibt? Es gibt sogar Hinweise, wonach einige dieser Täter in Moscheen der Milli Görüs aktiv seien. Wieso konfrontiert die Bundesregierung diesen Verband nicht damit?\n\n({1})\n\nMeine sehr geehrten Damen und Herren, rechtspopulistische Parteien und auch viele konservative Politiker vermischen in dieser Debatte häufig Islam und Islamismus. Sie vermischen absichtlich friedliche Muslime mit gewaltbereiten Islamisten. Dies schadet dem friedlichen Zusammenleben in unserer Gesellschaft."
"1049536","Gökay","Akbulut","DIE LINKE.","Member of Parliament","2020-11-06T00:00:00.000Z","https://dip21.bundestag.de/dip21/btp/19/19190.pdf","\n\nNein. – Nach islamistischen Angriffen werden leider auch friedliche Muslime stigmatisiert. Außerdem wird häufig nicht bedacht, dass auch Muslime Opfer von islamistischen Anschlägen sind. Ich möchte auch darauf hinweisen, dass in den letzten Jahren im Kampf gegen islamistische Organisationen die Kurdinnen und Kurden in Nordsyrien, auch Mitglieder meiner Familie, große Opfer gebracht haben.\n\nAls Linksfraktion stehen wir für eine friedliche Gesellschaft ohne Rassismus, Hass und Hetze. Wir stehen für die universellen Menschenrechte, für eine echte Gleichberechtigung von Frau, Mann und Divers sowie für Religions-, Meinungs-, Kunst- und Kulturfreiheit.\n\nVielen Dank.\n\n({0})"
"1051263","Gökay","Akbulut","DIE LINKE.","Member of Parliament","2020-11-27T00:00:00.000Z","https://dip21.bundestag.de/dip21/btp/19/19196.pdf","\n\nSehr geehrter Herr Präsident! Liebe Kolleginnen und Kollegen! Wir diskutieren heute über zwei wichtige Gesetzentwürfe zur Änderung des Grundgesetzes. In unserem Gesetzentwurf geht es darum, den Begriff „Rasse“ nicht nur zu streichen, sondern zu ersetzen. Der Begriff „Rasse“ sollte ersetzt werden durch ein Verbot von rassistischer Diskriminierung, sodass keine Schutzlücke entsteht; denn es gibt Rassismus, aber keine Rassen.\n\nZu Zeiten des Nationalsozialismus war der Diskurs um den Begriff „Rasse“ ganz anders als heute. Dieses Weltbild haben die Väter und Mütter des Grundgesetzes nicht einfach abgelegt. So spiegelt es sich auch heute in unserer Verfassung wider. Hermann von Mangoldt, einer der Väter des Grundgesetzes, war Vorsitzender des Ausschusses für Grundsatzfragen des Parlamentarischen Rates. Er selbst vertrat jedoch ein rassistisches Weltbild. So veröffentlichte der Antisemit und Nationalsozialist Mangoldt 1939 die rechtsvergleichende Schrift „Rassenrecht und Judentum“, in welcher er unter Bezug auf Hitlers „Mein Kampf“ die rechtlichen Grundlagen der Nürnberger Gesetze mit den Verfassungen der angelsächsischen Länder verglich.\n\nDie Diskussion um die Grundsatzfragen im Parlamentarischen Rat, an der sich Mangoldt, aber auch die anderen Berichterstatterinnen und Berichterstatter beteiligten, basierte oftmals auf rassistischen Ideologien. Ja, auch einige Väter und Mütter unseres Grundgesetzes haben selbst ein rassistisches Weltbild gehabt. In den Protokollen des Parlamentarischen Rates zeigt sich, dass die Berichterstatter selber beispielsweise das N-Wort verwendeten. Aber auch der vorhandene Antiziganismus wird erschreckend deutlich, wenn wörtlich von „asozialen Personen“ gesprochen wird und Sinti und Roma als „Plage“ bezeichnet werden. Ja, das kann man alles nachlesen.\n\nDie Initiative Schwarze Menschen in Deutschland stellt bereits seit vielen Jahren die Forderung auf, einen wirksamen Schutz vor Diskriminierung zu verankern. Dabei darf man sich nicht auf einen Begriff berufen, den rassistische Ideologien selbst hervorgebracht haben; denn das Grundgesetz sollte eigentlich einen Gegenentwurf zum nationalsozialistischen Regime darstellen. Das hat das Bundesverfassungsgericht in seinem Wunsiedel-Beschluss 2009 ausdrücklich entschieden. Umso wichtiger ist es, dass dieses Urteil Verfassungswirklichkeit wird.\n\n({0})\n\nEinige Mitgliedstaaten der EU haben bereits im Zuge der Umsetzung der Antirassismusrichtlinie den Begriff „Rasse“ aus ihren nationalen Gesetzen verbannt. Wir als Linksfraktion haben bereits 2010 gefordert, den Begriff „Rasse“ im Grundgesetz zu ersetzen. Einige Bundesländer haben ebenfalls ihre Landesverfassungen reformiert oder sind gerade noch dabei.\n\nDem Wortlaut „rassistisch“, den wir als Linksfraktion einfügen wollen, wohnt bereits eine Verurteilung von Rassismus inne. Dieses Bekenntnis sind wir in erster Linie den Opfern von Rassismus, aber auch unserer gesamten Gesellschaft schuldig. Struktureller und institutioneller Rassismus sind nach wie vor ein großes Problem in Deutschland, nicht erst seit dem rassistischen Mord an George Floyd. Aber die Reaktion auf seine Tötung hat das gesellschaftliche Problem aufgezeigt, indem sich Hunderttausende den Protesten der Black-Lives-Matter-Demos angeschlossen haben.\n\nFür uns ist es wichtig, dass sich das Recht klar schützend vor die Menschen stellt, die rassistische Diskriminierung tagtäglich erfahren. Erst vor knapp drei Wochen hat das Bundesverfassungsgericht in einer Entscheidung den Rassenbegriff in Anführungszeichen gesetzt. Das Bundesverfassungsgericht distanziert sich also selber von dem Begriff. Gleichzeitig wird deutlich, dass die Auslegung des Begriffs immer über die Notlösung einer Distanzierung von dem Begriff erfolgen muss, um den Diskriminierungsschutz herzuleiten. Es bleibt abzuwarten, welche Auswirkungen diese Entscheidung des obersten deutschen Gerichts haben wird.\n\nInsgesamt besteht in der juristischen Literatur zwar Konsens darüber, dass es Rassismus gibt, aber kein Konsens darüber, dass es keine Rassen gibt. Das wird deutlich, wenn man beispielsweise einen Blick in die juristischen Kommentare wirft. Diese werden für die Auslegung und Deutung des Begriffs herangezogen. Nicht einmal dort wird von vielen Fachleuten verstanden, dass es keine Menschenrassen gibt. Teilweise finden sich sogar Rechtfertigungen des Rassenbegriffs in juristischen Werken wieder. Solche Kommentare würden infolge der Grundrechtsänderung entfallen, und alle Juristinnen und Juristen müssten sich mit dem Verbot rassistischer Diskriminierung auseinandersetzen. Das ist auch notwendig.\n\n({1})\n\nDass der Diskriminierungsschutz, den wir jetzt haben, nicht ausreicht, ist klar. Zahlreiche Organisationen und auch die Antidiskriminierungsstelle verzeichnen einen drastischen Anstieg rassistischer Diskriminierung. In Gesprächen mit Wissenschaftlern, Engagierten und Betroffenen wurde die Ersetzung des Begriffs „Rasse“ im Grundgesetz teilweise als ein Vortäuschen von Diskriminierungsschutz gewertet. Damit diese Verfassungsänderung nicht nur zu einer Alibihandlung verkommt, fordern wir als Linksfraktion, eine zusätzliche Schutz- und Förderklausel im Grundgesetz zu verankern. Mit der Einfügung der Schutzklausel wird ein Gebot zum Schutz vor allen in Artikel 3 Absatz 3 GG genannten Diskriminierungsformen aufgestellt.\n\nDie Grundgesetzänderung wird nur einer von vielen nötigen Schritten sein, bis wir insgesamt mehr Diskriminierungsschutz erreichen. Dennoch ist das ein wichtiger Schritt. Unsere Verfassung soll alle Menschen in diesem Land wirksam vor Ungleichbehandlung schützen, ohne selbst einen diskriminierenden Charakter zu haben.\n\n({2})\n\nZum Maßnahmenkatalog des Kabinettsausschusses kann ich nur sagen, dass wir viele Maßnahmen unterstützen. Für uns ist jedoch wichtig, dass die Maßnahmen dauerhaft finanziert werden, und vor allem, dass die Evaluation gemeinsam mit der Zivilgesellschaft gestaltet wird.\n\nVielen Dank.\n\n({3})"
