id,firstname,lastname,faction,position,date, url,speech
"1005734","Gökay","Akbulut","DIE LINKE.","Member of Parliament","2018-04-19T00:00:00.000Z","https://dip21.bundestag.de/dip21/btp/19/19026.pdf","\n\nSehr geehrter Herr Präsident! Liebe Kolleginnen und Kollegen! Wir debattieren hier über einen Gesetzentwurf von Bündnis 90/Die Grünen zur Änderung des Asylgesetzes. Konkret soll das Rechtsmittelsystem in Asylverfahren reformiert werden, indem die Zulassung der Berufung durch das Verwaltungsgericht und der Beschwerdemöglichkeiten im Verfahren des vorläufigen Rechtsschutzes eingeführt werden. Dadurch soll den Verwaltungsgerichten eine Klärung offener Rechtsfragen ermöglicht werden.\n\nLiebe Kolleginnen und Kollegen der Fraktion Bündnis 90/Die Grünen, Die Linke begrüßt ausdrücklich die Forderung, dass die Asylverfahren beschleunigt und so den Verfahren nach dem allgemeinen Verwaltungsrecht wieder ein Stück weit angeglichen werden sollen.\n\n({0})\n\nDerzeit belasten die gravierenden Mängel in der Entscheidungspraxis des BAMF nicht nur Asylsuchende, die über Monate und Jahre hinweg in Unsicherheit leben, sondern sie überfordern auch die Verwaltungsgerichte. Die Verwaltungsgerichtsbarkeit verzeichnet seit geraumer Zeit hohe Eingänge von Asylverfahren. Es gibt einen Höchststand bei den anhängigen Gerichtsverfahren im Asylbereich. 2017 gab es 328 382 Klagen gegen Asylbescheide. Das ist fast eine Verdoppelung gegenüber dem Vorjahr. Gegen 91,3 Prozent aller ablehnenden Bescheide des BAMF wurde im Jahr 2017 geklagt. Wegen eines nur subsidiären Schutzstatus waren Ende 2017 noch 66 247 Klagen anhängig, sogenannte Upgrade-Klagen. Die Erfolgsquote der Klagenden in erster Instanz lag bei inhaltlichen Asylentscheidungen bei 59,6 Prozent. Bei Syrerinnen und Syrern war sie sogar noch höher. Meine Damen und Herren, es kann nicht sein, dass die Hauptaufgabe der Gerichte darin besteht, ständig die falschen Entscheidungen des BAMF zu kassieren.\n\n({1})\n\nDie Linke setzt sich entschieden dafür ein, dass die Entscheidungspraxis des BAMF auf den Prüfstand gestellt wird. Wichtig ist im Ergebnis, dass Geflüchtete in schnelleren und fairen Verfahren eine richtige Entscheidung erhalten.\n\nDurch die erweiterte Möglichkeit der Zulassung von Rechtsmitteln geht der Gesetzentwurf der Grünen in die richtige Richtung. Das Asylgesetz sieht derzeit noch einen äußerst beschränkten Rechtsmittelzug vor. Anders als im allgemeinen Verwaltungsprozess kann das Verwaltungsgericht weder in Hauptsacheverfahren die Berufung noch in Verfahren des einstweiligen Rechtsschutzes die Beschwerde zulassen. Dies hat zu einer nicht mehr hinnehmbaren Uneinheitlichkeit der Rechtsprechung geführt. Gleich gelagerte Fälle werden unterschiedlich entschieden und sorgen für Rechtsunsicherheit. Die Linke befürwortet ausdrücklich, dass durch einheitlichere Entscheidungen mehr Rechtssicherheit für Geflüchtete entsteht.\n\n({2})\n\nIn der bisherigen Uneinheitlichkeit der Entscheidungen sieht Die Linke eine nicht hinnehmbare Ungleichbehandlung von Schutzsuchenden. Dies darf nicht zum Regelfall werden.\n\n({3})\n\nIn diesem Zusammenhang möchte ich noch einmal ausdrücklich darauf hinweisen, dass der Gesetzentwurf der Grünen das Problem der fehlerhaften Entscheidungen des Bundesamtes für Migration und Flüchtlinge, welche wir als das Hauptproblem ansehen, nicht beheben wird.\n\n({4})\n\nDie wirksamste Entlastung der Gerichte würde immer noch darin bestehen, dass das BAMF endlich sorgfältige Asylprüfungen durchführen und gut begründete Bescheide erstellen würde. Das BAMF sollte bei Herkunftsländern mit einer Vielzahl von gerichtlichen Aufhebungen – das betrifft insbesondere Syrien und Afghanistan – negative Bescheide von sich aus überprüfen und gegebenenfalls korrigieren.\n\n({5})\n\nDen Zugang zu einem zügigen Verfahren zu ermöglichen, in welchem in guter Qualität über das Begehren der Schutzsuchenden entschieden wird, liegt in der Verantwortung des Staates. Das Recht der Schutzsuchenden auf ein faires Verfahren muss hierbei maßgebend sein.\n\n({6})\n\nDie Linke unterstützt deshalb den Gesetzentwurf, sieht aber noch weiteren Handlungsbedarf. Es muss umgehend flächendeckend in ganz Deutschland eine gute, frühzeitige und dabei kostenlose Rechtsberatung für alle Schutzsuchenden geben. Wir werden auch weiterhin solidarisch sein und die Rechte der Geflüchteten stärken.\n\nVielen Dank für Ihre Aufmerksamkeit.\n\n({7})"
"1008958","Gökay","Akbulut","DIE LINKE.","Member of Parliament","2018-06-14T00:00:00.000Z","https://dip21.bundestag.de/dip21/btp/19/19039.pdf","\n\nSehr geehrter Herr Präsident! Sehr geehrte Kolleginnen und Kollegen! In einem Urteil des Bundesverfassungsgerichtes aus dem Jahr 2009 heißt es:\n\nEs ist verfassungsrechtlich nicht begründbar, aus dem besonderen Schutz der Ehe abzuleiten, dass andere Lebensgemeinschaften im Abstand zur Ehe auszugestalten und mit geringeren Rechten zu versehen sind.\n\nMeine Damen und Herren, der Deutsche Bundestag hat nach diesem Urteil des Bundesverfassungsgerichtes ganze acht Jahre gebraucht, um das Recht auf Eheschließung für Personen gleichen Geschlechts möglich zu machen und somit die Ehe für alle endlich auf den Weg zu bringen.\n\n({0})\n\nViel zu lange haben die Vertreterinnen und Vertreter konservativer Vorstellungen – so wie auch heute – mit sich selber gerungen,\n\n({1})\n\nbis Lesben und Schwulen die gleichen Rechte wie allen anderen Menschen zugesprochen wurden.\n\nDer Gesetzentwurf der Fraktion der Grünen ist ein notwendiger Folgeschritt, um das möglich zu machen, was der Bundestag ohnehin vergangenes Jahr beschlossen hat. Die Angleichung des Abstammungsrechtes ist dringend notwendig.\n\n({2})\n\nDie Anzahl der Regenbogenfamilien und ihrer Kinder steigt in Deutschland. Unterschiedliche Familienkon­stellationen, wie Co-Parenting, erfordern eine rechtliche Öffnung und Veränderungen, die wir als Linke fordern und unterstützen.\n\nEs kann nicht sein, dass in einer lesbischen Ehe die Partnerin nicht als zweites Elternteil rechtlich anerkannt wird.\n\n({3})\n\nBei heterosexuellen Ehen ist der Mann automatisch der zweite rechtliche Elternteil des Kindes, unabhängig davon, ob er der biologische Vater ist oder nicht. Bei gleichgeschlechtlichen Ehen müssen sich Elternteil und Kind mit einem komplizierten und langjährigen Adoptivverfahren auseinandersetzen.\n\nWir stimmen hier den Grünen zu, die eine Diskriminierung der betroffenen Kinder und Eltern sehen. Ausgehend vom Wohl und Bedürfnis der Kinder wollen wir das System der Wahlverwandtschaft stärken.\n\n({4})\n\nKinder sollen in behüteten Verhältnissen aufwachsen. Insofern haben Sie bei diesem Anliegen unsere Unterstützung, liebe Kolleginnen und Kollegen von den Grünen.\n\n({5})\n\nDie Gleichstellung ist damit allerdings nicht getan. Wir müssen einen Schritt weitergehen und die Privilegien der Ehe abschaffen. Nur so können wir tatsächlich die Nichtdiskriminierung von allen anderen Lebenspartnerschaften möglich machen.\n\n({6})\n\nMit Steuermodellen wie dem Ehegattensplitting werden nicht nur rückwärtsgewandte Rollenverteilungen in der Familie gefördert, es werden auch wirtschaftliche Nachteile für Lebenspartnerschaften manifestiert, die sich bewusst gegen das Modell der Ehe entscheiden. Die Ehe jedoch darf keine Privilegien gegenüber anderen Formen der Partnerschaften enthalten.\n\n({7})\n\nWir fordern deshalb die Abschaffung des Ehegattensplittings und die rechtliche Gleichstellung der vielfältigen Formen der Lebenspartnerschaften, die nun mal Realität in unserer Gesellschaft sind.\n\n({8})\n\nMit der Einführung der Ehe für alle ist das Problem der Ungleichbehandlung in diesem Land noch lange nicht gelöst. Dieses werden wir vermutlich nicht alleine mit Gesetzen lösen können. Es braucht einen Prozess des Umdenkens in der Gesellschaft, aber auch in der Politik. Alle Lebens- und Liebensformen sind gleich viel wert und erfordern eine Gleichstellung und Gleichbehandlung vor dem Gesetz.\n\n({9})\n\nWir als Linke unterstützen weiterhin die Forderungen der Regenbogenfamilien und ihrer Kinder.\n\nVielen Dank.\n\n({10})"
"1009072","Gökay","Akbulut","DIE LINKE.","Member of Parliament","2018-06-15T00:00:00.000Z","https://dip21.bundestag.de/dip21/btp/19/19040.pdf","\n\nSehr geehrte Frau Präsidentin! Liebe Kolleginnen und Kollegen! Wir sollen heute in der Sache über den Familiennachzug zu subsidiär Schutzberechtigten entscheiden. Jetzt soll die Diskussion darüber nicht mehr sachlich geführt werden. Die FDP und die AfD instrumentalisieren die heutige Debatte, um über rechtswidrige Praxen an der deutschen Grenze zu diskutieren.\n\n({0})\n\nWir als Linke sagen ganz deutlich: Eine Zurückweisung an der Grenze ohne ein rechtsstaatliches Verfahren ist ein Verstoß gegen verbindliches Recht.\n\n({1})\n\nJetzt möchte ich zu der eigentlichen Debatte kommen. Heute wollen die Koalitionsfraktionen den Rechtsanspruch auf Familiennachzug zu subsidiär Schutzberechtigten auf Dauer abschaffen. Gerade einmal bis zu 1 000 Angehörige pro Monat sollen künftig zu ihrer Familie nachziehen können. Aber ob und wann das der Fall sein wird, weiß keiner. Das ist für die Betroffenen wirklich unerträglich.\n\n({2})"
"1009074","Gökay","Akbulut","DIE LINKE.","Member of Parliament","2018-06-15T00:00:00.000Z","https://dip21.bundestag.de/dip21/btp/19/19040.pdf","\n\nNein, das möchte ich nicht.\n\n({0})\n\nSchwer erträglich ist auch das parlamentarische Schnellverfahren, in dem das Ganze hier durchgezogen werden soll. Ich kann Ihnen sagen: Die von dieser Regelung betroffenen Menschen können es kaum fassen, wie schnell und bedenkenlos heute hier über ihr Schicksal entschieden wird. Ich möchte Sie an dieser Stelle erinnern: Es geht hier um Menschen, die Schwerstes erlebt und durchgemacht haben.\n\n({1})\n\nSchon seit Jahren sind diese Menschen zwangsweise von ihren Vätern, Müttern, Kindern und Geschwistern getrennt. Die Koalition will diese Leidenszeit einfach um weitere Jahre verlängern. Nehmen Sie künftig bitte die Worte „christlich“ und „Familie“ einfach nicht mehr in den Mund.\n\n({2})\n\nIn der Anhörung des Innenausschusses am vergangenen Montag haben nahezu alle Sachverständigen deutliche Kritik an dem Gesetzentwurf geäußert. Auch der Bundesrat hat konkrete Einwände und Forderungen aufgestellt. Die Koalition aber peitscht hier den Gesetzentwurf ohne jede Berücksichtigung dieser fachlichen Einwände im Eilverfahren durch.\n\nNach unserer Auffassung – das entspricht der Auffassung vieler Sachverständiger, fachkundiger Verbände, der Kirchen, des Deutschen Instituts für Menschenrechte usw. – verstößt der Gesetzentwurf der Koalition gegen das Recht auf Familie, wie es im Grundgesetz und in der Europäischen Menschenrechtskonvention verankert ist.\n\n({3})\n\nAuch wenn sich daraus kein direktes Recht auf Einreise zur Familienzusammenführung ableiten lässt: Unter bestimmten Bedingungen gibt es eben doch eine Verpflichtung des Staates, die Familieneinheit auch hier in Deutschland zu ermöglichen.\n\nSie nehmen eine Ungleichbehandlung der GFK-Flüchtlinge und der subsidiär Schutzberechtigten vor, die sich sachlich und menschlich einfach nicht begründen lässt. Beide gelten nach nationalem und EU-Recht gleichermaßen als international Schutzberechtigte. Beide Gruppen sind in gleicher Weise schutzbedürftig. Das sehen Sie doch an den syrischen Flüchtlingen. Unabhängig davon, welchen Status sie bekommen haben: Eine Rückkehr in den nächsten Jahren ist diesen geschundenen Menschen nicht möglich. Deshalb fordern wir mit unserem Gesetzentwurf: Das Recht auf Familienleben für international Schutzberechtigte muss wieder uneingeschränkt gelten.\n\n({4})\n\nIn der Anhörung der Sachverständigen am Montag ist deutlich geworden, dass bislang völlig unklar ist, wer künftig in welcher Reihenfolge kommen darf. Die praktische Umsetzung der Kontingentregelung droht administrativ an die Wand zu fahren. Das formulierte der Leiter der Berliner Ausländerbehörde.\n\nIch kann Ihnen sagen, zu welchem Ergebnis das Ganze führen wird: Die Behörden werden mit der Prüfung der Anträge erneut überfordert sein. Sie werden es aus bürokratischen Gründen nicht schaffen, 1 000 Visa pro Monat zu erstellen. Meine Damen und Herren, das ist untragbar und auch unverantwortlich.\n\n({5})\n\nDas Mindeste wäre gewesen, dieses Gesetz in seiner Wirkung zu befristen und die Auswirkungen der Neuregelung erst einmal gründlich zu evaluieren. Nicht einmal das haben Sie beschlossen. Es ist einfach zum Fremdschämen.\n\n({6})\n\nFür uns als Linke gibt es nur eine humanitäre Lösung, die auch meine Kollegin Ulla Jelpke vergangene Woche schon angesprochen hat: Jeder Mensch hat das Recht auf seine Familie,\n\n({7})\n\nund das muss auch für alle Flüchtlingsgruppen gelten.\n\nVielen Dank für Ihre Aufmerksamkeit.\n\n({8})"
"1010823","Gökay","Akbulut","DIE LINKE.","Member of Parliament","2018-07-05T00:00:00.000Z","https://dip21.bundestag.de/dip21/btp/19/19046.pdf","\n\nSehr geehrter Herr Präsident! Liebe Kolleginnen und Kollegen! Die Bundesjustizministerin Barley hatte zuletzt im Mai, als der Haushaltsentwurf hier debattiert wurde, mit den Worten: „Die Demokratie, der Rechtsschutz der Bürger und der Verbraucherschutz sollten gestärkt werden“, für ihren Pakt für den Rechtsstaat geworben. Es stellt sich nun die Frage: Was bleibt von dem Pakt für den Rechtsstaat übrig? Nicht viel. Das zeigt sich unter anderem am praktischen Beispiel der Musterfeststellungsklage, die die Regierungsparteien im Eilverfahren durch das Parlament peitschten, die aber wie vieles andere auch viel zu kurz greift, darüber hinaus auch noch verbraucherunfreundlich ist und hauptsächlich den Konzernen bei betrügerischen Geschäftspraktiken hilft.\n\n({0})\n\nAußerdem geht es um die Stärkung der Demokratie. Die Demokratie zu stärken, heißt auch, die Menschen zu unterstützen, die Opfer von Demokratiefeinden geworden sind. Dazu gehören die sogenannten Härteleistungen, die aus dem Haushalt des Bundesministeriums der Justiz und für Verbraucherschutz an die Opfer von extremistischen Übergriffen gezahlt werden können. Der Fonds diente bis vor ein paar Jahren ausschließlich Opfern von rechter Gewalt. Meine Damen und Herren, allein bis Mitte Mai 2018 wurden schon über 450 000 Euro an Opfer rechtsextremistischer Taten gezahlt, bei sogenannten linksextremistischen Fällen kein einziger Cent. 93 Prozent der Entschädigungen gingen an Opfer rechter Gewalt. Ähnliches spiegelt sich in der Auswertung der politisch motivierten Taten wider. Das zeigt insbesondere eines: Angriffe auf unsere Demokratie und auf den Rechtsstaat kommen von rechts.\n\n({1})\n\nDie von der Bundesregierung internalisierte und gepushte Extremismusdoktrin ist nicht mehr als eine eindimensionale Konstruktion, eine Gleichsetzung von Rechts- und Linksextremismus und hilft hier einfach nicht. Die Bundesregierung muss sich entschiedener gegen die Angreifer auf die Demokratie einsetzen. Ein Fonds für Härteleistungen allein reicht da nicht aus.\n\nMeine Damen und Herren, wir hatten diese Woche ein Fachgespräch zum Thema „Angriffe auf Demokratie und Menschenwürde“ hier im Bundestag. Die Referentinnen von anerkannten Stiftungen, die mit öffentlichen Mitteln finanziert werden und sich vehement für die demokratischen Ziele einsetzen, haben uns berichtet, dass sie regelmäßig Morddrohungen erhalten. Genau das zeigt: Für den Erhalt der Demokratie muss man mehr tun, als nur einen Pakt für den Rechtsstaat zu beschließen, der das ganze Problem nicht angeht. Vielmehr muss man sich entschieden gegen Rassisten, Faschisten und Antisemiten einsetzen, und das auch hier im Parlament.\n\n({2})\n\nDer Haushaltsentwurf sieht ja auch eine Aufstockung der Mittel des Generalbundesanwalts vor. Das begrüßen wir natürlich, weil die Kosten von Großverfahren wie denen des NSU-Verfahrens für die Länder kompensiert werden sollen. Dort wird nächste Woche, voraussichtlich am 11. Juli, das Urteil fallen. Zwar werden vom Gericht einige wenige Täterinnen verurteilt werden; aber das komplette Netzwerk des NSU mit seinen nationalen und internationalen Verknüpfungen besteht weiterhin. Anders als von Bundeskanzlerin Angela Merkel bei Bekanntwerden der Taten des NSU versprochen, wurde hier nicht schonungslos und lückenlos aufgeklärt. Komplexe Nazinetzwerke müssen gesamtgesellschaftlich und auch politisch angegriffen werden.\n\n({3})\n\nEin weiterer Aspekt des Justizetats ist der Stellenausbau auf Bundesebene, den wir als Linke begrüßen, weil er mehr Entlastung bringt. Ein Stellenausbau allein reicht aber nicht. Die Gleichstellungsstatistik des Bundesverwaltungsgerichtes zeigt, dass von insgesamt 44 Richterinnenstellen nur 13 mit Frauen besetzt sind. Das entspricht gerade einmal 29 Prozent. Beim Bundesgerichtshof in Karlsruhe und Leipzig sieht es ähnlich aus. Personen, die einen divers-kulturellen Hintergrund haben, lassen sich schon gar nicht in solchen Ämtern finden. Dabei sollte die Bundesjustiz mit gutem Beispiel vorangehen und verbindliche Gleichstellungsmaßnahmen sowie eine interkulturelle Öffnung auf Bundesebene vorantreiben.\n\nVielen Dank für Ihre Aufmerksamkeit.\n\n({4})"
"1012293","Gökay","Akbulut","DIE LINKE.","Member of Parliament","2018-09-27T00:00:00.000Z","https://dip21.bundestag.de/dip21/btp/19/19052.pdf","\n\nSehr geehrter Herr Präsident! Liebe Kolleginnen und Kollegen! Mit dem Gesetzentwurf der Bundesregierung soll eine neue Mitwirkungspflicht von Geflüchteten im Widerrufsverfahren eingeführt werden.\n\n({0})\n\nSchon wieder hat die Bundesregierung sich eine neue Schikane\n\n({1})\n\nund bürokratische Hürden für Geflüchtete ausgedacht.\n\nBei sogenannten Widerrufsprüfungen, die im Übrigen EU-weit nur in Deutschland und in Österreich existieren, wird der Schutzstatus von bereits anerkannten Flüchtlingen anlasslos erneut überprüft. Das bindet enorme Arbeitskapazitäten im BAMF und führt in der Regel zu nichts –\n\n({2})\n\naußer zur Verunsicherung der betroffenen Geflüchteten und ihrer Familien.\n\nIch will Ihnen das Ganze mal anhand einiger Zahlen erläutern. Bei 43 000 Entscheidungen in Widerrufsverfahren im ersten Halbjahr 2018 wurde in 99,3 Prozent der Fälle der Schutzstatus bestätigt. Ganz ähnlich ist die bisherige Bilanz bei den vorgezogenen Widerrufsprüfungen, die in Reaktion auf den Skandal um den rechtsextremen Soldaten Franco A., der sich als Flüchtling ausgab, eingeleitet wurden. In nur 1,2 Prozent der bislang überprüften 11 000 Anerkennungsbescheide gab es einen Widerruf oder eine Rücknahme. Wie viele davon anschließend einer gerichtlichen Überprüfung standhielten, ist nicht bekannt.\n\n({3})\n\nAnstatt mit diesem Unsinn Schluss zu machen, will die Bundesregierung die Überprüfung sogar noch ausweiten. Das grenzt doch schon an Bösartigkeit.\n\n({4})\n\nIn ihrem Gesetzentwurf kündigt die Bundesregierung für dieses und das folgende Jahr jeweils 250 000 Widerrufsprüfungen an.\n\n({5})\n\nNeu ist, dass Flüchtlinge künftig zur sogenannten Mitwirkung verpflichtet werden. Wer nicht mitwirkt, soll bestraft werden, bis hin zur Aberkennung des Schutzstatus.\n\n({6})\n\nBedenkt man, dass die allermeisten Verfahren den Schutzstatus erneut bestätigen, ist das doch reine Schikane für die Betroffenen.\n\n({7})\n\nZur Begründung stellt die Bundesregierung die falsche Behauptung auf, viele Geflüchtete hätten in den Jahren 2015 und 2016 zu Unrecht einen Schutzstatus bekommen. Dazu hat der Deutsche Anwaltverein in einer Pressemitteilung vom 7. August treffend erklärt, der Gesetzentwurf stütze sich auf einen – ich zitiere – „gefühlten Rechtsmissbrauch“, der in keiner Weise belegbar ist. Auf Grundlage einer gefühlten Wahrheit darf aber keine Politik gemacht werden,\n\n({8})\n\nschon gar nicht, wenn damit die Rechte von Asylsuchenden weiter beschnitten werden sollen.\n\n({9})\n\nWir alle haben doch gerade beim Fall BAMF Bremen gesehen, wie sich ein angeblicher Skandal, der wochenlang hochgekocht wurde, hinterher als schamlose Kampagne zur weiteren Demontage des Asylrechts entpuppte. Statt dumpfe Ressentiments von Flüchtlingsfeinden zu bedienen, sollten endlich die echten Probleme beim BAMF angegangen werden. Das Problem beim BAMF ist nicht die Anerkennung, sondern die Ablehnung von Asylanträgen. Während der erteilte Schutzstatus Überprüfungen fast immer standhält, erweisen sich jedoch Ablehnungen 10 000-fach als unrechtmäßig. 40 Prozent der inhaltlich geprüften BAMF-Bescheide haben die Verwaltungsgerichte im letzten Jahr einkassiert; das muss man sich doch mal vorstellen. Das ist doch der wahre Skandal.\n\n({10})\n\nDie anlasslosen Widerrufsprüfungen gehören unserer Meinung nach abgeschafft. Stattdessen gilt es, endlich die Qualität der Entscheidungen im BAMF zu verbessern, und das Ganze im Sinne der Schutzsuchenden und nicht gegen sie.\n\nVielen Dank für Ihre Aufmerksamkeit.\n\n({11})"
"1013139","Gökay","Akbulut","DIE LINKE.","Member of Parliament","2018-10-11T00:00:00.000Z","https://dip21.bundestag.de/dip21/btp/19/19055.pdf","\n\nSehr geehrte Frau Präsidentin! Liebe Kolleginnen und Kollegen! Die FDP möchte mit ihrem Antrag „Deutschland braucht ein Einwanderungsrecht aus einem Guss“ die Regierungsparteien im Grunde genommen von rechts überholen.\n\n({0})\n\nAnders kann man diesen Antrag nicht bewerten.\n\n({1})\n\nSie fordert unter anderem die Einführung eines weiteren Schutzstatus, der vorübergehend den humanitären Schutz für Kriegs- und Bürgerkriegsflüchtlinge gewährleisten soll. Der Status soll unbürokratisch und nach Identitätsfeststellung innerhalb von drei Monaten erteilt werden. Darunter würde nach derzeitigem Stand ein Großteil der Schutzsuchenden fallen. Damit würde das derzeitige Asylverfahren abgewertet, indem Massenentscheidungen ohne Einzelfallprüfungen ergehen.\n\nEs gibt bereits den subsidiären Schutz. Jetzt noch einen weiteren Schutzstatus einzuführen, würde nicht mehr Rechtssicherheit, sondern nur mehr Unsicherheit schaffen.\n\n({2})\n\nStatt weitere Aufenthaltsformen einzuführen, fordern wir ein klares Bekenntnis zu der Verpflichtung, schutzsuchenden Menschen ihre Rechte zu gewähren, wie zum Beispiel das Recht auf uneingeschränkte Familienzusammenführung.\n\n({3})\n\nAußerdem spricht sich die FDP in ihrem Antrag für zentrale Unterbringungseinrichtungen aus. Das klingt für mich ganz klar nach dem bekannten Konzept der AnKER-Zentren; das lehnen wir ganz klar ab.\n\n({4})\n\nWir als Linke sind für eine dezentrale Unterbringung an Orten, an denen die Menschen soziale oder familiäre Anknüpfungspunkte haben.\n\n({5})\n\nDie FDP zieht sogar Zurückweisungen an der EU-Binnengrenze in Betracht – keine Freizügigkeit für die Menschen innerhalb der EU, aber grenzenloser Waren- und Kapitalhandel. Es ist nicht nur europarechtswidrig, sondern auch zum Fremdschämen, diese Forderung hier erneut aufzustellen, und das von einer Partei, die Rechtsstaatlichkeit einmal sehr hoch gehalten hat.\n\n({6})\n\nLiebe Kolleginnen und Kollegen, es gibt verschiedene Formen der Zuwanderung nach Deutschland; darüber sind wir uns ja alle einig. Die FDP befasst sich in diesem Antrag auch mit dem Thema der Arbeitsmigration. Alle Vorschläge, die das Einwanderungsrecht betreffen, egal ob es das Eckpunktepapier der Bundesregierung ist oder dieser Antrag der FDP, haben eine Gemeinsamkeit: Sie folgen dem Gedanken einer Verwertungslogik, bei der es um die Nützlichkeit von Menschen geht. Dabei stehen die Interessen von Unternehmen und Wirtschaft im Vordergrund. Eine Gesellschaft braucht aber mehr als Menschen, die den Kapitalinteressen dienen. Sie braucht Vielfalt. Alle Menschen sollen im Leben die gleichen Möglichkeiten haben, wie zum Beispiel das Recht auf gute Bildung, den Zugang zum Gesundheitssystem und auch zu Arbeitsplätzen.\n\n({7})\n\nWir unterstützen die Schaffung von legalen Wegen und auch die Erleichterung der Einwanderung durch unbürokratischere Verfahren. Schon aus Artikel 1 der Allgemeinen Erklärung der Menschenrechte ergibt sich, dass alle Menschen frei und gleich an Würde und Rechten geboren sind. Mit den Gesetzen, über die wir hier diskutieren, gerät dieser Grundsatz aber immer weiter in den Hintergrund. Ich habe diese Woche mit der UN-Sonderbeauftragten für Internationale Migration, Louise Arbour, über den globalen Migrationspakt diskutiert. Dieser Pakt ist zwar kein verpflichtendes Instrument für die Mitgliedstaaten, aber es ist sicherlich richtig, dass die heutigen Fragen zur Migration ohne eine internationale Perspektive nicht gelöst werden können, eine Perspektive, die die Gründe für die Entscheidung, zu migrieren, auch global in Betracht zieht.\n\nWir brauchen kein weiteres Regelwerk, das die Interessen der Menschen, die es betrifft, nicht in Betracht zieht. Es ist im Grunde genommen der falsche Ansatz, ein Regelwerk zu schaffen, um die potenziellen Rechtsaußenwählerinnen und -wähler hier zu beruhigen. Wir müssen in die Zukunft schauen und uns die Frage stellen, in welcher Gesellschaft wir leben wollen. Ich setze mich für eine offene und solidarische Gesellschaft ein\n\n({8})\n\nund werde deshalb auch am Wochenende gemeinsam mit vielen Tausend Menschen hier in Berlin auf die Straße gehen und an der Demonstration unter dem Motto „#unteilbar – Für eine offene und solidarische Gesellschaft“ teilnehmen.\n\nVielen Dank.\n\n({9})"
